journal,year,title,authors,abstract,url
AEJ: Applied Economics,2022,Peer Effects in Product Adoption,"Michael Bailey, Drew Johnston, Theresa Kuchler, Johannes Stroebel and Arlene Wong","We use de-identified data from Facebook to study the nature of peer effects in the market for cell phones. To identify peer effects, we exploit variation in friends' new phone acquisitions resulting from random phone losses. A new phone purchase by a friend has a large and persistent effect on an individual's own demand for phones of the same brand. While peer effects increase the overall demand for phones, a friend's purchase of a particular phone brand can reduce an individual's own demand for phones from competing brands, in particular if they are running on a different operating system.",https://www.aeaweb.org/doi/10.1257/app.20200367
AEJ: Applied Economics,2022,Emotions and Risk Attitudes,Armando N. Meier,"Previous work has shown that preferences are not always stable across time, but surprisingly little is known about the reasons for this instability. I examine whether variation in people's emotions over time predicts changes in risk attitudes. Using a large-panel dataset, I identify happiness, anger, and fear as significant correlates of within-person changes in risk attitudes. Robustness checks indicate a limited role for alternative explanations. An event study around the death of a parent or child further confirms a large relationship between emotions and risk attitudes.",https://www.aeaweb.org/doi/10.1257/app.20200164
AEJ: Applied Economics,2022,Will Studying Economics Make You Rich? A Regression Discontinuity Analysis of the Returns to College Major,Zachary Bleemer and Aashish Mehta,"We investigate the wage return to studying economics by leveraging a policy that prevented students with low introductory grades from declaring a major. Students who barely met the grade point average threshold to major in economics earned $22,000 (46 percent) higher annual early-career wages than they would have with their second-choice majors. Access to the economics major shifts students' preferences toward business/finance careers, and about half of the wage return is explained by economics majors working in higher-paying industries. The causal return to majoring in economics is very similar to observational earnings differences in nationally representative data.",https://www.aeaweb.org/doi/10.1257/app.20200447
AEJ: Applied Economics,2022,Political Fragmentation and Government Stability: Evidence from Local Governments in Spain,"Felipe Carozzi, Davide Cipullo and Luca Repetto","This paper studies how political fragmentation affects government stability. Using a regression discontinuity design, we show that each additional party with representation in the local parliament increases the probability that the incumbent government is unseated by 5 percentage points. The entry of an additional party affects stability by reducing the probability of a single-party majority and increasing the instability of governments when such a majority is not available. We interpret our results in light of a bargaining model of coalition formation featuring government instability.",https://www.aeaweb.org/doi/10.1257/app.20200128
AEJ: Applied Economics,2022,"Missing Women, Integration Costs, and Big Push Policies in the Saudi Labor Market","Conrad Miller, Jennifer Peck and Mehmet Seflek","In settings where social norms promote gender segregation, firms may find it costly to employ both men and women. These integration costs may hinder women's employment. We develop a methodology to test for the presence of fixed integration costs and estimate counterfactual women's employment at all-male firms where these costs bind. We apply our approach in Saudi Arabia and find that integration costs bind for the majority of firms. We show that Nitaqat, a gender-neutral quota program that incentivized the hiring of Saudi nationals at private sector firms, induced firms to integrate and dramatically increased Saudi women's employment.",https://www.aeaweb.org/doi/10.1257/app.20200220
AEJ: Applied Economics,2022,The Rising Return to Noncognitive Skill,"Per-Anders Edin, Peter Fredriksson, Martin Nybom and Björn Öckert","This paper uses administrative data from Sweden to document trends in the labor market returns to skills. Between 1992 and 2013, the economic return to noncognitive skill⁠—a psychologist-assessed measure of teamwork and leadership skill⁠—roughly doubled. The return to cognitive skill was relatively stable and decreased modestly during the 2000s, however. Among men with similar levels of education, the return to noncognitive skill is higher than the return to cognitive skill. The increasing return to noncognitive skill is driven by changes at the top of the wage distribution and by sorting into higher-paying occupations.",https://www.aeaweb.org/doi/10.1257/app.20190199
AEJ: Applied Economics,2022,LinkedIn(to) Job Opportunities: Experimental Evidence from Job Readiness Training,"Laurel Wheeler, Robert Garlick, Eric Johnson, Patrick Shaw and Marissa Gargano","Online professional networking platforms are widely used and may help workers to search for and obtain jobs. We run the first randomized evaluation of training work seekers to join and use one of the largest platforms, LinkedIn. Training increases the end-of-program employment rate by 10 percent (7 percentage points), and this effect persists for at least 12 months. The available employment, platform use, and job search data suggest that employment effects are explained by work seekers using the platform to acquire information about prospective employers and perhaps by work seekers accessing referrals and conveying information to prospective employers on the platform.",https://www.aeaweb.org/doi/10.1257/app.20200025
AEJ: Applied Economics,2022,Reexamining the Contribution of Public Health Efforts to the Decline in Urban Mortality,"D. Mark Anderson, Kerwin Kofi Charles and Daniel I. Rees","Using data on 25 major American cities for the period 1900⁠–⁠1940, we explore the effects of municipal-level public health efforts that were viewed as critical in the fight against foodborne and waterborne diseases. In addition to studying interventions such as treating sewage and setting bacteriological standards for milk, which have received little attention, we provide new evidence on the effects of water filtration and chlorination, extending the work of previous scholars. Although water filtration is associated with an 11⁠–⁠12 percent reduction in infant mortality, none of the other interventions under study appear to have contributed to the observed mortality declines.",https://www.aeaweb.org/doi/10.1257/app.20190034
AEJ: Applied Economics,2022,Reexamining the Contribution of Public Health Efforts to the Decline in Urban Mortality: Comment,David M. Cutler and Grant Miller,"We address points raised by Anderson, Charles, and Rees (2022), which comments on our prior work. After correcting unambiguous data mistakes, our revised estimates suggest that municipal water disinfection (filtration) explains 38 percent of the total mortality rate decline in our sample cities and years—a result not very different from our original estimate of 43 percent. However, effects on infant mortality rates are smaller than in our original analysis. Much of the difference between their analyses and ours is due to the coding of partial intervention years and to differences in population denominators, for which ideal data are difficult to find.",https://www.aeaweb.org/doi/10.1257/app.20190711
AEJ: Applied Economics,2022,Reexamining the Contribution of Public Health Efforts to the Decline in Urban Mortality: Reply,"D. Mark Anderson, Kerwin Kofi Charles and Daniel I. Rees","This rejoinder is written in response to the comment by Cutler and Miller (hereafter CM) on our paper, ""Reexamining the Contribution of Public Health Efforts to the Decline in Urban Mortality"" (Anderson, Charles, and Rees 2022). In their comment, CM acknowledge making unambiguous data transcription errors when constructing the infant mortality rates, assess the sensitivity of their filtration estimates to alternative intervention dates, and defend the population denominators they used to construct total mortality rates. In this rejoinder, we focus on the third issue, the population denominators.",https://www.aeaweb.org/doi/10.1257/app.20210230
AEJ: Applied Economics,2022,Temporary Stays and Persistent Gains: The Causal Effects of Foster Care,Max Gross and E. Jason Baron,"Six percent of children in the United States enter foster care by age 18. We estimate the effects of foster care on children's outcomes by exploiting the quasi-random assignment of child welfare investigators in Michigan. We find that foster care improved children's safety and educational outcomes. Gains emerged after children exited the foster system when most were reunified with their birth parents, suggesting that improvements made by their parents were an important mechanism. These results indicate that safely reducing the use of foster care, a goal of recent federal legislation, requires more effective in-home, prevention-focused efforts.",https://www.aeaweb.org/doi/10.1257/app.20200204
AEJ: Applied Economics,2022,Health Insurance Design Meets Saving Incentives: Consumer Responses to Complex Contracts,Adam Leive,"To lower health care costs, Health Savings Accounts (HSAs) offer tax incentives encouraging people to trade off current consumption against future consumption. This paper tests whether consumers use HSAs as self-insurance over the life cycle. Using administrative data from a large employer and a regression discontinuity design, I estimate the marginal propensity to consume from HSA assets is 0.85 and reject the neoclassical benchmark of 0. Comparisons with 401(k) saving show most employees do not treat HSA money as fungible with retirement savings. In this setting, HSAs did not reduce health spending and instead increased the share that was financed tax-free.",https://www.aeaweb.org/doi/10.1257/app.20200135
AEJ: Applied Economics,2022,"Recessions, Mortality, and Migration Bias: Evidence from the Lancashire Cotton Famine","Vellore Arthi, Brian Beach and W Hanlon","We examine the health effects of the Lancashire Cotton Famine, a sharp downturn in Britain's cotton textile manufacturing regions that was induced by the US Civil War. Migration was an important response to this downturn, but as we document, migration also introduces a number of empirical challenges, which we overcome by introducing a new methodological approach. Our results indicate that the recession increased mortality among households employed in the cotton textile industry. We also document localized spillover effects on households providing nontradable services in the areas affected by the recession.",https://www.aeaweb.org/doi/10.1257/app.20190131
AEJ: Applied Economics,2022,Formative Experiences and the Price of Gasoline,Christopher Severen and Arthur A.  van Benthem,"Formative experiences shape behavior for decades. We document a striking feature about those who came of driving age during the oil crises of the 1970s⁠—they drive less in the year 2000. The effect is not specific to these cohorts; price variation over time and across states indicates that gasoline price changes between ages 15–18 generally shift later-life travel behavior. Effects are not explained by recessions, income, or costly skill acquisition and are inconsistent with recency bias, mental plasticity, and standard habit-formation models. Instead, they likely reflect formation of preferences for driving or persistent changes in its perceived cost.",https://www.aeaweb.org/doi/10.1257/app.20200407
AEJ: Applied Economics,2022,Unemployment Insurance as a Worker Indiscipline Device? Evidence from Scanner Data,"Lester Lusher, Geoffrey Schnorr and Rebecca Taylor","We provide causal evidence of an ex ante moral hazard effect of unemployment insurance (UI) by matching plausibly exogenous changes in UI benefit duration across state-weeks during the Great Recession to high-frequency productivity measures from individual supermarket cashiers. Estimating models with date and cashier-register fixed effects, we identify a modest but statistically significant negative relationship between UI benefits and worker productivity. This effect is strongest for more experienced and less productive cashiers, for whom UI expansions are especially relevant. Additional analyses from the American Time Use Survey reveal a similar increase in shirking during periods with increased UI benefit durations.",https://www.aeaweb.org/doi/10.1257/app.20190007
AEJ: Applied Economics,2022,Mental Health Costs of Lockdowns: Evidence from Age-Specific Curfews in Turkey,"Onur Altindag, Bilge Erten and Pinar Keskin","Using a strict, age-specific lockdown order for adults aged 65 and older in Turkey, we examine the mental health consequences of an extended period of tight mobility restrictions on senior adults. Adopting a regression discontinuity design, we find that the curfew-induced decline in mobility substantially worsened mental health outcomes, including somatic and nonsomatic symptoms of mental distress (approximately 0.2 standard deviation). Exploring potential channels, we document an increase in social and physical isolation, with no evidence of robust changes in labor market outcomes or intrahousehold conflict for this subpopulation.",https://www.aeaweb.org/doi/10.1257/app.20200811
AEJ: Applied Economics,2022,Rational Habit Formation: Experimental Evidence from Handwashing in India,"Reshmaan Hussam, Atonu Rabbani, Giovanni Reggiani and Natalia Rigol","We test the predictions of the rational addiction model, reconceptualized as rational habit formation, in the context of handwashing in rural India. To track handwashing, we design soap dispensers with timed sensors. We test for rational habit formation by informing some households about a future change in the returns to daily handwashing. Monitoring and incentives raise handwashing contemporaneously, and effects persist well after they end. In addition, people are rational about this habit formation: when they anticipate future monitoring, they increase their current handwashing. Average child weight and height increase for all study arms given soap dispensers.",https://www.aeaweb.org/doi/10.1257/app.20190568
AEJ: Applied Economics,2022,The Long-Run Effects of Recessions on Education and Income,Bryan Stuart,"This paper examines the long-run effects of the 1980–1982 recession on education and income. Using confidential census data, I estimate difference-in-difference regressions that exploit variation across counties in recession severity and across cohorts in age at the time of the recession. For individuals age 0–10 in 1979, a 10 percent decrease in earnings per capita in their county of birth reduces four-year college degree attainment by 15 percent and earnings in adulthood by 5 percent. Simple calculations suggest that in aggregate, the 1980–1982 recession led to 1.3–2.8 million fewer college graduates and $66–$139 billion less earned income per year.",https://www.aeaweb.org/doi/10.1257/app.20180055
AEJ: Applied Economics,2022,Finally a Smoking Gun? Compensating Differentials and the Introduction of Smoking Bans,Daniel Wissmann,"Using the staggered introduction of smoking bans in the German hospitality industry over 2007–2008, I find a robust 2.4 percent decline in the daily earnings of workers in bars and restaurants associated with the most comprehensive smoking ban. This effect is unlikely to be driven by a decline in hospitality revenues or hours worked but is consistent with a simple model of compensating differentials.",https://www.aeaweb.org/doi/10.1257/app.20180077
AEJ: Applied Economics,2022,Can Information Reduce Ethnic Discrimination? Evidence from Airbnb,Morgane Laouenan and Roland Rathelot,"We use data from Airbnb to identify the mechanisms underlying discrimination against ethnic minority hosts. Within the same neighborhood, hosts from minority groups charge 3.2 percent less for comparable listings. Since ratings provide guests with increasingly rich information about a listing's quality, we can measure the contribution of statistical discrimination, building upon Altonji and Pierret (2001). We find that statistical discrimination can account for the whole ethnic price gap: ethnic gaps would disappear if all unobservables were revealed. Also, three-quarters (2.5 points) of the initial ethnic gap can be attributed to inaccurate beliefs of potential guests about hosts' average group quality.",https://www.aeaweb.org/doi/10.1257/app.20190188
AEJ: Applied Economics,2022,"Information Frictions, Internet, and the Relationship between Distance and Trade","Anders Akerman, Edwin Leuven and Magne Mogstad",We examine how the adoption of information communication technology affects bilateral trade. The context is a public program in Norway that rolled out broadband access points leading to plausibly exogenous variation in the availability and adoption of broadband by firms. We find that broadband makes trade patterns more sensitive to distance and economic size. These results are consistent with a model of trade with variable elasticity of demand. The model predicts that adoption of a technology that lowers information frictions enlarges the choice set of exporters and importers. This makes demand more elastic with respect to trade costs and thus distance.,https://www.aeaweb.org/doi/10.1257/app.20190589
AEJ: Applied Economics,2022,Subways and Urban Air Pollution,"Nicolas Gendron-Carrier, Marco Gonzalez-Navarro, Stefano Polloni and Matthew Turner","We investigate the effect of subway system openings on urban air pollution. On average, particulate concentrations are unchanged by subway openings. For cities with higher initial pollution levels, subway openings reduce particulates by 4 percent in the area surrounding a city center. The effect decays with distance to city center and persists over the longest time horizon that we can measure with our data, about four years. For highly polluted cities, we estimate that a new subway system provides an external mortality benefit of about $1 billion per year. For less polluted cities, the effect is indistinguishable from zero. Back of the envelope cost estimates suggest that reduced mortality due to lower air pollution offsets a substantial share of the construction costs of subways.",https://www.aeaweb.org/doi/10.1257/app.20180168
AEJ: Applied Economics,2022,Labor Market Returns to Vocational Secondary Education,Mikko Silliman and Hanna Virtanen,"We study labor market returns to vocational versus general secondary education using a regression discontinuity design created by the centralized admissions process in Finland. Admission to the vocational track increases initial annual income, and this benefit persists at least through the mid-thirties, and present discount value calculations suggest that it is unlikely that life cycle returns will turn negative through retirement. Moreover, admission to the vocational track does not increase the likelihood of working in jobs at risk of replacement by automation or offshoring. Consistent with comparative advantage, we observe larger returns for people who express a preference for vocational education.",https://www.aeaweb.org/doi/10.1257/app.20190782
AEJ: Applied Economics,2022,Does Patient Demand Contribute to the Overuse of Prescription Drugs?,"Carolina Lopez, Anja Sautmann and Simone Schaner","In an experiment in Mali, we tested whether patients pressure providers to prescribe unnecessary medical treatment. We varied patients' information about a discount for antimalarial tablets and measure demand for both tablets and costlier antimalarial injections. We find evidence of patient-driven demand: informing patients about the discount, instead of letting providers decide to share this information, increased discount use by 35 percent and overall malaria treatment by 10 percent. These marginal patients rarely had malaria, worsening the illness-treatment match. Providers did not use the information advantage to sell injections—their use fell in both information conditions.",https://www.aeaweb.org/doi/10.1257/app.20190722
AEJ: Applied Economics,2022,The Origins of Common Identity: Evidence from Alsace-Lorraine,Sirus Dehdari and Kai Gehring,"We study how more negative historical exposure to the actions of nation-states—like war, occupation, and repression—affects the formation of regional identity. The quasi-exogenous division of the French regions Alsace and Lorraine allows us to implement a geographical regression discontinuity design at the municipal level. Using measures of stated and revealed preferences, we find that more negative experiences with nation-states are associated with a stronger regional identity in the short, medium, and long run. This is linked to preferences for more regional decision-making. Establishing regional organizations seems to be a key mechanism to maintaining and strengthening regional identity.",https://www.aeaweb.org/doi/10.1257/app.20190772
AEJ: Applied Economics,2022,How Effective Are Monetary Incentives to Vote? Evidence from a Nationwide Policy,"Mariella Gonzales, Gianmarco León-Ciliotta and Luis Martinez","We study voters' response to marginal changes to the fine for electoral abstention in Peru, leveraging variation from a nationwide reform. A smaller fine has a robust, negative effect on voter turnout, partly through irregular changes in voter registration. However, representation is largely unaffected, as most of the lost votes are blank or invalid. We also show that the effect of an exemption from compulsory voting is substantially larger than that of a full fine reduction, suggesting that nonmonetary incentives are the main drivers behind the effectiveness of compulsory voting.",https://www.aeaweb.org/doi/10.1257/app.20200482
AEJ: Applied Economics,2022,Inversions in US Presidential Elections: 1836–2016,"Michael Geruso, Dean Spears and Ishaana Talesara","Inversions—in which the popular vote winner loses the election—have occurred in four US presidential races. We show that rather than being statistical flukes, inversions have been ex ante likely since the early 1800s. In elections yielding a popular vote margin within 1 point (one-eighth of presidential elections), about 40 percent will be inversions in expectation. We show this conditional probability is remarkably stable across historical periods—despite differences in which groups voted, which states existed, and which parties participated. Our findings imply that the United States has experienced so few inversions merely because there have been so few elections (and fewer close elections).",https://www.aeaweb.org/doi/10.1257/app.20200210
AEJ: Applied Economics,2022,The Political Impact of Immigration: Evidence from the United States,"Anna Maria Mayda, Giovanni Peri and Walter Steingress","This paper studies the impact of immigration to the United States on the vote share for the Republican Party using county-level data from 1990 to 2016. Our main contribution is to show that an increase in high-skilled immigrants decreases the share of Republican votes, while an inflow of low-skilled immigrants increases it. These effects are mainly due to the indirect impact on existing citizens' votes, and this is independent of the origin country and race of immigrants. We find that the political effect of immigration is heterogeneous across counties and depends on their skill level, public spending, and noneconomic characteristics.",https://www.aeaweb.org/doi/10.1257/app.20190081
