journal,year,title,authors,abstract,url
AEJ: Applied Economics,2022,Mortality Change among Less Educated Americans,"Paul Novosad, Charlie Rafkin and Sam Asher","Measurements of mortality change among less educated Americans can be biased because the least educated groups (e.g., dropouts) become smaller and more negatively selected over time. We show that mortality changes at constant education percentiles can be bounded with minimal assumptions. Middle-age mortality increases among non-Hispanic Whites from 1992 to 2018 are driven almost entirely by the bottom 10 percent of the education distribution. Drivers of mortality change differ substantially across groups. Deaths of despair explain most of the mortality change among young non-Hispanic Whites, but less among older Whites and non-Hispanic Blacks. Our bounds are applicable in many other contexts.",https://www.aeaweb.org/doi/10.1257/app.20190297
AEJ: Applied Economics,2022,Competition and Pass-Through: Evidence from Isolated Markets,Christos Genakos and Mario Pagliero,"We measure how pass-through varies with competition in isolated oligopolistic markets with captive consumers. Using daily pricing data from gas stations on small Greek islands, we study how unanticipated and exogenous changes in excise duties are passed through to consumers in markets with different numbers of retailers. We find that pass-through increases from 0.4 in monopoly markets to 1 in markets with four or more competitors and remains constant thereafter. The speed of price adjustment is about 60 percent higher in more competitive markets. Finally, we show that geographic market definitions based on measures of distance across sellers often result in significant overestimation of the pass-through.",https://www.aeaweb.org/doi/10.1257/app.20200863
AEJ: Applied Economics,2022,Using Individual-Level Randomized Treatment to Learn about Market Structure,Lorenzo Casaburi and Tristan Reed,Interference across competing firms in RCTs can be informative about market structure. An experiment that subsidizes a random subset of traders who buy cocoa from farmers in Sierra Leone illustrates this idea. Interpreting treatment-control differences in prices and quantities purchased from farmers through a model of Cournot competition reveals differentiation between traders is low. Combining this result with quasi-experimental variation in world prices shows that the number of traders competing is 50 percent higher than the number operating in a village. Own-price and cross-price supply elasticities are high. Farmers face a competitive market in this first stage of the value chain.,https://www.aeaweb.org/doi/10.1257/app.20200306
AEJ: Applied Economics,2022,Time to Repay or Time to Delay? The Effect of Having More Time before a Payday Loan Is Due,"Susan Carter, Kuan Liu, Paige Marta Skiba and Justin Sydnor","We examine the effect of state laws on minimum payday loan durations that give some borrowers an additional pay cycle to repay their initial loan with no other changes to contract terms. Neoclassical models predict this ""grace period"" would reduce borrowers' need for costly loan rollovers. However, in reality, borrowers' repayment behavior with grace periods is very similar to borrowers with shorter loans, merely pushed out a few weeks. Potential explanations include heuristic repayment decisions and naive present focus. A calibrated model suggests that present-focused borrowers get less than one-half of the benefit from a grace period that time-consistent borrowers would.",https://www.aeaweb.org/doi/10.1257/app.20180721
AEJ: Applied Economics,2022,The Round Trip Effect: Endogenous Transport Costs and International Trade,Woan Foong Wong,"Container ships travel between a fixed set of origins and destinations in round trips, inducing a negative correlation in their freight rates. I study the implications of this round trip effect on international trade and trade policy. I identify this effect and develop an instrument using it to estimate the impact of transport costs on trade. I simulate counterfactual import tariff increases in a quantitative model and quantify the importance of endogenizing transport costs with respect to this effect: an exogenous transport costs model predicts a trade balance improvement from protectionist policies, while the round trip model finds the opposite.",https://www.aeaweb.org/doi/10.1257/app.20190721
AEJ: Applied Economics,2022,Money and Politics: The Effects of Campaign Spending Limits on Political Entry and Competition,"Eric Avis, Claudio Ferraz, Frederico Finan and Carlos Varjão","This paper studies the effects of campaign spending limits on the political entry, selection, and behavior of local politicians in Brazil. We analyze a reform that limits campaign spending for mayoral elections. The limits were implemented with a discontinuity that we exploit for causal identification. We find that stricter limits reduce reelection rates and increase political competition by attracting more candidates who are also less wealthy and rely less on self-financing. Despite their effects on electoral outcomes, stricter limits did not lead to significant short-run improvements in policy outcomes, such as in education and health.",https://www.aeaweb.org/doi/10.1257/app.20200296
AEJ: Applied Economics,2022,Leave the Door Open? Prison Conditions and Recidivism,Giovanni Mastrobuoni and Daniele Terlizzese,We estimate the effect on recidivism of replacing time served in a common closed-cell prison with time served in an open-cell one. We deal with the endogenous assignment of inmates to different prison regimes using variation that is driven by nearby prisons' overcrowding. Switching regimes for a year reduces recidivism by around 6 percentage points. The effects are largest for inmates with low levels of education and are weak for violent and hardened criminals.,https://www.aeaweb.org/doi/10.1257/app.20190038
AEJ: Applied Economics,2022,The Health Effects of Prison,Randi Hjalmarsson and Matthew Lindquist,"This paper studies the health effects of Swedish prison reforms that held sentences constant but increased the share of time inmates had to serve. The increased time served did not harm post-release health and actually reduced mortality risk. We find especially large decreases in mortality for offenders not previously incarcerated, younger offenders, and those more attached to the labor market. Risk of suicide and circulatory death fell for inmates with mental health problems and older inmates, respectively. In-prison health care utilization and program participation increased with time served, suggesting health care treatment and services as the key mechanism for mortality declines.",https://www.aeaweb.org/doi/10.1257/app.20200615
AEJ: Applied Economics,2022,Pathways into Opioid Dependence: Evidence from Practice Variation in Emergency Departments,Sarah Eichmeyer and Jonathan Zhang,"We use practice variation across physicians to uncover the role of medical care in causing opioid dependence. Using health records of 2 million US veterans with emergency department visits, we find that quasi-random assignment to a top (versus bottom) decile prescribing provider significantly increases subsequent opioid use and misuse rates. Instrumental variable results show that opioid prescription receipt leads to a 20 percent increase in the probability of long-term prescription opioid use and sizable increases in the development of opioid use disorder and opioid overdose mortality. We find suggestive evidence of transition into illicit opioids due to prescription opioid exposure.",https://www.aeaweb.org/doi/10.1257/app.20210048
AEJ: Applied Economics,2022,"Capital Destruction and Economic Growth: The Effects of Sherman's March, 1850–1920","James Feigenbaum, James Lee and Filippo Mezzanotti","Using General Sherman's March through Georgia, South Carolina, and North Carolina during the Civil War, we study the effect of capital destruction on medium- and long-run local economic activity, and the role of financial markets in recovery. We show that the march's capital destruction led to a large contraction in agricultural investment, farming asset prices, and manufacturing activity compared to neighboring counties. Elements of the decline in agriculture persisted through 1920. Exploiting variation in local access to antebellum credit, we argue that the underdevelopment of financial markets played a role in weakening the recovery.",https://www.aeaweb.org/doi/10.1257/app.20200397
AEJ: Applied Economics,2022,The Impact of Privatization of State-Owned Enterprises on Workers,David Arnold,"While privatization of state-owned enterprises (SOEs) remains a popular policy tool in many countries, the impacts on workers are unclear. This paper studies the case of Brazil, which implemented a large privatization program in the 1990s. Following privatization, incumbent workers in privatized SOEs suffer a wage decline of roughly 25 percent relative to a matched control group. Additionally, private sector firms that are connected to privatized SOEs by labor mobility also reduce wages. A summary calculation suggests that privatization decreased the formal sector wage by 3 percent, with about two-thirds of this effect due to the indirect impact on private sector workers.",https://www.aeaweb.org/doi/10.1257/app.20190428
AEJ: Applied Economics,2022,Is Zero a Special Price? Evidence from Child Health Care,Toshiaki Iizuka and Hitoshi Shigeoka,"Do consumers react differently to zero prices? We test the presence of a zero-price effect in child health care and find that a zero price is special as it boosts demand discontinuously. A zero price affects resource allocations by encouraging healthier children to use more services and exacerbates behavioral hazard by increasing inappropriate use of antibiotics. A co-payment, of as small as US$2 per visit, alleviates these problems without substantially increasing financial risk. However, a zero price may be used to boost demand for highly cost-effective treatments. Zero and non-zero prices should be strategically chosen to achieve specific goals.",https://www.aeaweb.org/doi/10.1257/app.20210184
AEJ: Applied Economics,2022,The Impact of Presidential Appointment of Judges: Montesquieu or the Federalists?,Sultan Mehmood,"A central question in development economics is whether there are adequate checks and balances on the executive. This paper provides causal evidence of how increasing constraints on the executive—via removal of presidential discretion in judicial appointments—promotes the rule of law. The age structure of judges at the time of the reform and the mandatory retirement age law provide us with an exogenous source of variation in the termination of presidential discretion in judicial appointments. Overall, the results indicate that presidential appointment of judges deteriorates the rule of law. Even one degree of separation between the judiciary and the president matters.",https://www.aeaweb.org/doi/10.1257/app.20210176
AEJ: Applied Economics,2022,Lifetime Earnings in the United States over Six Decades,"Fatih Guvenen, Greg Kaplan, Jae Song and Justin Weidner","Between the 1957 and 1983 labor market entry cohorts, median lifetime earnings declined by 10–19 percent for men and increased by 22–33 percent for women, albeit relative to very low median lifetime earnings for the early cohorts. The difference between newer and older cohorts comes from differences in median earnings at the time of labor market entry. Inequality in lifetime earnings has increased significantly within each gender group, but the closing lifetime gender gap has kept overall lifetime inequality flat. The increase among men is largely attributable to subsequent cohorts entering the labor market with progressively higher levels of inequality.",https://www.aeaweb.org/doi/10.1257/app.20190489
AEJ: Applied Economics,2022,Why Is Europe More Equal than the United States?,"Thomas Blanchet, Lucas Chancel and Amory Gethin","This article combines all available data to produce pretax and posttax income inequality series in 26 European countries from 1980 to 2017. Our estimates are consistent with macroeconomic growth and comparable with US distributional national accounts. Inequality grew in nearly all European countries, but much less than in the US. Contrary to a widespread view, we demonstrate that Europe's lower inequality levels cannot be explained by more equalizing tax and transfer systems. After accounting for indirect taxes and in-kind transfers, the US redistributes a greater share of national income to low-income groups than any European country. ""Predistribution,"" not ""redistribution,"" explains why Europe is less unequal than the United States.",https://www.aeaweb.org/doi/10.1257/app.20200703
AEJ: Applied Economics,2022,"Comment on ""Temperature and Decisions: Evidence from 207,000 Court Cases""",Holger Spamann,"Heyes and Saberian (2019) estimate from 2000–2004 data that outdoor temperature reduces US immigration judges' propensity to grant asylum. This estimate is the result of coding and data errors and of sample selection. Correcting the errors reduces the point estimate by two-thirds, with a wide 95 percent confidence interval straddling zero. Enlarging the sample to 1990–2019 flips the point estimate's sign and rules out the effect size reported by Heyes and Saberian with very high confidence. An analysis of all criminal sentencing decisions by US federal district judges from 1992 to 2003 yields no evidence of temperature or other weather effects either.",https://www.aeaweb.org/doi/10.1257/app.20200118
AEJ: Applied Economics,2022,"Correction to ""Temperature and Decisions: Evidence from 207,000 Court Cases"" and Reply to Spamann",Anthony Heyes and Soodeh Saberian,"This paper evidenced the sensitivity of US immigration judge decisions to temperature in the city of arbitration on the date of a case's completion. This note serves to correct errors noted since publication. The results from both the main linear specifications are qualitatively unchanged, with estimated treatment effects similar in size to the original and retaining statistical significance at conventional levels. Some secondary results lose significance with the erosion of sample size. We also acknowledge the additional finding by Spamann (2022) with respect to external validity.",https://www.aeaweb.org/doi/10.1257/app.20200068
AEJ: Applied Economics,2022,Why Have College Completion Rates Increased?,"Jeffrey Denning, Eric R. Eide, Kevin Mumford, Richard Patterson and Merrill Warnick","We document that college completion rates have increased since the 1990s, after declining in the 1970s and 1980s. We find that most of the increase in graduation rates can be explained by grade inflation and that other factors, such as changing student characteristics and institutional resources, play little or no role. This is because GPA strongly predicts graduation, and GPAs have been rising since the 1990s. This finding holds in national survey data and in records from nine large public universities. We also find that at a public liberal arts college grades increased, holding performance on identical exams fixed.",https://www.aeaweb.org/doi/10.1257/app.20200525
AEJ: Applied Economics,2022,Neighbors' Effects on University Enrollment,Andres Barrios-Fernández,This paper combines detailed geographic information and individual educational records in Chile to provide causal evidence that close neighbors significantly influence enrollment in university. I exploit the quasi-random variation generated by student loans eligibility rules and find that potential applicants are significantly more likely to attend and complete university when their closest neighbor—defined as the closest individual applying to university one year before—becomes eligible for a student loan and enrolls in university. These results highlight the importance of social influences on university enrollment and suggest that financial aid and university access policies may have important spillover effects.,https://www.aeaweb.org/doi/10.1257/app.20200360
AEJ: Applied Economics,2022,The Long-Run Evolution of Absolute Intergenerational Mobility,Yonatan Berman,"This paper combines cross-sectional and longitudinal income data to present the evolution of absolute intergenerational income mobility in ten advanced economies in the twentieth century. Absolute mobility decreased during the second half of the twentieth century in all of these countries. Increasing income inequality and decreasing growth rates have both contributed to the decrease, yet growth is the dominant contributor in most countries. We show that detailed panel data are effectively unnecessary for estimating absolute mobility over the long run.",https://www.aeaweb.org/doi/10.1257/app.20200631
AEJ: Applied Economics,2022,African American Intergenerational Economic Mobility since 1880,William J. Collins and Marianne H. Wanamaker,"We document the intergenerational mobility of Black and White American men from 1880 through 2000 by building new historical datasets for the late nineteenth and early twentieth century and combining them with modern data to cover the middle and late twentieth century. We find large disparities in mobility, with White children having far better chances of escaping the bottom of the distribution than Black children in every generation. This mobility gap was more important in proximately determining each generation's racial gap than was the initial gap in parents' economic status.",https://www.aeaweb.org/doi/10.1257/app.20170656
AEJ: Applied Economics,2022,And Yet It Moves: Intergenerational Mobility in Italy,"Paolo Acciari, Alberto Polo and Giovanni L. Violante","We estimate intergenerational income mobility in Italy using administrative data from tax returns. Our estimates of mobility are higher than prior work using survey data and indirect methods. The rank-rank slope of parent-child income is 0.22, compared to 0.18 in Denmark and 0.34 in the United States. The probability that a child reaches the top quintile of the national income distribution starting from a family in the bottom quintile is 0.11. We uncover substantial geographical variation: upward mobility is much stronger in northern Italy, where provinces have higher measured school quality, more stable families, and more favorable labor market conditions.",https://www.aeaweb.org/doi/10.1257/app.20210151
AEJ: Applied Economics,2022,Do Doctors Improve the Health Care of Their Parents? Evidence from Admission Lotteries,"Elisabeth Artmann, Hessel Oosterbeek and Bas van der Klaauw","To assess the importance of unequal access to medical expertise and services, we estimate the causal effects of having a child who is a doctor on parents' mortality and health care use. We use data from parents of almost 22,000 participants in admission lotteries to medical school in the Netherlands. Our findings indicate that informal access to medical expertise and services is not an important cause of differences in health care use and mortality.",https://www.aeaweb.org/doi/10.1257/app.20190629
AEJ: Applied Economics,2022,The Roots of Health Inequality and the Value of Intrafamily Expertise,"Yiqun Chen, Petra Persson and Maria Polyakova","In the context of Sweden, we show that having a doctor in the family raises preventive health investments throughout the life cycle, improves physical health, and prolongs life. Two quasi-experimental research designs—medical school admission lotteries and variation in the timing of medical degrees—support a causal interpretation of these effects. A hypothetical policy that would bring the same health behavior changes and benefits to all Swedes would close 18 percent of the mortality-income gradient. Our results suggest that socioeconomic differences in exposure to health-related expertise may meaningfully contribute to health inequality.",https://www.aeaweb.org/doi/10.1257/app.20200405
AEJ: Applied Economics,2022,Historical Lynchings and the Contemporary Voting Behavior of Blacks,Jhacova Williams,"This paper analyzes the extent to which the political participation of Blacks can be traced to historical lynchings that took place from 1882 to 1930. Using county-level voter registration data, I show that Blacks who reside in southern counties that experienced a relatively higher number of historical lynchings have lower voter registration rates today. This relationship holds after accounting for a variety of historical and contemporary characteristics of counties. There exists evidence of the persistence of cultural voting norms among Blacks, yet this relationship does not exist for Whites.",https://www.aeaweb.org/doi/10.1257/app.20190549
AEJ: Applied Economics,2022,The Impact of School Facility Investments on Students and Homeowners: Evidence from Los Angeles,Julien Lafortune and David Schönholzer,"We study school facility investments using administrative records from Los Angeles. Exploiting quasi-random variation in the timing of new facility openings and using a residential assignment instrument, we find positive impacts on test scores, attendance, and house prices. Effects are not driven by changes in class size, peers, teachers, or principals, but some evidence points toward increased facility quality. We evaluate program efficiency using implied future earnings and housing capitalization. For each dollar spent, the program generated $1.62 in household value, with about 24 percent coming directly through test score gains and 76 percent from capitalization of non-test-score amenities.",https://www.aeaweb.org/doi/10.1257/app.20200467
AEJ: Applied Economics,2022,The Side Effects of Immunity: Malaria and African Slavery in the United States,Elena Esposito,"This paper documents the role of malaria in the diffusion of African slavery in the United States. The novel empirical evidence reveals that the introduction of malaria triggered a demand for malaria-resistant labor, which led to a massive expansion of African enslaved workers in the more malaria-infested areas. Further results document that among African slaves, more malaria-resistant individuals—i.e., those born in the most malaria-ridden regions of Africa—commanded significantly higher prices.",https://www.aeaweb.org/doi/10.1257/app.20190372
AEJ: Applied Economics,2022,Breastfeeding and Child Development,Emla Fitzsimons and Marcos Vera-Hernandez,"We show that children who are born at or just before the weekend are less likely to be breastfed, owing to poorer breastfeeding support services in hospitals at weekends. We use this variation to estimate the effect of breastfeeding on children's development in the first seven years of life, for a sample of births of low-educated mothers. We find large effects of breastfeeding on children's cognitive development but no effects on health or noncognitive development during the period of childhood we consider. Regarding mechanisms, we study how breastfeeding affects parental investments and the quality of the mother-child relationship.",https://www.aeaweb.org/doi/10.1257/app.20180385
AEJ: Applied Economics,2022,The Impact of Health on Labor Market Outcomes: Evidence from a Large-Scale Health Experiment,Melvin Stephens and Desmond Toohey,"While economists have posited that health investments increase earnings, isolating the causal effect of health is challenging due to reverse causality and unobserved heterogeneity. We examine the labor market effects of a randomized controlled trial, the Multiple Risk Factor Intervention Trial (MRFIT), which monitored nearly 13,000 men for over six years. We find that this intervention, which provided a bundle of treatments to reduce coronary heart disease mortality, increased earnings and family income. We find few differences in estimated gains by baseline health and occupation characteristics.",https://www.aeaweb.org/doi/10.1257/app.20180686
AEJ: Applied Economics,2022,Intrahousehold Consumption Allocation and Demand for Agency: A Triple Experimental Investigation,"Uzma Afzal, Giovanna d'Adda, Marcel Fafchamps and Farah Said","We conduct lab experiments to investigate demand for consumption agency in married couples from Pakistan. Most subjects are no better at guessing their spouse's preferences than those of a stranger, suggesting that individual executive agency has instrumental value. We find significant evidence of demand for agency in all experiments, varying with the cost and anticipated instrumental benefit of agency. But subjects often make choices incompatible with purely instrumental motives—e.g., paying for agency when knowing their partner assigned them their preferred choice. Female subjects are willing to exert agency even when they have little executive agency within their household.",https://www.aeaweb.org/doi/10.1257/app.20200672
AEJ: Applied Economics,2022,Assortative Matching at the Top of the Distribution: Evidence from the World's Most Exclusive Marriage Market,Marc Goñi,"Using novel data on peerage marriages in Britain, I find that low search costs and marriage-market segregation can generate sorting. Peers courted in the London Season, a matching technology introducing aristocratic bachelors to debutantes. When Queen Victoria went into mourning for her husband, the Season was interrupted (1861–1863), raising search costs and reducing market segregation. I exploit exogenous variation in women's probability to marry during the interruption from their age in 1861. The interruption increased peer-commoner intermarriage by 40 percent and reduced sorting along landed wealth by 30 percent. Eventually, this reduced peers' political power and affected public policy in late nineteenth-century England.",https://www.aeaweb.org/doi/10.1257/app.20180463
