journal,year,title,authors,abstract,url
American Economic Review,2021,Inattention and Switching Costs as Sources of Inertia in Medicare Part D,"Florian Heiss, Daniel McFadden, Joachim Winter, Amelie Wuppermann and Bo Zhou","Consumers' health plan choices are highly persistent even though optimal plans change over time. This paper separates two sources of inertia, inattention to plan choice and switching costs. We develop a panel data model with separate attention and choice stages, linked by heterogeneity in acuity, i.e., the ability and willingness to make diligent choices. Using data from Medicare Part D, we find that inattention is an important source of inertia but switching costs also play a role, particularly for low-acuity individuals. Separating the two stages and allowing for heterogeneity is crucial for counterfactual simulations of interventions that reduce inertia.",https://www.aeaweb.org/doi/10.1257/aer.20170471
American Economic Review,2021,The Risk-Adjusted Carbon Price,Ton van den Bremer and Frederick (Rick) van der Ploeg,"The social cost of carbon is the expected present value of damages from emitting one ton of carbon today. We use perturbation theory to derive an approximate tractable expression for this cost adjusted for climatic and economic risk. We allow for different aversion to risk and intertemporal fluctuations, skewness and dynamics in the risk distributions of climate sensitivity and the damage ratio, and correlated shocks. We identify prudence, insurance, and exposure effects, reproduce earlier analytical results, and offer analytical insights into numerical results on the effects of economic and damage ratio uncertainty and convex damages on the optimal carbon price.",https://www.aeaweb.org/doi/10.1257/aer.20180517
American Economic Review,2021,Implementation by Vote-Buying Mechanisms,Jon Eguia and Dimitrios Xefteris,"Vote-buying mechanisms allow agents to express any level of support for their preferred alternative at an increasing cost. Focusing on large societies with wealth inequality, we prove that the family of binary social choice rules implemented by well-behaved vote-buying mechanisms is indexed by a single parameter, which determines the importance assigned to the agents' willingness to pay to affect outcomes and to the number of supporters for each alternative. This parameter depends solely on the elasticity of the cost function near its origin: as this elasticity decreases, the intensities of support matter relatively more for outcomes than the supporters' count.",https://www.aeaweb.org/doi/10.1257/aer.20190197
American Economic Review,2021,Mortgage Prepayment and Path-Dependent Effects of Monetary Policy,"David Berger, Konstantin Milbradt, Fabrice Tourre and Joseph Vavra","How much ability does the Fed have to stimulate the economy by cutting interest rates? We argue that the presence of substantial debt in fixed-rate, prepayable mortgages means that the ability to stimulate the economy by cutting interest rates depends not just on their current level but also on their previous path. Using a household model of mortgage prepayment matched to detailed loan-level evidence on the relationship between prepayment and rate incentives, we argue that recent interest rate paths will generate substantial headwinds for future monetary stimuli.",https://www.aeaweb.org/doi/10.1257/aer.20181857
American Economic Review,2021,Asymmetric Attention,Alexandre N. Kohlhas and Ansgar Walther,"We document that the expectations of households, firms, and professional forecasters in standard surveys simultaneously extrapolate from recent events and underreact to new information. Existing models of expectation formation, whether behavioral or rational, cannot account for these observations. We develop a rational theory of extrapolation based on limited attention, which is consistent with this evidence. In particular, we show that limited, asymmetric attention to procyclical variables can explain the coexistence of extrapolation and underreactions. We illustrate these mechanisms in a microfounded macroeconomic model, which generates expectations consistent with the survey data, and show that asymmetric attention increases business cycle fluctuations.",https://www.aeaweb.org/doi/10.1257/aer.20191432
American Economic Review,2021,The Effects of Parental and Sibling Incarceration: Evidence from Ohio,"Samuel Norris, Matthew Pecenco and Jeffrey Weaver","Every year, millions of Americans experience the incarceration of a family member. Using 30 years of administrative data from Ohio and exploiting differing incarceration propensities of randomly assigned judges, this paper provides the first quasi-experimental estimates of the effects of parental and sibling incarceration in the United States. Parental incarceration has beneficial effects on some important outcomes for children, reducing their likelihood of incarceration by 4.9 percentage points and improving their adult neighborhood quality. While estimates on academic performance and teen parenthood are imprecise, we reject large positive or negative effects. Sibling incarceration leads to similar reductions in criminal activity.",https://www.aeaweb.org/doi/10.1257/aer.20190415
American Economic Review,2021,From Weber to Kafka: Political Instability and the Overproduction of Laws,"Gabriele Gratton, Luigi Guiso, Claudio Michelacci and Massimo Morelli","With inefficient bureaucratic institutions, the effects of laws are hard to assess and incompetent politicians may pass laws to build a reputation as skillful reformers. Since too many laws curtail bureaucratic efficiency, this mechanism can generate a steady state with Kafkaesque bureaucracy. Temporary surges in political instability heighten the incentives to overproduce laws and can shift the economy towards the Kafkaesque state. Consistent with the theory, after a surge in political instability in the early 1990s, Italy experienced a significant increase in the amount of poor-quality legislation and a decrease in bureaucratic efficiency.",https://www.aeaweb.org/doi/10.1257/aer.20190672
American Economic Review,2021,Justified Communication Equilibrium,Daniel Clark and Drew Fudenberg,"Justified communication equilibrium (JCE) is an equilibrium refinement for signaling games with cheap-talk communication. A strategy profile must be a JCE to be a stable outcome of nonequilibrium learning when receivers are initially trusting and senders play many more times than receivers. In the learning model, the counterfactual ""speeches"" that have been informally used to motivate past refinements are messages that are actually sent. Stable profiles need not be perfect Bayesian equilibria, so JCE sometimes preserves equilibria that existing refinements eliminate. Despite this, it resembles the earlier refinements D1 and NWBR, and it coincides with them in co-monotonic signaling games.",https://www.aeaweb.org/doi/10.1257/aer.20201692
American Economic Review,2021,The Challenges of Universal Health Insurance in Developing Countries: Experimental Evidence from Indonesia's National Health Insurance,"Abhijit Banerjee, Amy Finkelstein, Rema Hanna, Benjamin A. Olken, Arianna Ornaghi and Sudarno Sumarto","To investigate barriers to universal health insurance in developing countries, we designed a randomized experiment involving about 6,000 households in Indonesia who are subject to a government health insurance program with a weakly enforced mandate. Time-limited subsidies increased enrollment and attracted lower-cost enrollees, in part by reducing the strategic timing of enrollment to correspond with health needs. Registration assistance also increased enrollment, but increased attempted enrollment much more, as over one-half of households who attempted to enroll did not successfully do so. These findings underscore how weak administrative capacity can create important challenges in developing countries for achieving widespread coverage.",https://www.aeaweb.org/doi/10.1257/aer.20200523
American Economic Review,2021,"Media, Pulpit, and Populist Persuasion: Evidence from Father Coughlin",Tianyi Wang,"I study the political impact of the first populist radio personality in American history. Father Charles Coughlin blended populist demagoguery, anti-Semitism, and fascist sympathies to create a hugely popular radio program that attracted 30 million weekly listeners in the 1930s. I find that exposure to Father Coughlin's anti-Roosevelt broadcast reduced Franklin D. Roosevelt's vote share in the 1936 presidential election. Coughlin's effects were larger among Catholics and persisted after Coughlin left the air. Moreover, places more exposed to Coughlin's broadcast were more likely to form a local branch of the pro-Nazi German-American Bund and sold fewer war bonds during World War II.",https://www.aeaweb.org/doi/10.1257/aer.20200513
American Economic Review,2021,Lapse-Based Insurance,Daniel Gottlieb and Kent Smetters,"Most individual life insurance policies lapse, with lapsers cross-subsidizing non-lapsers. We show that policies and lapse patterns predicted by standard rational expectations models are the opposite of those observed empirically. We propose two behavioral models consistent with the evidence: (i) consumers forget to pay premiums and (ii) consumers understate future liquidity needs. We conduct two surveys with a large insurer. New buyers believe that their own lapse probabilities are small compared to the insurer's actual experience. For recent lapsers, forgetfulness accounts for 37.8 percent of lapses while unexpected liquidity accounts for 15.4 percent.",https://www.aeaweb.org/doi/10.1257/aer.20160868
American Economic Review,2021,Daily Labor Supply and Adaptive Reference Points,Neil Thakral and Linh Tô,"This paper provides field evidence on how reference points adjust, a degree of freedom in reference-dependence models. Examining this in the context of cabdrivers' daily labor-supply behavior, we ask how the within-day timing of earnings affects decisions. Drivers work less in response to higher accumulated income, with a strong effect for recent earnings that gradually diminishes for earlier earnings. We estimate a structural model in which drivers work toward a reference point that adjusts to deviations from expected earnings with a lag. This dynamic view of reference dependence reconciles conflicting ""neoclassical"" and ""behavioral"" interpretations of evidence on daily labor-supply decisions.",https://www.aeaweb.org/doi/10.1257/aer.20170768
American Economic Review,2021,Mediation in Reputational Bargaining,Jack Fanning,"Can an uninformed mediator improve outcomes in a dynamic reputational bargaining model? I show that a simple communication protocol used by professional mediators, of announcing an agreement only if both parties privately accept its terms, can increase the payoffs of rational bargainers, but only if communication is noisy: the mediator must sometimes fail to suggest a deal even when both bargainers accept it.",https://www.aeaweb.org/doi/10.1257/aer.20191321
American Economic Review,2021,What to Expect from the Lower Bound on Interest Rates: Evidence from Derivatives Prices,Thomas M. Mertens and John Williams,"This paper analyzes the effects of the lower bound for interest rates on the distributions of inflation and interest rates. In a New Keynesian model with a lower bound, two equilibria emerge: policy is mostly unconstrained in the ""target equilibrium,"" whereas policy is mostly constrained in the ""liquidity trap equilibrium."" Using options data on interest rates and inflation, we find forecast densities consistent with the target equilibrium and find no evidence in favor of the liquidity trap equilibrium. The lower bound has a sizable effect on the distribution of interest rates, but its impact on inflation is relatively modest.",https://www.aeaweb.org/doi/10.1257/aer.20181461
American Economic Review,2021,The Impacts of a Multifaceted Prenatal Intervention on Human Capital Accumulation in Early Life,"Pedro Carneiro, Lucy Kraftman, Giacomo Mason, Lucie Moore, Imran Rasul and Molly Scott","We evaluate an intervention targeting early life nutrition and well-being for households in extreme poverty in Northern Nigeria. The intervention leads to large and sustained improvements in children's anthropometric and health outcomes, including an 8 percent reduction in stunting 4 years, post-intervention. These impacts are partly driven by information-related channels. However, the certain and substantial flow of cash transfers is also key. They induce positive labor supply responses among women, and enables them to undertake productive investments in livestock. These provide protein rich diets for children, and generate higher household earnings streams long after the cash transfers expire.",https://www.aeaweb.org/doi/10.1257/aer.20191726
American Economic Review,2021,"The Long-Run Effects of Childhood Insurance Coverage: Medicaid Implementation, Adult Health, and Labor Market Outcomes",Andrew Goodman-Bacon,"This paper estimates the long-run effects of childhood Medicaid eligibility on adult health and economic outcomes using the program's original introduction (1966–1970) and its mandated coverage of welfare recipients. The design compares cohorts born in different years relative to Medicaid implementation, in states with different preexisting welfare-based eligibility. Early childhood Medicaid eligibility reduces mortality and disability, increases employment, and reduces receipt of disability transfer programs up to 50 years later. Medicaid has saved the government more than its original cost and saved more than 10 million quality adjusted life years.",https://www.aeaweb.org/doi/10.1257/aer.20171671
American Economic Review,2021,Identifying Present Bias from the Timing of Choices,Paul Heidhues and Philipp Strack,"A (partially naive) quasi-hyperbolic discounter repeatedly chooses whether to complete a task. Her net benefits of task completion are drawn independently between periods from a time-invariant distribution. We show that the probability of completing the task conditional on not having done so earlier increases towards the deadline. Conversely, we establish nonidentifiability by proving that for any time-preference parameters and any dataset with such (weakly increasing) task-completion probabilities, there exists a stationary payoff distribution that rationalizes the agent's behavior if she is either sophisticated or fully naive. Additionally, we provide sharp partial identification for the case of observable continuation values.",https://www.aeaweb.org/doi/10.1257/aer.20191258
American Economic Review,2021,Entry-Proofness and Discriminatory Pricing under Adverse Selection,"Andrea Attar, Thomas Mariotti and François Salanié","This paper studies competitive allocations under adverse selection. We first provide a general necessary and sufficient condition for entry on an inactive market to be unprofitable. We then use this result to characterize, for an active market, a unique budget-balanced allocation implemented by a market tariff making additional trades with an entrant unprofitable. Motivated by the recursive structure of this allocation, we finally show that it emerges as the essentially unique equilibrium outcome of a discriminatory ascending auction. These results yield sharp predictions for competitive nonexclusive markets.",https://www.aeaweb.org/doi/10.1257/aer.20190189
American Economic Review,2021,Targeting In-Kind Transfers through Market Design: A Revealed Preference Analysis of Public Housing Allocation,Daniel Waldinger,"Public housing benefits are rationed through wait lists. Theoretical work on public housing allocation has debated how much choice applicants should have over units, identifying a possible trade-off between efficiency and redistribution. This paper empirically establishes the existence and economic importance of this trade-off using wait list data from Cambridge, Massachusetts. I estimate a model of public housing preferences in a setting where heterogeneous apartments are rationed through waiting time. Eliminating choice would improve targeting but reduce tenant welfare by more than 30 percent. Such a change is only justified on targeting grounds by a strong social preference for redistribution.",https://www.aeaweb.org/doi/10.1257/aer.20190516
American Economic Review,2021,Place-Based Drivers of Mortality: Evidence from Migration,"Amy Finkelstein, Matthew Gentzkow and Heidi Williams","We estimate the effect of current location on elderly mortality by analyzing outcomes of movers in the Medicare population. We control for movers' origin locations as well as a rich vector of pre-move health measures. We also develop a novel strategy to adjust for remaining unobservables, using the correlation of residual mortality with movers' origins to gauge the importance of omitted variables. We estimate substantial effects of current location. Moving from a tenth to a ninetieth percentile location would increase life expectancy at age 65 by 1.1 years, and equalizing location effects would reduce cross-sectional variation in life expectancy by 15 percent. Places with favorable life expectancy effects tend to have higher quality and quantity of health care, less extreme climates, lower crime rates, and higher socioeconomic status.",https://www.aeaweb.org/doi/10.1257/aer.20190825
American Economic Review,2021,Notching R&D Investment with Corporate Income Tax Cuts in China,"Zhao Chen, Zhikuo Liu, Juan Carlos Suárez Serrato and Yi Xu","We study a Chinese policy that awards substantial tax cuts to firms with R&D investment over a threshold or ""notch."" Quasi-experimental variation and administrative tax data show a significant increase in reported R&D that is partly driven by firms relabeling expenses as R&D. Structural estimates show relabeling accounts for 24.2 percent of reported R&D and that doubling R&D would increase productivity by 9 percent. Policy simulations show that firm selection and relabeling determine the cost-effectiveness of stimulating R&D, that notch-based policies are more effective than tax credits when relabeling is prevalent, and that modest spill-overs justify the program from a welfare perspective.",https://www.aeaweb.org/doi/10.1257/aer.20191758
American Economic Review,2021,Unwatched Pollution: The Effect of Intermittent Monitoring on Air Quality,Eric Zou,"Intermittent monitoring of environmental standards may induce strategic changes in polluting activities. This paper documents local strategic responses to a cyclical, once-every-six-day air quality monitoring schedule under the federal Clean Air Act. Using satellite data of monitored areas, I show that air quality is significantly worse on unmonitored days. This effect is explained by short-term suppression of pollution on monitored days, especially during high-pollution periods when the city's noncompliance risk is high. Cities' use of air quality warnings increases on monitored days, which suggests local governments' role in coordinating emission reductions.",https://www.aeaweb.org/doi/10.1257/aer.20181346
American Economic Review,2021,How to Avoid Black Markets for Appointments with Online Booking Systems,"Rustamdjan Hakimov, C.-Philipp Heller, Dorothea Kübler and Morimitsu Kurino","Allocating appointment slots is presented as a new application for market design. Online booking systems are commonly used by public authorities to allocate appointments for visa interviews, driver's licenses, passport renewals, etc. We document that black markets for appointments have developed in many parts of the world. Scalpers book the appointments that are offered for free and sell the slots to appointment seekers. We model the existing first-come-first-served booking system and propose an alternative batch system. The batch system collects applications for slots over a certain time period and then randomly allocates slots to applicants. The theory predicts and lab experiments confirm that scalpers profitably book and sell slots under the current system with sufficiently high demand, but that they are not active in the proposed batch system. We discuss practical issues for the implementation of the batch system and its applicability to other markets with scalping.",https://www.aeaweb.org/doi/10.1257/aer.20191204
American Economic Review,2021,Adverse and Advantageous Selection in the Laboratory,"S. Nageeb Ali, Maximilian Mihm, Lucas Siga and Chloe Tergiman","We study two-player games where one-sided asymmetric information can lead to either adverse or advantageous selection. We contrast behavior in these games with settings where both players are uninformed. We find stark differences, suggesting that subjects do account for endogenous selection effects. Removing strategic uncertainty increases the fraction of subjects who account for selection. Subjects respond more to adverse than advantageous selection. Using additional treatments where we vary payoff feedback, we connect this difference to learning. We also observe a significant fraction of subjects who appear to understand selection effects but do not apply that knowledge.",https://www.aeaweb.org/doi/10.1257/aer.20200304
American Economic Review,2021,Pay Me Later: Savings Constraints and the Demand for Deferred Payments,"Lasse Brune, Eric Chyn and Jason Kerwin","We study a simple savings scheme that allows workers to defer receipt of part of their wages for three months at zero interest. The scheme significantly increases savings during the deferral period, leading to higher postdisbursement spending on lumpy goods. Two years later, after two additional rounds of the savings scheme, we find that treated workers have made permanent improvements to their homes. The popularity of the scheme implies a lack of good alternative savings options. The results of a follow-up experiment suggest that demand for the scheme is partly due to its ability to address self-control issues.",https://www.aeaweb.org/doi/10.1257/aer.20191657
American Economic Review,2021,"Recruitment, Effort, and Retention Effects of Performance Contracts for Civil Servants: Experimental Evidence from Rwandan Primary Schools","Clare Leaver, Owen Ozier, Pieter Serneels and Andrew Zeitlin","This paper reports on a two-tiered experiment designed to separately identify the selection and effort margins of pay for performance (P4P). At the recruitment stage, teacher labor markets were randomly assigned to a ""pay-for-percentile"" or fixed-wage contract. Once recruits were placed, an unexpected, incentive-compatible, school-level re-randomization was performed so that some teachers who applied for a fixed-wage contract ended up being paid by P4P, and vice versa. By the second year of the study, the within-year effort effect of P4P was 0.16 standard deviations of pupil learning, with the total effect rising to 0.20 standard deviations after allowing for selection.",https://www.aeaweb.org/doi/10.1257/aer.20191972
American Economic Review,2021,Market Fragmentation,Daniel Chen and Darrell Duffie,"We model a simple market setting in which fragmentation of trade of the same asset across multiple exchanges improves allocative efficiency. Fragmentation reduces the inhibiting effect of price-impact avoidance on order submission. Although fragmentation reduces market depth on each exchange, it also isolates cross-exchange price impacts, leading to more aggressive overall order submission and better rebalancing of unwanted positions across traders. Fragmentation also has implications for the extent to which prices reveal traders' private information. While a given exchange price is less informative in more fragmented markets, all exchange prices taken together are more informative.",https://www.aeaweb.org/doi/10.1257/aer.20200829
American Economic Review,2021,Security Transitions,"Thiemo Fetzer, Pedro C. L. Souza, Oliver Vanden Eynde and Austin L. Wright","How do foreign powers disengage from a conflict? We study this issue by examining the recent, large-scale security transition from international troops to local forces in the ongoing civil conflict in Afghanistan. We construct a new dataset that combines information on this transition process with declassified conflict outcomes and previously unreleased quarterly survey data of residents' perceptions of local security. Our empirical design leverages the staggered roll-out of the transition, and employs a novel instrumental variables approach to estimate the impact. We find a significant, sharp, and timely decline of insurgent violence in the initial phase: the security transfer to Afghan forces. We find that this is followed by a significant surge in violence in the second phase: the actual physical withdrawal of foreign troops. We argue that this pattern is consistent with a signaling model, in which the insurgents reduce violence strategically to facilitate the foreign military withdrawal to capitalize on the reduced foreign military presence afterward. Our findings clarify the destabilizing consequences of withdrawal in one of the costliest conflicts in modern history, and yield potentially actionable insights for designing future security transitions.",https://www.aeaweb.org/doi/10.1257/aer.20200412
