journal,year,title,authors,abstract,url
American Economic Review,2021,The Economic Consequences of Bankruptcy Reform,"Tal Gross, Raymond Kluender, Feng Liu, Matthew Notowidigdo and Jialan Wang","A more generous consumer bankruptcy system provides greater insurance against financial risks but may also raise the cost of credit. We study this trade-off using the 2005 Bankruptcy Abuse Prevention and Consumer Protection Act (BAPCPA), which increased the costs of filing for bankruptcy. We identify the effects of BAPCPA on borrowing costs using variation in the effects of the reform across credit scores. We find that a one-percentage-point reduction in bankruptcy filing risk decreased credit card interest rates by 70–90 basis points. Conversely, BAPCPA reduced the insurance value of bankruptcy, with uninsured hospitalizations 70 percent less likely to obtain bankruptcy relief after the reform.",https://www.aeaweb.org/doi/10.1257/aer.20191311
American Economic Review,2021,On Her Own Account: How Strengthening Women's Financial Control Impacts Labor Supply and Gender Norms,"Erica Field, Rohini Pande, Natalia Rigol, Simone Schaner and Charity Moore","Can increasing control over earnings incentivize a woman to work, and thereby influence norms around gender roles? We randomly varied whether rural Indian women received bank accounts, training in account use, and direct deposit of public sector wages into their own (versus husbands') accounts. Relative to the accounts only group, women who also received direct deposit and training worked more in public and private sector jobs. The private sector result suggests gender norms initially constrained female employment. Three years later, direct deposit and training broadly liberalized women's own work-related norms, and shifted perceptions of community norms.",https://www.aeaweb.org/doi/10.1257/aer.20200705
American Economic Review,2021,Closing the Gap: The Effect of Reducing Complexity and Uncertainty in College Pricing on the Choices of Low-Income Students,"Susan Dynarski, Libassi Cj, Katherine Michelmore and Stephanie Owen","High-achieving, low-income students attend selective colleges at far lower rates than upper-income students with similar achievement. Behavioral biases, intensified by complexity and uncertainty in the admissions and aid process, may explain this gap. In a large-scale experiment we test an early commitment of free tuition at a flagship university. The intervention did not increase aid: rather, students were guaranteed before application the same grant aid that they would qualify for in expectation if admitted. The offer substantially increased application (68 percent versus 26 percent) and enrollment rates (27 percent versus 12 percent). The results suggest that uncertainty, present bias, and loss aversion loom large in students' college decisions.",https://www.aeaweb.org/doi/10.1257/aer.20200451
American Economic Review,2021,The Selection of Talent: Experimental and Structural Evidence from Ethiopia,"Girum Abebe, A. Stefano Caria and Esteban Ortiz-Ospina","We study how search frictions in the labor market affect firms' ability to recruit talented workers. In a field experiment in Ethiopia, we show that an employer can attract more talented applicants by offering a small monetary incentive for making a job application. Estimates from a structural model suggest that the intervention is effective because the cost of making a job application is large, and positively correlated with jobseeker ability. We provide evidence that this positive correlation is driven by dynamic selection. In a second experiment, we show that local recruiters underestimate the positive impacts of application incentives.",https://www.aeaweb.org/doi/10.1257/aer.20190586
American Economic Review,2021,Types of Contact: A Field Experiment on Collaborative and Adversarial Caste Integration,Matt Lowe,"I estimate the effects of collaborative and adversarial intergroup contact. I randomly assigned Indian men from different castes to participate in cricket leagues or to serve as a control group. League players faced variation in collaborative contact, through random assignment to homogeneous-caste or mixed-caste teams, and adversarial contact, through random assignment of opponents. Collaborative contact increases cross-caste friendships and efficiency in trade, and reduces own-caste favoritism. In contrast, adversarial contact generally reduces cross-caste interaction and efficiency. League participation reduces intergroup differences, suggesting that the positive aspects of intergroup contact more than offset the negative aspects in this setting.",https://www.aeaweb.org/doi/10.1257/aer.20191780
American Economic Review,2021,Feedbacks: Financial Markets and Economic Activity,"Markus Brunnermeier, Darius Palia, Karthik A. Sastry and Christopher Sims","Is credit expansion a sign of desirable financial deepening or the prelude to an inevitable bust? We study this question in modern US data using a structural VAR model of 10 monthly frequency variables, identified by heteroskedasticity. Negative reduced-form responses of output to credit growth are caused by endogenous monetary policy response to credit expansion shocks. On average, credit and output growth remain positively associated. ""Financial stress"" shocks to credit spreads cause declines in output and credit levels. Neither credit aggregates nor spreads provide much advance warning of the 2008–2009 crisis, but spreads improve within-crisis forecasts.",https://www.aeaweb.org/doi/10.1257/aer.20180733
American Economic Review,2021,Can Policy Change Culture? Government Pension Plans and Traditional Kinship Practices,Natalie Bau,"Policies may change the incentives that allow cultural practices to persist. To test this, I study matrilocality and patrilocality, kinship traditions that determine daughters' and sons' post-marriage residences, and thus, which gender lives with and supports parents in their old age. Two separate policy experiments in Ghana and Indonesia show that pension policies reduce the practice of these traditions. I also show that these traditions incentivize parents to invest in the education of children who traditionally coreside with them. Consequently, when pension plans change cultural practices, they also reduce educational investment. This finding further demonstrates that policy can change culture.",https://www.aeaweb.org/doi/10.1257/aer.20190098
American Economic Review,2021,Can Network Theory-Based Targeting Increase Technology Adoption?,"Lori Beaman, Ariel BenYishay, Jeremy Magruder and Ahmed Mobarak","Can targeting information to network-central farmers induce more adoption of a new agricultural technology? By combining social network data and a field experiment in 200 villages in Malawi, we find that targeting central farmers is important to spur the diffusion process. We also provide evidence of one explanation for why centrality matters: a diffusion process governed by complex contagion. Our results are consistent with a model in which many farmers need to learn from multiple people before they adopt themselves. This means that without proper targeting of information, the diffusion process can stall and technology adoption remains perpetually low.",https://www.aeaweb.org/doi/10.1257/aer.20200295
American Economic Review,2021,Digitization and Pre-purchase Information: The Causal and Welfare Impacts of Reviews and Crowd Ratings,Imke Reimers and Joel Waldfogel,"Digitization has led to many new creative products, straining the capacity of professional critics and consumers. Yet, the digitization of retailing has also delivered new crowd-based sources of pre-purchase information. We compare the relative impacts of professional critics and crowd-based Amazon star ratings on consumer welfare in book publishing. Using various fixed effects and discontinuity-based empirical strategies, we estimate their causal impacts on sales. We use these causal estimates to calibrate a structural demand model. The aggregate effect of star ratings on consumer surplus is, in our baseline estimates, more than ten times the effect of traditional review outlets.",https://www.aeaweb.org/doi/10.1257/aer.20200153
American Economic Review,2021,Discrete Choice under Risk with Limited Consideration,"Levon Barseghyan, Francesca Molinari and Matthew Thirkettle","This paper is concerned with learning decision-makers' preferences using data on observed choices from a finite set of risky alternatives. We propose a discrete choice model with unobserved heterogeneity in consideration sets and in standard risk aversion. We obtain sufficient conditions for the model's semi-nonparametric point identification, including in cases where consideration depends on preferences and on some of the exogenous variables. Our method yields an estimator that is easy to compute and is applicable in markets with large choice sets. We illustrate its properties using a dataset on property insurance purchases.",https://www.aeaweb.org/doi/10.1257/aer.20190253
American Economic Review,2021,Digital Dystopia,Jean Tirole,"Autocratic regimes, democratic majorities, private platforms, and religious or professional organizations can achieve social control by managing the flow of information about individuals' behavior. Bundling the agents' political, organizational, or religious attitudes with information about their prosocial conduct makes them care about behaviors that they otherwise would not. The incorporation of the individuals' social graph in their social score further promotes soft control but destroys the social fabric. Both bundling and guilt by association are most effective in a society that has weak ties and is politically docile.",https://www.aeaweb.org/doi/10.1257/aer.20201214
American Economic Review,2021,Auction Research Evolving: Theorems and Market Designs,Paul Milgrom,,https://www.aeaweb.org/doi/10.1257/aer.111.5.1383
American Economic Review,2021,A Few Bad Apples? Racial Bias in Policing,Felipe Goncalves and Steven Mello,"We estimate the degree to which individual police officers practice racial discrimination. Using a bunching estimation design and data from the Florida Highway Patrol, we show that minorities are less likely to receive a discount on their speeding tickets than White drivers. Disaggregating this difference to the individual police officer, we estimate that 42 percent of officers practice discrimination. We then apply our officer-level discrimination measures to various policy-relevant questions in the literature. In particular, reassigning officers across locations based on their lenience can effectively reduce the aggregate disparity in treatment.",https://www.aeaweb.org/doi/10.1257/aer.20181607
American Economic Review,2021,"How Research Affects Policy: Experimental Evidence from 2,150 Brazilian Municipalities","Jonas Hjort, Diana Moreira, Gautam Rao and Juan Francisco Santini","Can research findings change political leaders' beliefs and policies? We use experiments with 2,150 Brazilian municipalities to measure mayors' demand for and response to research information. In one experiment, we find that mayors are willing to pay to learn the results of evaluation studies, and update their beliefs when informed of the findings. They value larger-sample studies more, while not distinguishing between studies in rich and poor countries. In a second experiment, we find that informing mayors about research on a simple and effective policy, taxpayer reminder letters, increases the probability the policy is implemented by 10 percentage points.",https://www.aeaweb.org/doi/10.1257/aer.20190830
American Economic Review,2021,Five Facts about Beliefs and Portfolios,"Stefano Giglio, Matteo Maggiori, Johannes Stroebel and Stephen Utkus","We study a newly designed survey administered to a large panel of wealthy retail investors. The survey elicits beliefs that are important for macroeconomics and finance, and matches respondents with administrative data on their portfolio composition, their trading activity, and their login behavior. We establish five facts in these data. (i) Beliefs are reflected in portfolio allocations. The sensitivity of portfolios to beliefs is small on average, but varies significantly with investor wealth, attention, trading frequency, and confidence. (ii) Belief changes do not predict when investors trade, but conditional on trading, they affect both the direction and the magnitude of trades. (iii) Beliefs are mostly characterized by large and persistent individual heterogeneity. Demographic characteristics explain only a small part of why some individuals are optimistic and some are pessimistic. (iv) Expected cash flow growth and expected returns are positively related, both within and across investors. (v) Expected returns and the subjective probability of rare disasters are negatively related, both within and across investors. These five facts provide useful guidance for the design of macro-finance models.",https://www.aeaweb.org/doi/10.1257/aer.20200243
American Economic Review,2021,"Dynastic Human Capital, Inequality, and Intergenerational Mobility","Adrian Adermon, Mikael Lindahl and Mårten Palme","We estimate long-run intergenerational persistence in human capital using information on outcomes for the extended family: the dynasty. A dataset including the entire Swedish population, linking four generations, allows us to identify parents' siblings and cousins, their spouses, and spouses' siblings. Using various human capital measures, we show that traditional parent-child estimates underestimate long-run intergenerational persistence by at least one-third. By adding outcomes for more distant ancestors, we show that almost all of the persistence is captured by the parental generation. Data on adoptees show that at least one-third of long-term persistence is attributed to environmental factors.",https://www.aeaweb.org/doi/10.1257/aer.20190553
American Economic Review,2021,The Role of Behavioral Frictions in Health Insurance Marketplace Enrollment and Risk: Evidence from a Field Experiment,"Richard Domurat, Isaac Menashe and Wesley Yin","We experimentally varied information mailed to 87,000 households in California's health insurance marketplace to study the role of frictions in insurance take-up. Reminders about the enrollment deadline raised enrollment by 1.3 pp (16 percent) in this typically low take-up population. Heterogeneous effects of personalized subsidy information indicate misperceptions about program benefits. Consistent with an adverse selection model with frictional enrollment costs, the intervention lowered average spending risk by 5.1 percent, implying that marginal respondents were 37 percent less costly than inframarginal consumers. We observe the largest positive selection among low income consumers, who exhibit the largest frictions in enrollment. Finally, we estimate the implied value of the letter intervention to be $25 to $53 per month in subsidy dollars. These results suggest that frictions may partially explain low take-up for marketplace insurance, and that interventions reducing them can improve enrollment and market risk in exchanges.",https://www.aeaweb.org/doi/10.1257/aer.20190823
American Economic Review,2021,An Experiment in Candidate Selection,"Katherine Casey, Abou Bakarr Kamara and Niccoló F. Meriggi","Are ordinary citizens or political party leaders better positioned to select candidates? While the American primary system lets citizens choose, most democracies rely instead on party officials to appoint or nominate candidates. The consequences of these distinct design choices are unclear: while officials are often better informed about candidate qualifications, they may value traits, like party loyalty or willingness to pay for the nomination, at odds with identifying the best performer. We partnered with both major political parties in Sierra Leone to experimentally vary how much say voters have in selecting Parliamentary candidates. Estimates suggest that more democratic procedures increase the likelihood that parties select voters' most preferred candidates and favor candidates with stronger records of public goods provision.",https://www.aeaweb.org/doi/10.1257/aer.20200125
American Economic Review,2021,Stock Market Wealth and the Real Economy: A Local Labor Market Approach,"Gabriel Chodorow-Reich, Plamen T. Nenov and Alp Simsek","We provide evidence of the stock market consumption wealth effect by using a local labor market analysis. An increase in local stock wealth driven by aggregate stock prices increases local employment and payroll in nontradable industries and in total, with no effect on employment in tradable industries. In a model of geographic heterogeneity in stock wealth, these responses imply an MPC of 3.2 cents per year and that a 20 percent increase in stock valuations, unless countered by monetary policy, increases the aggregate labor bill by at least 1.7 percent and aggregate hours by at least 0.7 percent two years after the shock.",https://www.aeaweb.org/doi/10.1257/aer.20200208
American Economic Review,2021,Efficiency and Equity Impacts of Energy Subsidies,Robert W. Hahn and Robert Metcalfe,"Economic theory suggests that energy subsidies can lead to excessive consumption and environmental degradation. However, the precise impact of energy subsidies is not well understood. We analyze a large energy subsidy: the California Alternate Rates for Energy (CARE). CARE provides a price reduction for low-income consumers of natural gas and electricity. Using a natural field experiment, we estimate the price elasticity of demand for natural gas to be about −0.35 for CARE customers. An economic model of this subsidy yields three results. First, the natural gas subsidy appears to reduce welfare. Second, the economic impact of various policies, such as cap-and-trade, depends on whether prices for various customers move closer to the marginal social cost. Third, benefits to CARE customers need to increase by 6 percent to offset the costs of the program.",https://www.aeaweb.org/doi/10.1257/aer.20180441
American Economic Review,2021,Cross-Region Transfer Multipliers in a Monetary Union: Evidence from Social Security and Stimulus Payments,Steven Pennings,"US federal transfers to individuals are large, countercyclical, vary geographically, and are often credited with helping to stabilize regional economies. This paper estimates the short-run effects of these transfers using plausibly exogenous regional variation in temporary stimulus payments and permanent Social Security benefit increases. States that received larger transfers tended to grow faster contemporaneously, with a multiplier of around 1.5 for permanent transfers and 1/3 for temporary transfers. Results are broadly consistent with an open-economy New Keynesian model. At business cycle frequencies, cross-region transfer multipliers are not large, suggesting only modest gains in regional stabilization from US federal automatic stabilizers.",https://www.aeaweb.org/doi/10.1257/aer.20190240
American Economic Review,2021,Behavioral Constraints on the Design of Subgame-Perfect Implementation Mechanisms,"Ernst Fehr, Michael Powell and Tom Wilkening","We study subgame-perfect implementation (SPI) mechanisms that have been proposed as a solution to incomplete contracting problems. We show that these mechanisms, which are based on off-equilibrium arbitration clauses that impose large fines for lying and the inappropriate use of arbitration, have severe behavioral constraints because the fines induce retaliation against legitimate uses of arbitration. Incorporating reciprocity preferences into the theory explains the observed behavioral patterns and helps us develop a new mechanism that is more robust and achieves high rates of truth-telling and efficiency. Our results highlight the importance of tailoring implementation mechanisms to the underlying behavioral environment.",https://www.aeaweb.org/doi/10.1257/aer.20170297
American Economic Review,2021,The Macroeconomic Effects of Oil Supply News: Evidence from OPEC Announcements,Diego Känzig,"This paper studies how changes in oil supply expectations affect the oil price and the macroeconomy. Using a novel identification design, exploiting institutional features of OPEC and high-frequency data, I identify an oil supply news shock. These shocks have statistically and economically significant effects. Negative news leads to an immediate increase in oil prices, a gradual fall in oil production, and an increase in inventories. This has consequences for the US economy: activity falls, prices and inflation expectations rise, and the dollar depreciates, providing evidence for a strong channel operating through supply expectations.",https://www.aeaweb.org/doi/10.1257/aer.20190964
American Economic Review,2021,Reference Points for Retirement Behavior: Evidence from German Pension Discontinuities,Arthur Seibold,"This paper studies the large concentration of retirement behavior around statutory retirement ages, a puzzling stylized fact. To investigate this fact, I estimate bunching responses to 644 pension benefit discontinuities, using administrative data on the universe of German retirees. Financial incentives alone cannot explain retirement patterns, but there is a large direct effect of statutory retirement ages. I argue that the framing of statutory ages as reference points for retirement provides a plausible explanation. Simulations based on a model with reference dependence highlight that shifting statutory ages via pension reforms is an effective policy to influence retirement behavior.",https://www.aeaweb.org/doi/10.1257/aer.20191136
American Economic Review,2021,Myopia and Anchoring,George-Marios Angeletos and Zhen Huo,"We develop an equivalence between the equilibrium effects of incomplete information and those of two behavioral distortions: myopia, or extra discounting of the future; and anchoring of current behavior to past behavior, as in models with habit persistence or adjustment costs. We show how these distortions depend on higher-order beliefs and GE mechanisms, and how they can be disciplined by evidence on expectations. We finally illustrate the use of our toolbox with a quantitative application in the context of inflation, a bridge to the HANK literature, and an extension to networks.",https://www.aeaweb.org/doi/10.1257/aer.20191436
American Economic Review,2021,Parental Resources and College Attendance: Evidence from Lottery Wins,"George Bulman, Robert Fairlie, Sarena Goodman and Adam Isen","We examine US children whose parents won the lottery to trace out the effect of financial resources on college attendance. The analysis leverages federal tax and financial aid records and substantial variation in win size and timing. While per-dollar effects are modest, the relationship is weakly concave, with a high upper bound for amounts greatly exceeding college costs. Effects are smaller among low-SES households, not sensitive to how early in adolescence the shock occurs, and not moderated by financial aid crowd-out. The results imply that households derive consumption value from college, and household financial constraints alone do not inhibit attendance.",https://www.aeaweb.org/doi/10.1257/aer.20171272
American Economic Review,2021,Impacts of Performance Pay for Hospitals: The Readmissions Reduction Program,Atul Gupta,"US policy increasingly ties payments for providers to performance on quality measures, though little empirical evidence guides the design of such incentives. I deploy administrative data to study a large federal program that penalizes hospitals with high readmissions rates. Using policy-driven variation in the penalty incentive across hospitals for identification, I find that hospital responses to the penalty account for two-thirds of the observed decrease in readmissions over this period, as well as a decrease in heart attack mortality. Quality improvement accounts for about one-half of the decrease in readmissions; the remainder is explained by selective admission of returning patients.",https://www.aeaweb.org/doi/10.1257/aer.20171825
American Economic Review,2021,The Legacy of Colonial Medicine in Central Africa,Sara Lowes and Eduardo Montero,"Between 1921 and 1956, French colonial governments organized medical campaigns to treat and prevent sleeping sickness. Villagers were forcibly examined and injected with medications with severe, sometimes fatal, side effects. We digitized 30 years of archival records to document the locations of campaign visits at a granular geographic level for five central African countries. We find that greater campaign exposure reduces vaccination rates and trust in medicine, as measured by willingness to consent to a blood test. We examine relevance for present-day health initiatives; World Bank projects in the health sector are less successful in areas with greater exposure.",https://www.aeaweb.org/doi/10.1257/aer.20180284
