journal,year,title,authors,abstract,url
American Economic Review,2021,"Product Innovation, Product Diversification, and Firm Growth: Evidence from Japan's Early Industrialization","Serguey Braguinsky, Atsushi Ohyama, Tetsuji Okazaki and Chad Syverson","We explore how firms grow by adding products. We leverage detailed data from Japan's cotton spinning industry at the turn of the last century to do so. This setting allows us to fully characterize the type of differentiation (vertical or horizontal) of new product introductions as well as whether the product is within or outside of the firm's prior technological capabilities. We find that trying to introduce innovative products beyond the firm's previous technologically feasible set, even if such trials fail, is a key to firm growth. Indeed, it mostly facilitates growth through the firm's later success in horizontal product diversification. In long-term outcomes, the right tail of the firm size distribution becomes dominated by firms that first moved into technologically challenging products and then later applied their newly acquired technical competence to horizontal expansion of their product portfolios. Two mechanisms through which this knowledge transfer occurs are greater production system flexibility and higher product appeal to downstream buyers.",https://www.aeaweb.org/doi/10.1257/aer.20201656
American Economic Review,2021,Tax Administration versus Tax Rates: Evidence from Corporate Taxation in Indonesia,"Muhamad Basri, Mayara Felix, Rema Hanna and Benjamin A. Olken","We compare two approaches to increasing tax revenue: tax administration and tax rates. We show that when Indonesia moved top regional firms into ""medium taxpayer offices,"" with high staff-to-taxpayer ratios, tax revenue more than doubled. Examining nonlinear changes to corporate income tax rates, we estimate an elasticity of taxable income of 0.579. Combining these estimates, improved tax administration is equivalent to raising top rates on all firms by 8 percentage points. On net, improved tax administration can have significant returns for developing countries.",https://www.aeaweb.org/doi/10.1257/aer.20201237
American Economic Review,2021,Sectoral Media Focus and Aggregate Fluctuations,"Ryan Chahrour, Kristoffer Nimark and Stefan Pitschner","We formalize the editorial role of news media in a multisector economy and show that media can be an independent source of business cycle fluctuations, even when they report accurate information. Public reporting about a subset of sectoral developments that are newsworthy but unrepresentative causes firms across all sectors to hire too much or too little labor. We construct historical measures of US sectoral news coverage and use them to calibrate our model. Time-varying media focus generates demand-like fluctuations that are orthogonal to productivity, even in the absence of non-TFP shocks. Presented with historical sectoral productivity, the model reproduces the 2009 Great Recession.",https://www.aeaweb.org/doi/10.1257/aer.20191895
American Economic Review,2021,Team-Specific Human Capital and Team Performance: Evidence from Doctors,Yiqun Chen,"This paper studies whether team members' past collaboration creates team-specific human capital and influences current team performance. Using administrative Medicare claims for two heart procedures, I find that shared work experience between the doctor who performs the procedure (""proceduralist"") and the doctors who provide care to the patient during the hospital stay for the procedure (""physicians"") reduces patient mortality rates. A one standard deviation increase in proceduralist-physician shared work experience leads to a 10–14 percent reduction in patient 30-day mortality. Patient medical resource use also declines with shared work experience, even as survival improves.",https://www.aeaweb.org/doi/10.1257/aer.20201238
American Economic Review,2021,Prep School for Poor Kids: The Long-Run Impacts of Head Start on Human Capital and Economic Self-Sufficiency,"Martha Bailey, Shuqiao Sun and Brenden Timpe","This paper evaluates the long-run effects of Head Start using large-scale, restricted administrative data. Using the county roll-out of Head Start between 1965 and 1980 and age-eligibility cutoffs for school entry, we find that Head Start generated large increases in adult human capital and economic self-sufficiency, including a 0.65-year increase in schooling, a 2.7 percent increase in high school completion, an 8.5 percent increase in college enrollment, and a 39 percent increase in college completion. These estimates imply sizable, long-term returns to investments in means-tested, public preschool programs.",https://www.aeaweb.org/doi/10.1257/aer.20181801
American Economic Review,2021,M Equilibrium: A Theory of Beliefs and Choices in Games,Jacob K. Goeree and Philippos Louis,"We introduce a set-valued solution concept, M equilibrium, to capture empirical regularities from over half a century of game theory experiments. We show M equilibrium serves as a meta theory for various models that hitherto were considered unrelated. M equilibrium is empirically robust and, despite being set-valued, falsifiable. Results from a series of experiments that compare M equilibrium to leading behavioral game theory models demonstrate its virtues in predicting observed choices and stated beliefs. Data from experimental games with a unique pure-strategy Nash equilibrium and multiple M equilibria exhibit coordination problems that could not be anticipated through the lens of existing models.",https://www.aeaweb.org/doi/10.1257/aer.20201683
American Economic Review,2021,Delegation in Veto Bargaining,"Navin Kartik, Andreas Kleiner and Richard Van Weelden","A proposer requires a veto player's approval to change a status quo. Proposer is uncertain about Vetoer's preferences. We show that Vetoer is typically given a non-singleton menu, or delegation set, of options to pick from. The optimal set balances the extent of compromise with the risk of a veto. We identify conditions for certain delegation sets to emerge, including ""full delegation"": Vetoer can choose any action between the status quo and Proposer's ideal action. By contrast to expertise-based delegation, Proposer gives less discretion to Vetoer when their preferences are more (likely to be) aligned.",https://www.aeaweb.org/doi/10.1257/aer.20201817
American Economic Review,2021,Synthetic Difference-in-Differences,"Dmitry Arkhangelsky, Susan Athey, David A. Hirshberg, Guido Imbens and Stefan Wager","We present a new estimator for causal effects with panel data that builds on insights behind the widely used difference-in-differences and synthetic control methods. Relative to these methods we find, both theoretically and empirically, that this ""synthetic difference-in-differences"" estimator has desirable robustness properties, and that it performs well in settings where the conventional estimators are commonly used in practice. We study the asymptotic behavior of the estimator when the systematic part of the outcome model includes latent unit factors interacted with latent time factors, and we present conditions for consistency and asymptotic normality.",https://www.aeaweb.org/doi/10.1257/aer.20190159
American Economic Review,2021,"Market Entry, Fighting Brands, and Tacit Collusion: Evidence from the French Mobile Telecommunications Market","Marc Bourreau, Yutec Sun and Frank Verboven","We study a major new entry in the French mobile telecommunications market, followed by the introduction of fighting brands by the three incumbents. Using an empirical oligopoly model, we find that the incumbents' fighting brand strategies are difficult to rationalize as unilateral best responses. Instead, their strategies are consistent with a breakdown of tacit semi-collusion: before entry, the incumbents could successfully coordinate on restricting product variety to avoid cannibalization; after entry, this outcome became harder to sustain because of increased business stealing incentives. Consumers gained considerably from the added variety and, to a lesser extent, from the incumbents' price responses.",https://www.aeaweb.org/doi/10.1257/aer.20190540
American Economic Review,2021,Bargaining under the Illusion of Transparency,Kristóf Madarász,"This paper studies bargaining with noncommon priors where the buyer projects and exaggerates the probability that her private information may leak to the seller. Letting the buyer name her price first, raises the seller's payoff above his payoff from posting a price. In seller-offer bargaining, projection implies a partial reversal of classic Coasian comparative static results. Weakening price commitment can benefit the seller and, as long as the relative speed at which imaginary information versus offers arrive does not converge to zero too quickly, frictionless bargaining converges to a fast haggling process which allows the seller to extract all surplus from trade. Bargaining under common prior transparency is instead slow and becomes equivalent to simply waiting. The comparative static predictions are consistent with experimental evidence.",https://www.aeaweb.org/doi/10.1257/aer.20150004
American Economic Review,2021,Naïve Learning with Uninformed Agents,"Abhijit Banerjee, Emily Breza, Arun G. Chandrasekhar and Markus Mobius","The DeGroot model has emerged as a credible alternative to the standard Bayesian model for studying learning on networks, offering a natural way to model naïve learning in a complex setting. One unattractive aspect of this model is the assumption that the process starts with every node in the network having a signal. We study a natural extension of the DeGroot model that can deal with sparse initial signals. We show that an agent's social influence in this generalized DeGroot model is essentially proportional to the degree-weighted share of uninformed nodes who will hear about an event for the first time via this agent. This characterization result then allows us to relate network geometry to information aggregation. We show information aggregation preserves ""wisdom"" in the sense that initial signals are weighed approximately equally in a model of network formation that captures the sparsity, clustering, and small-world properties of real-world networks. We also identify an example of a network structure where essentially only the signal of a single agent is aggregated, which helps us pinpoint a condition on the network structure necessary for almost full aggregation. Simulating the modeled learning process on a set of real-world networks, we find that there is on average 22.4 percent information loss in these networks. We also explore how correlation in the location of seeds can exacerbate aggregation failure. Simulations with real-world network data show that with clustered seeding, information loss climbs to 34.4 percent.",https://www.aeaweb.org/doi/10.1257/aer.20181151
American Economic Review,2021,"Incentive Constrained Risk Sharing, Segmentation, and Asset Pricing","Bruno Biais, Johan Hombert and Pierre-Olivier Weill","Incentive problems make securities' payoffs imperfectly pledgeable, limiting agents' ability to issue liabilities. We analyze the equilibrium consequences of such endogenous incompleteness in a dynamic exchange economy. Because markets are endogenously incomplete, agents have different intertemporal marginal rates of substitution, so that they value assets differently. Consequently, agents hold different portfolios. This leads to endogenous markets segmentation, which we characterize with optimal transport methods. Moreover, there is a basis going always in the same direction: the price of a security is lower than that of replicating portfolios of long positions. Finally, equilibrium expected returns are concave in factor loadings.",https://www.aeaweb.org/doi/10.1257/aer.20181707
American Economic Review,2021,Venting Out: Exports during a Domestic Slump,"Miguel Almunia, Pol Antràs, David Lopez-Rodriguez and Eduardo Morales","We study the relationship between domestic-demand shocks and exports using data for Spanish manufacturing firms in 2002–2013. Exploiting plausibly exogenous geographical variation caused by the Great Recession, we find that firms whose domestic sales declined by more experienced a larger increase in export flows, controlling for firms' supply determinants. This result illustrates the capacity of export markets to counteract the negative impact of local demand shocks. By structurally estimating a heterogeneous-firm model of exporting with nonconstant marginal costs of production, we conclude that these firm-level responses accounted for half of the spectacular increase in Spanish goods exports over the period 2009–2013.",https://www.aeaweb.org/doi/10.1257/aer.20181853
American Economic Review,2021,The Causal Interpretation of Two-Stage Least Squares with Multiple Instrumental Variables,"Magne Mogstad, Alexander Torgovitsky and Christopher Walters","Empirical researchers often combine multiple instrumental variables (IVs) for a single treatment using two-stage least squares (2SLS). When treatment effects are heterogeneous, a common justification for including multiple IVs is that the 2SLS estimand can be given a causal interpretation as a positively weighted average of local average treatment effects (LATEs). This justification requires the well-known monotonicity condition. However, we show that with more than one instrument, this condition can only be satisfied if choice behavior is effectively homogeneous. Based on this finding, we consider the use of multiple IVs under a weaker, partial monotonicity condition. We characterize empirically verifiable sufficient and necessary conditions for the 2SLS estimand to be a positively weighted average of LATEs under partial monotonicity. We apply these results to an empirical analysis of the returns to college with multiple instruments. We show that the standard monotonicity condition is at odds with the data. Nevertheless, our empirical checks reveal that the 2SLS estimate retains a causal interpretation as a positively weighted average of the effects of college attendance among complier groups.",https://www.aeaweb.org/doi/10.1257/aer.20190221
American Economic Review,2021,Constrained Pseudo-Market Equilibrium,"Federico Echenique, Antonio Miralles and Jun Zhang","We propose a pseudo-market solution to resource allocation problems subject to constraints. Our treatment of constraints is general: including bihierarchical constraints due to considerations of diversity in school choice, or scheduling in course allocation; and other forms of constraints needed to model, for example, the market for roommates, combinatorial assignment problems, and knapsack constraints. Constraints give rise to pecuniary externalities, which are internalized via prices. Agents pay to the extent that their purchases affect the value the of relevant constraints at equilibrium prices. The result is a constrained-efficient market-equilibrium outcome. The outcome is fair to the extent that constraints treat agents symmetrically.",https://www.aeaweb.org/doi/10.1257/aer.20201769
American Economic Review,2021,Labor Supply Responses to Learning the Tax and Benefit Schedule,Andreas R. Kostøl and Andreas Myhre,"Despite the implications for policy, empirical evidence on the relative importance of factors that shape labor supply responses is missing. This paper helps fill this gap and quantifies the role of information frictions versus other frictions by combining notches in the Norwegian welfare system and quasi-experimental variation in access to information about the slope and location of kinks. While we estimate a frictionless elasticity of 0.3, overall frictions attenuate this elasticity by about 70 percent. We find the information letter increased the earnings elasticity from 0.06 to 0.15, implying that information frictions account for at least 30 percent of total attenuation.",https://www.aeaweb.org/doi/10.1257/aer.20201877
American Economic Review,2021,The Intergenerational Effects of a Large Wealth Shock: White Southerners after the Civil War,"Philipp Ager, Leah Boustan and Katherine Eriksson","The nullification of slave wealth after the US Civil War (1861–1865) was one of the largest episodes of wealth compression in history. We document that White Southern households that owned more slaves in 1860 lost substantially more wealth by 1870, relative to Southern households that had been equally wealthy before the war. Yet, their sons almost entirely recovered from this wealth shock by 1900, and their grandsons completely converged by 1940. Marriage networks and connections to other elite families may have aided in recovery, whereas transmission of entrepreneurship and skills appear less central.",https://www.aeaweb.org/doi/10.1257/aer.20191422
American Economic Review,2021,Jobs for Sale: Corruption and Misallocation in Hiring,Jeffrey Weaver,"Corrupt government hiring is common in developing countries. This paper uses original data to document the operation and consequences of corrupt hiring in a health bureaucracy. Hires pay bribes averaging 17 months of salary, but contrary to conventional wisdom, their observable quality is comparable to counterfactual merit-based hires. Exploiting variation across jobs, I show that the consequences of corrupt allocations depend on the correlation between wealth and quality among applicants: service delivery outcomes are good for jobs where this was positive and poor when negative. In this setting, the correlation was typically positive, leading to relatively good performance of hires.",https://www.aeaweb.org/doi/10.1257/aer.20201062
American Economic Review,2021,Oligopolistic Price Leadership and Mergers: The United States Beer Industry,"Nathan H. Miller, Gloria Sheu and Matthew C. Weinberg","We study a repeated game of price leadership in which a firm proposes supermarkups over Bertrand prices to a coalition of rivals. Supermarkups and marginal costs are recoverable from data on prices and quantities using the model's structure. In an application to the beer industry, we find that price leadership increases profit relative to Bertrand competition by 17 percent in fiscal years 2006 and 2007, and by 22 percent in 2010 and 2011, with the change mostly due to consolidation. We simulate two mergers, which relax binding incentive compatibility constraints and increase supermarkups. These coordinated effects arise even with efficiencies that offset price increases under Bertrand competition.",https://www.aeaweb.org/doi/10.1257/aer.20190913
American Economic Review,2021,"Mistakes, Overconfidence, and the Effect of Sharing on Detecting Lies",Marta Serra-Garcia and Uri Gneezy,"Mistakes and overconfidence in detecting lies could help lies spread. Participants in our experiments observe videos in which senders either tell the truth or lie, and are incentivized to distinguish between them. We find that participants fail to detect lies, but are overconfident about their ability to do so. We use these findings to study the determinants of sharing and its effect on lie detection, finding that even when incentivized to share truthful videos, participants are more likely to share lies. Moreover, the receivers are more likely to believe shared videos. Combined, the tendency to believe lies increases with sharing.",https://www.aeaweb.org/doi/10.1257/aer.20191295
American Economic Review,2021,Labor Rationing,"Emily Breza, Supreet Kaur and Yogita Shamdasani","This paper measures excess labor supply in equilibrium. We induce hiring shocks—which employ 24 percent of the labor force in external month-long jobs—in Indian local labor markets. In peak months, wages increase instantaneously and local aggregate employment declines. In lean months, consistent with severe labor rationing, wages and aggregate employment are unchanged, with positive employment spillovers on remaining workers, indicating that over a quarter of labor supply is rationed. At least 24 percent of lean self-employment among casual workers occurs because they cannot find jobs. Consequently, traditional survey approaches mismeasure labor market slack. Rationing has broad implications for labor market analysis.",https://www.aeaweb.org/doi/10.1257/aer.20201385
American Economic Review,2021,Neighborhood-Based Information Costs,Benjamin Hebert and Michael Woodford,"We derive a new cost of information in rational inattention problems, the neighborhood-based cost functions, starting from the observation that many settings involve exogenous states with a topological structure. These cost functions are uniformly posterior separable and capture notions of perceptual distance. This second property ensures that neighborhood-based costs, unlike mutual information, make accurate predictions about behavior in perceptual experiments. We compare the implications of our neighborhood-based cost functions with those of the mutual information in a series of applications: perceptual judgments, the general environment of binary choice, regime-change games, and linear-quadratic-Gaussian settings.",https://www.aeaweb.org/doi/10.1257/aer.20200154
American Economic Review,2021,Projection of Private Values in Auctions,"Tristan Gagnon-Bartsch, Marco Pagnozzi and Antonio Rosato","We explore how taste projection—the tendency to overestimate how similar others' tastes are to one's own—affects bidding in auctions. In first-price auctions with private values, taste projection leads bidders to exaggerate the intensity of competition and, consequently, to overbid—irrespective of whether values are independent, affiliated, or (a)symmetric. Moreover, the optimal reserve price is lower than the rational benchmark, and decreasing in the extent of projection and the number of bidders. With an uncertain common-value component, projecting bidders draw distorted inferences about others' information. This misinference is stronger in second-price and English auctions, reducing their allocative efficiency compared to first-price auctions.",https://www.aeaweb.org/doi/10.1257/aer.20200988
American Economic Review,2021,From Mad Men to Maths Men: Concentration and Buyer Power in Online Advertising,Francesco Decarolis and Gabriele Rovigatti,"This paper analyzes the impact of intermediary concentration on the allocation of revenue in online platforms. We study sponsored search documenting how advertisers increasingly bid through a handful of specialized intermediaries. This enhances automated bidding and data pooling, but lessens competition whenever the intermediary represents competing advertisers. Using data on nearly 40 million Google keyword auctions, we first apply machine learning algorithms to cluster keywords into thematic groups serving as relevant markets. Using an instrumental variable strategy, we estimate a decline in the platform's revenue of approximately 11 percent due to the average rise in concentration associated with intermediary merger and acquisition activity.",https://www.aeaweb.org/doi/10.1257/aer.20190811
American Economic Review,2021,The Effect of High-Tech Clusters on the Productivity of Top Inventors,Enrico Moretti,"The high-tech sector is concentrated in a small number of cities. The ten largest clusters in computer science, semiconductors, and biology account for 69 percent, 77 percent, and 59 percent of all US inventors, respectively. Using longitudinal data on 109,846 inventors, I find that geographical agglomeration results in significant productivity gains. When an inventor moves to a city with a large cluster of inventors in the same field, she experiences a sizable increase in the number and quality of patents produced. The presence of significant productivity externalities implies that the agglomeration of inventors generates large gains in the aggregate amount of innovation produced in the United States.",https://www.aeaweb.org/doi/10.1257/aer.20191277
American Economic Review,2021,Quantifying the Supply Response of Private Schools to Public Policies,Michael Dinerstein and Troy D. Smith,"School policies that cause a large demand shift between public and private schooling may cause some private schools to enter or exit the market. We study how the policy effects differ under a fixed versus changing market structure in the context of a public school funding reform in New York City. We find evidence of a reduction in private schools in response to the reform. Using a model of demand for and supply of private schooling, we estimate that 20 percent of the reform's effect on school enrollments came from increased private school exit and reduced private school entry.",https://www.aeaweb.org/doi/10.1257/aer.20151723
American Economic Review,2021,Assortative Matching or Exclusionary Hiring? The Impact of Employment and Pay Policies on Racial Wage Differences in Brazil,"Francois Gerard, Lorenzo Lagos, Edson Severnini and David Card","We measure the effects of firm policies on racial pay differences in Brazil. Non-Whites are less likely to be hired by high-wage firms, explaining about 20 percent of the racial wage gap for both genders. Firm-specific pay premiums for non-Whites are also compressed relative to Whites, contributing another 5 percent for that gap. A counterfactual analysis reveals that about two-thirds of the underrepresentation of non-Whites at higher-wage firms is explained by race-neutral skill-based sorting. Non-skill-based sorting and differential wage setting are largest for college-educated workers, suggesting that the allocative costs of discriminatory hiring and pay policies may be relatively large in Brazil.",https://www.aeaweb.org/doi/10.1257/aer.20181596
