journal,year,title,authors,abstract,url
Biometrika,2024,On propensity score matching with a diverging number of matches,Yihui He and Fang Han,"This paper re-examines the work of Abadie & Imbens (2016) on propensity score matching for average treatment effect estimation. We explore the asymptotic behaviour of these estimators when the number of nearest neighbours, M, grows with the sample size. It is shown, while not surprising, but technically nontrivial, that the modified estimators can improve upon the original fixed M-estimators in terms of efficiency. Additionally, we demonstrate the potential to attain the semiparametric efficiency lower bound when the propensity score admits some special structures, echoing the insight of Hahn (1998).",http://hdl.handle.net/10.1093/biomet/asae026
Biometrika,2024,Sharp symbolic nonparametric bounds for measures of benefit in observational and imperfect randomized studies with ordinal outcomes,"Erin E Gabriel, Michael C Sachs and Andreas Kryger Jensen","The probability of benefit can be a valuable and meaningful measure of treatment effect. Particularly for an ordinal outcome, it can have an intuitive interpretation. Unfortunately, this measure, and variations of it, are not identifiable even in randomized trials with perfect compliance. There is, for this reason, a long literature on nonparametric bounds for unidentifiable measures of benefit. These have primarily focused on perfect randomized trial settings and one or two specific estimands. We expand these bounds to observational settings with unmeasured confounders and imperfect randomized trials for all three estimands considered in the literature: the probability of benefit, the probability of no harm and the relative treatment effect.",http://hdl.handle.net/10.1093/biomet/asae020
Biometrika,2024,Inference for partial correlations of a multivariate Gaussian time series,"A S Dilernia, M Fiecas and L Zhang","We derive an asymptotic joint distribution and novel covariance estimator for the partial correlations of a multivariate Gaussian time series under mild regularity conditions. Using our derived asymptotic distribution, we develop a Wald confidence interval and testing procedure for inference of individual partial correlations for time series data. Through simulation we demonstrate that our proposed confidence interval attains higher coverage rates and our testing procedure achieves false positive rates closer to the nominal levels than approaches that assume independent observations when autocorrelation is present.",http://hdl.handle.net/10.1093/biomet/asae012
Biometrika,2024,Selective conformal inference with false coverage-statement rate control,"Yajie Bao, Yuyang Huo, Haojie Ren and Changliang Zou","SUMMARYConformal inference is a popular tool for constructing prediction intervals. We consider here the scenario of post-selection/selective conformal inference, that is, prediction intervals are reported only for individuals selected from unlabelled test data. To account for multiplicity, we develop a general split conformal framework to construct selective prediction intervals with the false coverage-statement rate control. We first investigate the false coverage rate–adjusted method of Benjamini & Yekutieli (2005) in the present setting, and show that it is able to achieve false coverage-statement rate control, but yields uniformly inflated prediction intervals. We then propose a novel solution to the problem called selective conditional conformal prediction. Our method performs selection procedures on both the calibration set and test set, and then constructs conformal prediction intervals for the selected test candidates with the aid of the conditional empirical distribution obtained by the post-selection calibration set. When the selection rule is exchangeable, we show that our proposed method can exactly control the false coverage-statement rate in a model-free and distribution-free guarantee. For nonexchangeable selection procedures involving the calibration set, we provide non-asymptotic bounds for the false coverage-statement rate under mild distributional assumptions. Numerical results confirm the effectiveness and robustness of our method under false coverage-statement rate control and show that it achieves more narrowed prediction intervals over existing methods across various settings.",http://hdl.handle.net/10.1093/biomet/asae010
Biometrika,2024,Central limit theorems for local network statistics,P A Maugis,"SummarySubgraph counts, in particular the number of occurrences of small shapes such as triangles, characterize properties of random networks. As a result, they have seen wide use as network summary statistics. Subgraphs are typically counted globally, making existing approaches unable to describe vertex-specific characteristics. In contrast, rooted subgraphs focus on vertex neighbourhoods, and are fundamental descriptors of local network properties. We derive the asymptotic joint distribution of rooted subgraph counts in inhomogeneous random graphs, a model that generalizes most statistical network models. This result enables a shift in the statistical analysis of graphs, from estimating network summaries to estimating models linking local network structure and vertex-specific covariates. As an example, we consider a school friendship network and show that gender and race are significant predictors of local friendship patterns.",http://hdl.handle.net/10.1093/biomet/asad080
Biometrika,2024,Generalized kernel two-sample tests,Hoseung Song and Hao Chen,"SummaryKernel two-sample tests have been widely used for multivariate data to test equality of distributions. However, existing tests based on mapping distributions into a reproducing kernel Hilbert space mainly target specific alternatives and do not work well for some scenarios when the dimension of the data is moderate to high due to the curse of dimensionality. We propose a new test statistic that makes use of a common pattern under moderate and high dimensions and achieves substantial power improvements over existing kernel two-sample tests for a wide range of alternatives. We also propose alternative testing procedures that maintain high power with low computational cost, offering easy off-the-shelf tools for large datasets. The new approaches are compared to other state-of-the-art tests under various settings and show good performance. We showcase the new approaches through two applications: the comparison of musks and nonmusks using the shape of molecules, and the comparison of taxi trips starting from John F. Kennedy airport in consecutive months. All proposed methods are implemented in an R package kerTests.",http://hdl.handle.net/10.1093/biomet/asad068
Biometrika,2024,Graphical tools for selecting conditional instrumental sets,"L Henckel, M Buttenschoen and M H Maathuis","SummaryWe consider the efficient estimation of total causal effects in the presence of unmeasured confounding using conditional instrumental sets. Specifically, we consider the two-stage least-squares estimator in the setting of a linear structural equation model with correlated errors that is compatible with a known acyclic directed mixed graph. To set the stage for our results, we characterize the class of linearly valid conditional instrumental sets that yield consistent two-stage least-squares estimators for the target total effect and derive a new asymptotic variance formula for these estimators. Equipped with these results, we provide three graphical tools for selecting more efficient linearly valid conditional instrumental sets: first, a graphical criterion that, for certain pairs of linearly valid conditional instrumental sets, identifies which of the two corresponding estimators has the smaller asymptotic variance second, an algorithm that greedily adds covariates that reduce the asymptotic variance to a given linearly valid conditional instrumental set and, third, a linearly valid conditional instrumental set for which the corresponding estimator has the smallest asymptotic variance that can be ensured with a graphical criterion.",http://hdl.handle.net/10.1093/biomet/asad066
Biometrika,2024,Doubly robust estimation under covariate-induced dependent left truncation,"Yuyao Wang, Andrew Ying and Ronghui Xu","SummaryIn prevalent cohort studies with follow-up, the time-to-event outcome is subject to left truncation leading to selection bias. For estimation of the distribution of the time to event, conventional methods adjusting for left truncation tend to rely on the quasi-independence assumption that the truncation time and the event time are independent on the observed region. This assumption is violated when there is dependence between the truncation time and the event time, possibly induced by measured covariates. Inverse probability of truncation weighting can be used in this case, but it is sensitive to misspecification of the truncation model. In this work, we apply semiparametric theory to find the efficient influence curve of the expectation of an arbitrarily transformed survival time in the presence of covariate-induced dependent left truncation. We then use it to construct estimators that are shown to enjoy double-robustness properties. Our work represents the first attempt to construct doubly robust estimators in the presence of left truncation, which does not fall under the established framework of coarsened data where doubly robust approaches were developed. We provide technical conditions for the asymptotic properties that appear to not have been carefully examined in the literature for time-to-event data, and study the estimators via extensive simulation. We apply the estimators to two datasets from practice, with different right-censoring patterns.",http://hdl.handle.net/10.1093/biomet/asae005
Biometrika,2024,Explicit solutions for the asymptotically optimal bandwidth in cross-validation,Karim M Abadir and Michel Lubrano,"We show that least-squares cross-validation methods share a common structure that has an explicit asymptotic solution, when the chosen kernel is asymptotically separable in bandwidth and data. For density estimation with a multivariate Student-t(ν) kernel, the cross-validation criterion becomes asymptotically equivalent to a polynomial of only three terms. Our bandwidth formulae are simple and noniterative, thus leading to very fast computations, their integrated squared-error dominates traditional cross-validation implementations, they alleviate the notorious sample variability of cross-validation and overcome its breakdown in the case of repeated observations. We illustrate our method with univariate and bivariate applications, of density estimation and nonparametric regressions, to a large dataset of Michigan State University academic wages and experience.",http://hdl.handle.net/10.1093/biomet/asae007
Biometrika,2024,Asymptotically constant risk estimator of the time-average variance constant,K W Chan and C Y Yau,"SummaryEstimation of the time-average variance constant is important for statistical analyses involving dependent data. This problem is difficult as it relies on a bandwidth parameter. Specifically, the optimal choices of the bandwidths of all existing estimators depend on the estimand itself and another unknown parameter that is very difficult to estimate. Thus, optimal variance estimation is unachievable. In this paper, we introduce a concept of converging flat-top kernels for constructing variance estimators whose optimal bandwidths are free of unknown parameters asymptotically and hence can be computed easily. We prove that the new estimator has an asymptotically constant risk and is locally asymptotically minimax.",http://hdl.handle.net/10.1093/biomet/asae003
Biometrika,2024,Efficient nonparametric estimation of Toeplitz covariance matrices,K Klockmann and T Krivobokova,"A new efficient nonparametric estimator for Toeplitz covariance matrices is proposed. This estimator is based on a data transformation that translates the problem of Toeplitz covariance matrix estimation to the problem of mean estimation in an approximate Gaussian regression. The resulting Toeplitz covariance matrix estimator is positive definite by construction, fully data driven and computationally very fast. Moreover, this estimator is shown to be minimax optimal under the spectral norm for a large class of Toeplitz matrices. These results are readily extended to estimation of inverses of Toeplitz covariance matrices. Also, an alternative version of the Whittle likelihood for the spectral density based on the discrete cosine transform is proposed.",http://hdl.handle.net/10.1093/biomet/asae002
Biometrika,2024,On the optimality of score-driven models,"P Gorgi, C S A Lauria and A Luati","SummaryScore-driven models have recently been introduced as a general framework to specify time-varying parameters of conditional densities. The score enjoys stochastic properties that make these models easy to implement and convenient to apply in several contexts, ranging from biostatistics to finance. Score-driven parameter updates have been shown to be optimal in terms of locally reducing a local version of the Kullback–Leibler divergence between the true conditional density and the postulated density of the model. A key limitation of such an optimality property is that it holds only locally both in the parameter space and sample space, yielding to a definition of local Kullback–Leibler divergence that is in fact not a divergence measure. The current paper shows that score-driven updates satisfy stronger optimality properties that are based on a global definition of Kullback–Leibler divergence. In particular, it is shown that score-driven updates reduce the distance between the expected updated parameter and the pseudo-true parameter. Furthermore, depending on the conditional density and the scaling of the score, the optimality result can hold globally over the parameter space, which can be viewed as a generalization of the monotonicity property of the stochastic gradient descent scheme. Several examples illustrate how the results derived in the paper apply to specific models under different easy-to-check assumptions, and provide a formal method to select the link function and the scaling of the score.",http://hdl.handle.net/10.1093/biomet/asad067
Biometrika,2024,Phylogenetic association analysis with conditional rank correlation,"Shulei Wang, Bo Yuan, T Tony Cai and Hongzhe Li","SummaryPhylogenetic association analysis plays a crucial role in investigating the correlation between microbial compositions and specific outcomes of interest in microbiome studies. However, existing methods for testing such associations have limitations related to the assumption of a linear association in high-dimensional settings and the handling of confounding effects. Hence, there is a need for methods capable of characterizing complex associations, including nonmonotonic relationships. This article introduces a novel phylogenetic association analysis framework and associated tests to address these challenges by employing conditional rank correlation as a measure of association. The proposed tests account for confounders in a fully nonparametric manner, ensuring robustness against outliers and the ability to detect diverse dependencies. The proposed framework aggregates conditional rank correlations for subtrees using weighted sum and maximum approaches to capture both dense and sparse signals. The significance level of the test statistics is determined by calibration through a nearest-neighbour bootstrapping method, which is straightforward to implement and can accommodate additional datasets when these are available. The practical advantages of the proposed framework are demonstrated through numerical experiments using both simulated and real microbiome datasets.",http://hdl.handle.net/10.1093/biomet/asad075
Biometrika,2024,Network community detection using higher-order structures,X Yu and J Zhu,"SummaryIn many real-world networks, it is often observed that subgraphs or higher-order structures of certain configurations, e.g., triangles and by-fans, are overly abundant compared to standard randomly generated networks (Milo et al., 2002). However, statistical models accounting for this phenomenon are limited, especially when community structure is of interest. This limitation is coupled with a lack of community detection methods that leverage subgraphs or higher-order structures. In this paper, we propose a new community detection method that effectively uses higher-order structures in a network. Furthermore, for the community detection accuracy, under an edge-dependent network model that consists of both community and triangle structures, we develop a finite-sample error bound characterized by the expected triangle degree, which leads to the consistency of the proposed method. To the best of our knowledge, this is the first statistical error bound and consistency result for community detection of a single network considering a network model with dependent edges. We also show, in both simulation studies and a real-world data example, that our method unveils network communities that are otherwise invisible to methods that ignore higher-order structures.",http://hdl.handle.net/10.1093/biomet/asae014
Biometrika,2024,Testing serial independence of object-valued time series,"Feiyu Jiang, Hanjia Gao and Xiaofeng Shao","SummaryWe propose a novel method for testing serial independence of object-valued time series in metric spaces, which are more general than Euclidean or Hilbert spaces. The proposed method is fully nonparametric, free of tuning parameters and can capture all nonlinear pairwise dependence. The key concept used in this paper is the distance covariance in metric spaces, which is extended to the autodistance covariance for object-valued time series. Furthermore, we propose a generalized spectral density function to account for pairwise dependence at all lags and construct a Cramér–von Mises-type test statistic. New theoretical arguments are developed to establish the asymptotic behaviour of the test statistic. A wild bootstrap is also introduced to obtain the critical values of the nonpivotal limiting null distribution. Extensive numerical simulations and two real data applications on cumulative intraday returns and human mortality data are conducted to illustrate the effectiveness and versatility of our proposed test.",http://hdl.handle.net/10.1093/biomet/asad069
Biometrika,2024,Nonparametric priors with full-range borrowing of information,"F Ascolani, B Franzolini, A Lijoi and I Prünster","SummaryModelling of the dependence structure across heterogeneous data is crucial for Bayesian inference, since it directly impacts the borrowing of information. Despite extensive advances over the past two decades, most available methods only allow for nonnegative correlations. We derive a new class of dependent nonparametric priors that can induce correlations of any sign, thus introducing a new and more flexible idea of borrowing of information. This is achieved thanks to a novel concept, which we term hyper-tie, and represents a direct and simple measure of dependence. We investigate prior and posterior distributional properties of the model and develop algorithms to perform posterior inference. Illustrative examples on simulated and real data show that the proposed method outperforms alternatives in terms of prediction and clustering.",http://hdl.handle.net/10.1093/biomet/asad063
Biometrika,2024,Maximum likelihood estimation for semiparametric regression models with interval-censored multistate data,"Yu Gu, Donglin Zeng, Gerardo Heiss and D Y Lin","SummaryInterval-censored multistate data arise in many studies of chronic diseases, where the health status of a subject can be characterized by a finite number of disease states and the transition between any two states is only known to occur over a broad time interval. We relate potentially time-dependent covariates to multistate processes through semiparametric proportional intensity models with random effects. We study nonparametric maximum likelihood estimation under general interval censoring and develop a stable expectation-maximization algorithm. We show that the resulting parameter estimators are consistent and that the finite-dimensional components are asymptotically normal with a covariance matrix that attains the semiparametric efficiency bound and can be consistently estimated through profile likelihood. In addition, we demonstrate through extensive simulation studies that the proposed numerical and inferential procedures perform well in realistic settings. Finally, we provide an application to a major epidemiologic cohort study.",http://hdl.handle.net/10.1093/biomet/asad073
Biometrika,2024,On inference in high-dimensional logistic regression models with separated data,R M Lewis and H S Battey,"SummaryDirect use of the likelihood function typically produces severely biased estimates when the dimension of the parameter vector is large relative to the effective sample size. With linearly separable data generated from a logistic regression model, the loglikelihood function asymptotes and the maximum likelihood estimator does not exist. We show that an exact analysis for each regression coefficient produces half-infinite confidence sets for some parameters when the data are separable. Such conclusions are not vacuous, but an honest portrayal of the limitations of the data. Finite confidence sets are only achievable when additional, perhaps implicit, assumptions are made. Under a notional double-asymptotic regime in which the dimension of the logistic coefficient vector increases with the sample size, the present paper considers the implications of enforcing a natural constraint on the vector of logistic transformed probabilities. We derive a relationship between the logistic coefficients and a notional parameter obtained as a probability limit of an ordinary least-squares estimator. The latter exists even when the data are separable. Consistency is ascertained under weak conditions on the design matrix.",http://hdl.handle.net/10.1093/biomet/asad065
Biometrika,2024,Projective independence tests in high dimensions: the curses and the cures,Yaowu Zhang and Liping Zhu,"SummaryTesting independence between high-dimensional random vectors is fundamentally different from testing independence between univariate random variables. Taking the projection correlation as an example, it suffers from at least three problems. First, it has a high computational complexity of O{n3(p+q)}, where n, p and q are the sample size and dimensions of the random vectors; this limits its usefulness substantially when n is extremely large. Second, the asymptotic null distribution of the projection correlation test is rarely tractable; therefore, random permutations are often suggested as a means of approximating the asymptotic null distribution, which further increases the complexity of implementing independence tests. Third, the power performance of the projection correlation test deteriorates in high dimensions. To address these issues, the projection correlation is improved by using a modified weight function, which reduces the complexity to O{n2(p+q)}. We estimate the improved projection correlation with U-statistic theory. Importantly, its asymptotic null distribution is standard normal, thanks to the high dimesnionality of the random vectors. This expedites the implementation of independence tests substantially. To enhance the power performance in high dimensions, we propose incorporating a cross-validation procedure with feature screening into the projection correlation test. The implementation efficacy and power enhancement are confirmed through extensive numerical studies.",http://hdl.handle.net/10.1093/biomet/asad070
Biometrika,2024,Familial inference: tests for hypotheses on a family of centres,"Ryan Thompson, Catherine S Forbes, Steven N MacEachern and Mario Peruggia","SummaryStatistical hypotheses are translations of scientific hypotheses into statements about one or more distributions, often concerning their centre. Tests that assess statistical hypotheses of centre implicitly assume a specific centre, e.g., the mean or median. Yet, scientific hypotheses do not always specify a particular centre. This ambiguity leaves the possibility for a gap between scientific theory and statistical practice that can lead to rejection of a true null. In the face of replicability crises in many scientific disciplines, significant results of this kind are concerning. Rather than testing a single centre, this paper proposes testing a family of plausible centres, such as that induced by the Huber loss function. Each centre in the family generates a testing problem, and the resulting family of hypotheses constitutes a familial hypothesis. A Bayesian nonparametric procedure is devised to test familial hypotheses, enabled by a novel pathwise optimization routine to fit the Huber family. The favourable properties of the new test are demonstrated theoretically and experimentally. Two examples from psychology serve as real-world case studies.",http://hdl.handle.net/10.1093/biomet/asad074
