journal,year,title,authors,abstract,url
Biometrika,2024,An eigenvector-assisted estimation framework for signal-plus-noise matrix models,Fangzheng Xie and Dingbo Wu,"SummaryIn this paper, we develop an eigenvector-assisted estimation framework for a collection of signal-plus-noise matrix models arising in high-dimensional statistics and many applications. The framework is built upon a novel asymptotically unbiased estimating equation using the leading eigenvectors of the data matrix. However, the estimator obtained by directly solving the estimating equation could be numerically unstable in practice and lacks robustness against model misspecification. We propose to use the quasi-posterior distribution by exponentiating a criterion function whose maximizer coincides with the estimating equation estimator. The proposed framework can incorporate heteroskedastic variance information, but does not require the complete specification of the sampling distribution and is also robust to the potential misspecification of the distribution of the noise matrix. Computationally, the quasi-posterior distribution can be obtained via a Markov chain Monte Carlo sampler, which exhibits superior numerical stability over some of the existing optimization-based estimators and is straightforward for uncertainty quantification. Under mild regularity conditions, we establish the large sample properties of the quasi-posterior distributions. In particular, the quasi-posterior credible sets have the correct frequentist nominal coverage probability provided that the criterion function is carefully selected. The validity and usefulness of the proposed framework are demonstrated through the analysis of synthetic datasets and the real-world ENZYMES network datasets.",http://hdl.handle.net/10.1093/biomet/asad058
Biometrika,2024,An anomaly arising in the analysis of processes with more than one source of variability,H S Battey and Peter McCullagh,"SummaryIt is frequently observed in practice that the Wald statistic gives a poor assessment of the statistical significance of a variance component. This paper provides detailed analytic insight into the phenomenon by way of two simple models, which point to an atypical geometry as the source of the aberration. The latter can in principle be checked numerically to cover situations of arbitrary complexity, such as those arising from elaborate forms of blocking in an experimental context, or models for longitudinal or clustered data. The salient point, echoing Dickey (2020), is that a suitable likelihood-ratio test should always be used for the assessment of variance components.",http://hdl.handle.net/10.1093/biomet/asad044
Biometrika,2024,Covariate-adjusted log-rank test: guaranteed efficiency gain and universal applicability,"Ting Ye, Jun Shao and Yanyao Yi","SummaryNonparametric covariate adjustment is considered for log-rank-type tests of the treatment effect with right-censored time-to-event data from clinical trials applying covariate-adaptive randomization. Our proposed covariate-adjusted log-rank test has a simple explicit formula and a guaranteed efficiency gain over the unadjusted test. We also show that our proposed test achieves universal applicability in the sense that the same formula of test can be universally applied to simple randomization and all commonly used covariate-adaptive randomization schemes such as the stratified permuted block and the Pocock–Simon minimization, which is not a property enjoyed by the unadjusted log-rank test. Our method is supported by novel asymptotic theory and empirical results for Type-I error and power of tests.",http://hdl.handle.net/10.1093/biomet/asad045
Biometrika,2024,Deep Kronecker network,Long Feng and Guang Yang,"SummaryWe develop a novel framework for the analysis of medical imaging data, including magnetic resonance imaging, functional magnetic resonance imaging, computed tomography and more. Medical imaging data differ from general images in two main aspects: (i) the sample size is often considerably smaller and (ii) the interpretation of the model is usually more crucial than predicting the outcome. As a result, standard methods such as convolutional neural networks cannot be directly applied to medical imaging analysis. Therefore, we propose the deep Kronecker network, which can adapt to the low sample size constraint and offer the desired model interpretation. Our approach is versatile, as it works for both matrix- and tensor-represented image data and can be applied to discrete and continuous outcomes. The deep Kronecker network is built upon a Kronecker product structure, which implicitly enforces a piecewise smooth property on coefficients. Moreover, our approach resembles a fully convolutional network as the Kronecker structure can be expressed in a convolutional form. Interestingly, our approach also has strong connections to the tensor regression framework proposed by Zhou et al. (2013), which imposes a canonical low-rank structure on tensor coefficients. We conduct both classification and regression analyses using real magnetic resonance imaging data from the Alzheimer’s Disease Neuroimaging Initiative to demonstrate the effectiveness of our approach.",http://hdl.handle.net/10.1093/biomet/asad049
Biometrika,2024,Kernel interpolation generalizes poorly,"Yicheng Li, Haobo Zhang and Qian Lin","SummaryOne of the most interesting problems in the recent renaissance of the studies in kernel regression might be whether kernel interpolation can generalize well, since it may help us understand the ‘benign overfitting phenomenon’ reported in the literature on deep networks. In this paper, under mild conditions, we show that, for any ε>0, the generalization error of kernel interpolation is lower bounded by Ω(n−ε). In other words, the kernel interpolation generalizes poorly for a large class of kernels. As a direct corollary, we can show that overfitted wide neural networks defined on the sphere generalize poorly.",http://hdl.handle.net/10.1093/biomet/asad048
Biometrika,2024,Causal inference with misspecified exposure mappings: separating definitions and assumptions,F Sävje,"SummaryExposure mappings facilitate investigations of complex causal effects when units interact in experiments. Current methods require experimenters to use the same exposure mappings to define the effect of interest and to impose assumptions on the interference structure. However, the two roles rarely coincide in practice, and experimenters are forced to make the often questionable assumption that their exposures are correctly specified. This paper argues that the two roles exposure mappings currently serve can, and typically should, be separated, so that exposures are used to define effects without necessarily assuming that they are capturing the complete causal structure in the experiment. The paper shows that this approach is practically viable by providing conditions under which exposure effects can be precisely estimated when the exposures are misspecified. Some important questions remain open.",http://hdl.handle.net/10.1093/biomet/asad019
Biometrika,2024,Discussion of ‘Causal inference with misspecified exposure mappings: separating definitions and assumptions’,Michael Leung,,http://hdl.handle.net/10.1093/biomet/asad040
Biometrika,2024,Discussion of ‘Causal inference with misspecified exposure mappings: separating definitions and assumptions’,"Eric Auerbach, Jonathan Auerbach and Max Tabord-Meehan",,http://hdl.handle.net/10.1093/biomet/asad054
Biometrika,2024,Rejoinder: Causal inference with misspecified exposure mappings: separating definitions and assumptions,F Sävje,,http://hdl.handle.net/10.1093/biomet/asad071
Biometrika,2024,A linear adjustment-based approach to posterior drift in transfer learning,"Subha Maity, Diptavo Dutta, Jonathan Terhorst, Yuekai Sun and Moulinath Banerjee","SummaryWe present new models and methods for the posterior drift problem where the regression function in the target domain is modelled as a linear adjustment, on an appropriate scale, of that in the source domain, and study the theoretical properties of our proposed estimators in the binary classification problem. The core idea of our model inherits the simplicity and the usefulness of generalized linear models and accelerated failure time models from the classical statistics literature. Our approach is shown to be flexible and applicable in a variety of statistical settings, and can be adopted for transfer learning problems in various domains including epidemiology, genetics and biomedicine. As concrete applications, we illustrate the power of our approach (i) through mortality prediction for British Asians by borrowing strength from similar data from the larger pool of British Caucasians, using the UK Biobank data, and (ii) in overcoming a spurious correlation present in the source domain of the Waterbirds dataset.",http://hdl.handle.net/10.1093/biomet/asad029
Biometrika,2024,Efficient evaluation of natural stochastic policies in off-line reinforcement learning,Nathan Kallus and Masatoshi Uehara,"SummaryWe study the efficient off-policy evaluation of natural stochastic policies, which are defined in terms of deviations from the unknown behaviour policy. This is a departure from the literature on off-policy evaluation that largely considers the evaluation of explicitly specified policies. Crucially, off-line reinforcement learning with natural stochastic policies can help alleviate issues of weak overlap, lead to policies that build upon current practice and improve policies’ implementability in practice. Compared with the classic case of a prespecified evaluation policy, when evaluating natural stochastic policies, the efficiency bound, which measures the best-achievable estimation error, is inflated since the evaluation policy itself is unknown. In this paper we derive the efficiency bounds of two major types of natural stochastic policies: tilting policies and modified treatment policies. We then propose efficient nonparametric estimators that attain the efficiency bounds under lax conditions and enjoy a partial double robustness property.",http://hdl.handle.net/10.1093/biomet/asad059
Biometrika,2024,Universal robust regression via maximum mean discrepancy,P Alquier and M Gerber,"Many modern datasets are collected automatically and are thus easily contaminated by outliers. This has led to a renewed interest in robust estimation, including new notions of robustness such as robustness to adversarial contamination of the data. However, most robust estimation methods are designed for a specific model. Notably, many methods were proposed recently to obtain robust estimators in linear models, or generalized linear models, and a few were developed for very specific settings, for example beta regression or sample selection models. In this paper we develop a new approach for robust estimation in arbitrary regression models, based on maximum mean discrepancy minimization. We build two estimators that are both proven to be robust to Huber-type contamination. For one of them, we obtain a non-asymptotic error bound and show that it is also robust to adversarial contamination, but this estimator is computationally more expensive to use in practice than the other one. As a by-product of our theoretical analysis of the proposed estimators, we derive new results on kernel conditional mean embedding of distributions that are of independent interest.",http://hdl.handle.net/10.1093/biomet/asad031
Biometrika,2024,Online inference with debiased stochastic gradient descent,"Ruijian Han, Lan Luo, Yuanyuan Lin and Jian Huang","SummaryWe propose a debiased stochastic gradient descent algorithm for online statistical inference with high-dimensional data. Our approach combines the debiasing technique developed in high-dimensional statistics with the stochastic gradient descent algorithm. It can be used to construct confidence intervals efficiently in an online fashion. Our proposed algorithm has several appealing aspects: as a one-pass algorithm, it reduces the time complexity; in addition, each update step requires only the current data together with the previous estimate, which reduces the space complexity. We establish the asymptotic normality of the proposed estimator under mild conditions on the sparsity level of the parameter and the data distribution. Numerical experiments demonstrate that the proposed debiased stochastic gradient descent algorithm attains nominal coverage probability. Furthermore, we illustrate our method with analysis of a high-dimensional text dataset.",http://hdl.handle.net/10.1093/biomet/asad046
Biometrika,2024,Hybrid confidence intervals for informative uniform asymptotic inference after model selection,Adam McCloskey,"I propose a new type of confidence interval for correct asymptotic inference after using data to select a model of interest without assuming any model is correctly specified. This hybrid confidence interval is constructed by combining techniques from the selective inference and post-selection inference literatures to yield a short confidence interval across a wide range of data realizations. I show that hybrid confidence intervals have correct asymptotic coverage, uniformly over a large class of probability distributions that do not bound scaled model parameters. I illustrate the use of these confidence intervals in the problem of inference after using the lasso objective function to select a regression model of interest and provide evidence of their desirable length and coverage properties in small samples via a set of Monte Carlo experiments that entail a variety of different data distributions as well as an empirical application to the predictors of diabetes disease progression.",http://hdl.handle.net/10.1093/biomet/asad023
Biometrika,2024,One-step targeted maximum likelihood estimation for targeting cause-specific absolute risks and survival curves,H C W Rytgaard and M J van der Laan,"SummaryThis paper considers the one-step targeted maximum likelihood estimation methodology for multi-dimensional causal parameters in general survival and competing risk settings where event times take place on the positive real line and are subject to right censoring. We focus on effects of baseline treatment decisions possibly confounded by pretreatment covariates, but remark that our work generalizes to settings with time-varying treatment regimes and time-dependent confounding. We point out two overall contributions of our work. First, our methods can be used to obtain simultaneous inference for treatment effects on multiple absolute risks in competing risk settings. Second, our methods can be used to achieve inference for the full survival curve, or a full absolute risk curve, across time. The one-step targeted maximum likelihood procedure is based on a one-dimensional universal least favourable submodel for each cause-specific hazard that we implement in recursive steps along a corresponding nonuniversal multivariate least favourable submodel. Our empirical study demonstrates the practical use of the methods.",http://hdl.handle.net/10.1093/biomet/asad033
Biometrika,2024,Populations of unlabelled networks: graph space geometry and generalized geodesic principal components,"Anna Calissano, Aasa Feragen and Simone Vantini","Statistical analysis for populations of networks is widely applicable, but challenging, as networks have strongly non-Euclidean behaviour. Graph space is an exhaustive framework for studying populations of unlabelled networks that are weighted or unweighted, uni- or multilayered, directed or undirected. Viewing graph space as the quotient of a Euclidean space with respect to a finite group action, we show that it is not a manifold, and that its curvature is unbounded from above. Within this geometrical framework we define generalized geodesic principal components, and we introduce the align-all-and-compute algorithms, all of which allow for the computation of statistics on graph space. The statistics and algorithms are compared with existing methods and empirically validated on three real datasets, showcasing the potential utility of the framework. The whole framework is implemented within the geomstats Python package.",http://hdl.handle.net/10.1093/biomet/asad024
Biometrika,2024,Statistical summaries of unlabelled evolutionary trees,Rajanala Samyak and Julia A Palacios,"SummaryRooted and ranked phylogenetic trees are mathematical objects that are useful in modelling hierarchical data and evolutionary relationships with applications to many fields such as evolutionary biology and genetic epidemiology. Bayesian phylogenetic inference usually explores the posterior distribution of trees via Markov chain Monte Carlo methods. However, assessing uncertainty and summarizing distributions remains challenging for these types of structures. While labelled phylogenetic trees have been extensively studied, relatively less literature exists for unlabelled trees that are increasingly useful, for example when one seeks to summarize samples of trees obtained with different methods, or from different samples and environments, and wishes to assess the stability and generalizability of these summaries. In our paper, we exploit recently proposed distance metrics of unlabelled ranked binary trees and unlabelled ranked genealogies, or trees equipped with branch lengths, to define the Fréchet mean, variance and interquartile sets as summaries of these tree distributions. We provide an efficient combinatorial optimization algorithm for computing the Fréchet mean of a sample or of distributions on unlabelled ranked tree shapes and unlabelled ranked genealogies. We show the applicability of our summary statistics for studying popular tree distributions and for comparing the SARS-CoV-2 evolutionary trees across different locations during the COVID-19 epidemic in 2020. Our current implementations are publicly available at https://github.com/RSamyak/fmatrix.",http://hdl.handle.net/10.1093/biomet/asad025
Biometrika,2024,Bayesian learning of network structures from interventional experimental data,F Castelletti and S Peluso,"SummaryDirected acyclic graphs provide an effective framework for learning causal relationships among variables given multivariate observations. Under pure observational data, directed acyclic graphs encoding the same conditional independencies cannot be distinguished and are collected into Markov equivalence classes. In many contexts, however, observational measurements are supplemented by interventional data that improve directed acyclic graph identifiability and enhance causal effect estimation. We propose a Bayesian framework for multivariate data partially generated after stochastic interventions. To this end, we introduce an effective prior elicitation procedure leading to a closed-form expression for the directed acyclic graph marginal likelihood and guaranteeing score equivalence among directed acyclic graphs that are Markov equivalent post intervention. Under the Gaussian setting, we show, in terms of posterior ratio consistency, that the true network will be asymptotically recovered, regardless of the specific distribution of the intervened variables and of the relative asymptotic dominance between observational and interventional measurements. We validate our theoretical results via simulation and we implement a Markov chain Monte Carlo sampler for posterior inference on the space of directed acyclic graphs on both synthetic and biological protein expression data.",http://hdl.handle.net/10.1093/biomet/asad032
Biometrika,2024,Tailored inference for finite populations: conditional validity and transfer across distributions,Ying Jin and Dominik Rothenhäusler,"SummaryParameters of subpopulations can be more relevant than those of superpopulations. For example, a healthcare provider may be interested in the effect of a treatment plan for a specific subset of their patients; policymakers may be concerned with the impact of a policy in a particular state within a given population. In these cases, the focus is on a specific finite population, as opposed to an infinite superpopulation. Such a population can be characterized by fixing some attributes that are intrinsic to them, leaving unexplained variations like measurement error as random. Inference for a population with fixed attributes can then be modelled as inferring parameters of a conditional distribution. Accordingly, it is desirable that confidence intervals are conditionally valid for the realized population, instead of marginalizing over many possible draws of populations. We provide a statistical inference framework for parameters of finite populations with known attributes. Leveraging the attribute information, our estimators and confidence intervals closely target a specific finite population. When the data are from the population of interest, our confidence intervals attain asymptotic conditional validity, given the attributes, and are shorter than those for superpopulation inference. In addition, we develop procedures to infer parameters of new populations with differing covariate distributions; the confidence intervals are also conditionally valid for the new populations under mild conditions. Our methods extend to situations where the fixed information has a weaker structure or is only partially observed. We demonstrate the validity and applicability of our methods using simulated data and a real-word dataset for predicting car prices.",http://hdl.handle.net/10.1093/biomet/asad022
Biometrika,2024,Treatment effect quantiles in stratified randomized experiments and matched observational studies,Yongchang Su and Xinran Li,"SummaryEvaluating the treatment effect has become an important topic for many applications. However, most existing literature focuses mainly on average treatment effects. When the individual effects are heavy tailed or have outlier values, not only may the average effect not be appropriate for summarizing treatment effects, but also the conventional inference for it can be sensitive and possibly invalid due to poor large-sample approximations. In this paper we focus on quantiles of individual treatment effects, which can be more robust in the presence of extreme individual effects. Moreover, our inference for them is purely randomization based, avoiding any distributional assumptions on the units. We first consider inference in stratified randomized experiments, extending the recent work by Caughey et al. (2021). We show that the computation of valid p-values for testing null hypotheses on quantiles of individual effects can be transformed into instances of the multiple-choice knapsack problem, which can be efficiently solved exactly or slightly conservatively. We then extend our approach to matched observational studies and propose a sensitivity analysis to investigate to what extent our inference on quantiles of individual effects is robust to unmeasured confounding. The proposed randomization inference and sensitivity analysis are simul- taneously valid for all quantiles of individual effects, noting that the analysis for the maximum or minimum individual effect coincides with the conventional analysis assuming constant treatment effects.",http://hdl.handle.net/10.1093/biomet/asad030
Biometrika,2024,A mark-specific quantile regression model,"Lianqiang Qu, Liuquan Sun and Yanqing Sun","SummaryQuantile regression has become a widely used tool for analysing competing risk data. However, quantile regression for competing risk data with a continuous mark is still scarce. The mark variable is an extension of cause of failure in a classical competing risk model where cause of failure is replaced by a continuous mark only observed at uncensored failure times. An example of the continuous mark variable is the genetic distance that measures dissimilarity between the infecting virus and the virus contained in the vaccine construct. In this article, we propose a novel mark-specific quantile regression model. The proposed estimation method borrows strength from data in a neighbourhood of a mark and is based on an induced smoothed estimation equation, which is very different from the existing methods for competing risk data with discrete causes. The asymptotic properties of the resulting estimators are established across mark and quantile continuums. In addition, a mark-specific quantile-type vaccine efficacy is proposed and its statistical inference procedures are developed. Simulation studies are conducted to evaluate the finite sample performances of the proposed estimation and hypothesis testing procedures. An application to the first HIV vaccine efficacy trial is provided.",http://hdl.handle.net/10.1093/biomet/asad039
Biometrika,2024,On geometric convergence for the Metropolis-adjusted Langevin algorithm under simple conditions,Alain Oliviero-Durmus and Éric Moulines,"SummaryWhile the Metropolis-adjusted Langevin algorithm is a popular and widely used Markov chain Monte Carlo method, very few papers derive conditions that ensure its convergence. In particular, to the authors’ knowledge, assumptions that are both easy to verify and guarantee geometric convergence, are still missing. In this work, we establish V-uniformly geometric convergence for the Metropolis-adjusted Langevin algorithm under mild assumptions about the target distribution. Unlike previous work, we only consider tail and smoothness conditions for the potential associated with the target distribution. These conditions are quite common in the Markov chain Monte Carlo literature. Finally, we pay special attention to the dependence of the bounds we derive on the step size of the Euler–Maruyama discretization, which corresponds to the proposed Markov kernel of the Metropolis-adjusted Langevin algorithm.",http://hdl.handle.net/10.1093/biomet/asad060
