journal,year,title,authors,abstract,url
Biometrika,2024,Regression analysis of group-tested current status data,"Shuwei Li, Tao Hu, Lianming Wang, Christopher S McMahan and Joshua M Tebbs","SummaryGroup testing is an effective way to reduce the time and cost associated with conducting large-scale screening for infectious diseases. Benefits are realized through testing pools formed by combining specimens, such as blood or urine, from different individuals. In some studies, individuals are assessed only once and a time-to-event endpoint is recorded, for example, the time until infection. Combining group testing with this type of endpoint results in group-tested current status data (Petito & Jewell, 2016). To analyse these complex data, we propose methods that estimate a proportional hazard regression model based on test outcomes from measuring the pools. A sieve maximum likelihood estimation approach is developed that approximates the cumulative baseline hazard function with a piecewise constant function. To identify the sieve estimator, a computationally efficient expectation-maximization algorithm is derived by using data augmentation. Asymptotic properties of both the parametric and nonparametric components of the sieve estimator are then established by applying modern empirical process theory. Numerical results from simulation studies show that our proposed method performs nominally and has advantages over the corresponding estimation method based on individual testing results. We illustrate our work by analysing a chlamydia dataset collected by the State Hygienic Laboratory at the University of Iowa.",http://hdl.handle.net/10.1093/biomet/asae006
Biometrika,2024,On the failure of the bootstrap for Chatterjee’s rank correlation,Zhexiao Lin and Fang Han,"While researchers commonly use the bootstrap to quantify the uncertainty of an estimator, it has been noticed that the standard bootstrap, in general, does not work for Chatterjee’s rank correlation. In this paper, we provide proof of this issue under an additional independence assumption, and complement our theory with simulation evidence for general settings. Chatterjee’s rank correlation thus falls into a category of statistics that are asymptotically normal, but bootstrap inconsistent. Valid inferential methods in this case are Chatterjee’s original proposal for testing independence and the analytic asymptotic variance estimator of Lin & Han (2022) for more general purposes.[Received on 5 April 2023. Editorial decision on 10 January 2024]",http://hdl.handle.net/10.1093/biomet/asae004
Biometrika,2024,A note on minimax robustness of designs against correlated or heteroscedastic responses,D P Wiens,"We present a result according to which certain functions of covariance matrices are maximized at scalar multiples of the identity matrix. This is used to show that experimental designs that are optimal under an assumption of independent, homoscedastic responses can be minimax robust, in broad classes of alternate covariance structures. In particular, it can justify the common practice of disregarding possible dependence, or heteroscedasticity, at the design stage of an experiment.",http://hdl.handle.net/10.1093/biomet/asae001
Biometrika,2024,Second term improvement to generalized linear mixed model asymptotics,"Luca Maestrini, Aishwarya Bhaskaran and Matt P Wand","A recent article by Jiang et al. (2022) on generalized linear mixed model asymptotics derived the rates of convergence for the asymptotic variances of maximum likelihood estimators. If m denotes the number of groups and n is the average within-group sample size then the asymptotic variances have orders m−1 and (mn)−1, depending on the parameter. We extend this theory to provide explicit forms of the (mn)−1 second terms of the asymptotically harder-to-estimate parameters. Improved accuracy of statistical inference and planning are consequences of our theory.",http://hdl.handle.net/10.1093/biomet/asad072
Biometrika,2024,The state of cumulative sum sequential changepoint testing 70 years after Page,Alexander Aue and Claudia Kirch,"Quality control charts aim at raising an alarm as soon as sequentially obtained observations of an underlying random process no longer seem to be within stochastic fluctuations prescribed by an in-control scenario. Such random processes can often be modelled using the concept of stationarity, or even independence as in most classical works. An important out-of-control scenario is the changepoint alternative, for which the distribution of the process changes at an unknown point in time. In his seminal 1954 Biometrika paper, E. S. Page introduced the famous cumulative sum control charts for changepoint monitoring. Innovatively, decision rules based on cumulative sum procedures took the full history of the process into account, whereas previous procedures were based only on a fixed and typically small number of the most recent observations. The extreme case of using only the most recent observation, often referred to as the Shewhart chart, is more akin to serial outlier than changepoint detection. Page’s cumulative sum approach, introduced seven decades ago, is ubiquitous in modern changepoint analysis, and his original paper has led to a multitude of follow-up papers in different research communities. This review is focused on a particular subfield of this research, namely nonparametric sequential, or online, changepoint tests that are constructed to maintain a desired Type-1 error as opposed to the more traditional approach seeking to minimize the average run length of the procedures. Such tests have originated at the intersection of econometrics and statistics. We trace the development of these tests and highlight their properties, mostly using a simple location model for clarity of exposition, but we also review more complex situations such as regression and time series models.",http://hdl.handle.net/10.1093/biomet/asad079
Biometrika,2024,On selection and conditioning in multiple testing and selective inference,Jelle J Goeman and Aldo Solari,"SummaryWe investigate a class of methods for selective inference that condition on a selection event. Such methods follow a two-stage process. First, a data-driven collection of hypotheses is chosen from some large universe of hypotheses. Subsequently, inference takes place within this data-driven collection, conditioned on the information that was used for the selection. Examples of such methods include basic data splitting as well as modern data-carving methods and post-selection inference methods for lasso coefficients based on the polyhedral lemma. In this article, we take a holistic view of such methods, considering the selection, conditioning and final error control steps together as a single method. From this perspective, we demonstrate that multiple testing methods defined directly on the full universe of hypotheses are always at least as powerful as selective inference methods based on selection and conditioning. This result holds true even when the universe is potentially infinite and only implicitly defined, such as in the case of data splitting. We provide general theory and intuition before investigating in detail several case studies where a shift to a nonselective or unconditional perspective can yield a power gain.",http://hdl.handle.net/10.1093/biomet/asad078
Biometrika,2024,E-values as unnormalized weights in multiple testing,"Nikolaos Ignatiadis, Ruodu Wang and Aaditya Ramdas","SummaryWe study how to combine p-values and e-values, and design multiple testing procedures where both p-values and e-values are available for every hypothesis. Our results provide a new perspective on multiple testing with data-driven weights: while standard weighted multiple testing methods require the weights to deterministically add up to the number of hypotheses being tested, we show that this normalization is not required when the weights are e-values that are independent of the p-values. Such e-values can be obtained in meta-analysis where a primary dataset is used to compute p-values, and an independent secondary dataset is used to compute e-values. Going beyond meta-analysis, we showcase settings wherein independent e-values and p-values can be constructed on a single dataset itself. Our procedures can result in a substantial increase in power, especially if the nonnull hypotheses have e-values much larger than one.",http://hdl.handle.net/10.1093/biomet/asad057
Biometrika,2024,More efficient exact group invariance testing: using a representative subgroup,N W Koning and J Hemerik,"SummaryWe consider testing invariance of a distribution under an algebraic group of transformations, such as permutations or sign flips. As such groups are typically huge, tests based on the full group are often computationally infeasible. Hence, it is standard practice to use a random subset of transformations. We improve upon this by replacing the random subset with a strategically chosen, fixed subgroup of transformations. In a generalized location model, we show that the resulting tests are often consistent for lower signal-to-noise ratios. Moreover, we establish an analogy between the power improvement and switching from a t-test to a Z-test under normality. Importantly, in permutation-based multiple testing, the efficiency gain with our approach can be huge, since we attain the same power with many fewer permutations.",http://hdl.handle.net/10.1093/biomet/asad050
Biometrika,2024,Conformalized survival analysis with adaptive cut-offs,"Yu Gui, Rohan Hore, Zhimei Ren and Rina Foygel Barber","SummaryThis paper introduces an assumption-lean method that constructs valid and efficient lower predictive bounds for survival times with censored data. We build on recent work by Candès et al. (2023), whose approach first subsets the data to discard any data points with early censoring times and then uses a reweighting technique, namely, weighted conformal inference (Tibshirani et al., 2019), to correct for the distribution shift introduced by this subsetting procedure. For our new method, instead of constraining to a fixed threshold for the censoring time when subsetting the data, we allow for a covariate-dependent and data-adaptive subsetting step, which is better able to capture the heterogeneity of the censoring mechanism. As a result, our method can lead to lower predictive bounds that are less conservative and give more accurate information. We show that in the Type-I right-censoring setting, if either the censoring mechanism or the conditional quantile of the survival time is well estimated, our proposed procedure achieves nearly exact marginal coverage, where in the latter case we additionally have approximate conditional coverage. We evaluate the validity and efficiency of our proposed algorithm in numerical experiments, illustrating its advantage when compared with other competing methods. Finally, our method is applied to a real dataset to generate lower predictive bounds for users’ active times on a mobile app.",http://hdl.handle.net/10.1093/biomet/asad076
Biometrika,2024,τ-censored weighted Benjamini–Hochberg procedures under independence,Haibing Zhao and Huijuan Zhou,"In the field of multiple hypothesis testing, auxiliary information can be leveraged to enhance the efficiency of test procedures. A common way to make use of auxiliary information is by weighting p-values. However, when the weights are learned from data, controlling the finite-sample false discovery rate becomes challenging, and most existing weighted procedures only guarantee false discovery rate control in an asymptotic limit. In a recent study conducted by Ignatiadis & Huber (2021), a novel τ-censored weighted Benjamini–Hochberg procedure was proposed to control the finite-sample false discovery rate. The authors employed the cross-weighting approach to learn weights for the p-values. This approach randomly splits the data into several folds and constructs a weight for each p-value Pi using the p-values outside the fold containing Pi. Cross-weighting does not exploit the p-value information inside the fold and only balances the weights within each fold, which may result in a loss of power. In this article, we introduce two methods for constructing data-driven weights for τ-censored weighted Benjamini–Hochberg procedures under independence. They provide new insight into masking p-values to prevent overfitting in multiple testing. The first method utilizes a leave-one-out technique, where all but one of the p-values are used to learn a weight for each p-value. This technique masks the information of a p-value in its weight by calculating the infimum of the weight with respect to the p-value. The second method uses partial information from each p-value to construct weights and utilizes the conditional distributions of the null p-values to establish false discovery rate control. Additionally, we propose two methods for estimating the null proportion and demonstrate how to integrate null-proportion adaptivity into the proposed weights to improve power.",http://hdl.handle.net/10.1093/biomet/asad047
Biometrika,2024,"Kernel methods for causal functions: dose, heterogeneous and incremental response curves","R Singh, L Xu and A Gretton","We propose estimators based on kernel ridge regression for nonparametric causal functions such as dose, heterogeneous and incremental response curves. The treatment and covariates may be discrete or continuous in general spaces. Because of a decomposition property specific to the reproducing kernel Hilbert space, our estimators have simple closed-form solutions. We prove uniform consistency with finite sample rates via an original analysis of generalized kernel ridge regression. We extend our main results to counterfactual distributions and to causal functions identified by front and back door criteria. We achieve state-of-the-art performance in nonlinear simulations with many covariates, and conduct a policy evaluation of the US Job Corps training programme for disadvantaged youths.",http://hdl.handle.net/10.1093/biomet/asad042
Biometrika,2024,Selective machine learning of doubly robust functionals,Y Cui and E J Tchetgen Tchetgen,"SummaryWhile model selection is a well-studied topic in parametric and nonparametric regression or density estimation, selection of possibly high-dimensional nuisance parameters in semiparametric problems is far less developed. In this paper, we propose a selective machine learning framework for making inferences about a finite-dimensional functional defined on a semiparametric model, when the latter admits a doubly robust estimating function and several candidate machine learning algorithms are available for estimating the nuisance parameters. We introduce a new selection criterion aimed at bias reduction in estimating the functional of interest based on a novel definition of pseudo risk inspired by the double robustness property. Intuitively, the proposed criterion selects a pair of learners with the smallest pseudo risk, so that the estimated functional is least sensitive to perturbations of a nuisance parameter. We establish an oracle property for a multi-fold cross-validation version of the new selection criterion that states that our empirical criterion performs nearly as well as an oracle with a priori knowledge of the pseudo risk for each pair of candidate learners. Finally, we apply the approach to model selection of a semiparametric estimator of average treatment effect given an ensemble of candidate machine learners to account for confounding in an observational study that we illustrate in simulations and a data application.",http://hdl.handle.net/10.1093/biomet/asad055
Biometrika,2024,Promises of parallel outcomes,"Ying Zhou, Dingke Tang, Dehan Kong and Linbo Wang","SummaryA key challenge in causal inference from observational studies is the identification and estimation of causal effects in the presence of unmeasured confounding. In this paper, we introduce a novel approach for causal inference that leverages information in multiple outcomes to deal with unmeasured confounding. An important assumption in our approach is conditional independence among multiple outcomes. In contrast to existing proposals in the literature, the roles of multiple outcomes in the conditional independence assumption are symmetric; hence, the name parallel outcomes. We show nonparametric identifiability with at least three parallel outcomes and provide parametric estimation tools under a set of linear structural equation models. Our proposal is evaluated through a set of synthetic and real data analyses.",http://hdl.handle.net/10.1093/biomet/asae008
Biometrika,2024,Order-based structure learning without score equivalence,"Hyunwoong Chang, James J Cai and Quan Zhou","SummaryWe propose an empirical Bayes formulation of the structure learning problem, where the prior specification assumes that all node variables have the same error variance, an assumption known to ensure the identifiability of the underlying causal directed acyclic graph. To facilitate efficient posterior computation, we approximate the posterior probability of each ordering by that of a best directed acyclic graph model, which naturally leads to an order-based Markov chain Monte Carlo algorithm. Strong selection consistency for our model in high-dimensional settings is proved under a condition that allows heterogeneous error variances, and the mixing behaviour of our sampler is theoretically investigated. Furthermore, we propose a new iterative top-down algorithm, which quickly yields an approximate solution to the structure learning problem and can be used to initialize the Markov chain Monte Carlo sampler. We demonstrate that our method outperforms other state-of-the-art algorithms under various simulation settings, and conclude the paper with a single-cell real-data study illustrating practical advantages of the proposed method.",http://hdl.handle.net/10.1093/biomet/asad052
Biometrika,2024,Retrospective causal inference with multiple effect variables,"Wei Li, Zitong Lu, Jinzhu Jia, Min Xie and Zhi Geng","SummaryAs highlighted in Dawid (2000) and Pearl & Mackenzie (2018), deducing the causes of given effects is a more challenging problem than evaluating the effects of causes in causal inference. Lu et al. (2023) proposed an approach for deducing causes of a single effect variable based on posterior causal effects. In many applications, there are multiple effect variables, and they can be used simultaneously to more accurately deduce the causes. To retrospectively deduce causes from multiple effects, we propose multivariate posterior total, intervention and direct causal effects conditional on the observed evidence. We describe the assumptions of no confounding and monotonicity, under which we prove identifiability of the multivariate posterior causal effects and provide their identification equations. The proposed approach can be applied for causal attributions, medical diagnosis, blame and responsibility in various studies with multiple effect or outcome variables. Two examples are used to illustrate the proposed approach.",http://hdl.handle.net/10.1093/biomet/asad056
Biometrika,2024,Likelihood-based inference under nonconvex boundary constraints,"J Y Wang, Z S Ye and Y Chen","Likelihood-based inference under nonconvex constraints on model parameters has become increasingly common in biomedical research. In this paper, we establish large-sample properties of the maximum likelihood estimator when the true parameter value lies at the boundary of a nonconvex parameter space. We further derive the asymptotic distribution of the likelihood ratio test statistic under nonconvex constraints on model parameters. A general Monte Carlo procedure for generating the limiting distribution is provided. The theoretical results are demonstrated by five examples in Anderson’s stereotype logistic regression model, genetic association studies, gene-environment interaction tests, cost-constrained linear regression and fairness-constrained linear regression.",http://hdl.handle.net/10.1093/biomet/asad062
Biometrika,2024,On varimax asymptotics in network models and spectral methods for dimensionality reduction,J Cape,"Varimax factor rotations, while popular among practitioners in psychology and statistics since being introduced by Kaiser (1958), have historically been viewed with skepticism and suspicion by some theoreticians and mathematical statisticians. Now, work by Rohe & Zeng (2023) provides new, fundamental insight: varimax rotations provably perform statistical estimation in certain classes of latent variable models when paired with spectral-based matrix truncations for dimensionality reduction. We build on this new-found understanding of varimax rotations by developing further connections to network analysis and spectral methods rooted in entrywise matrix perturbation analysis. Concretely, this paper establishes the asymptotic multivariate normality of vectors in varimax-transformed Euclidean point clouds that represent low-dimensional node embeddings in certain latent space random graph models. We address related concepts including network sparsity, data denoising and the role of matrix rank in latent variable parameterizations. Collectively, these findings, at the confluence of classical and contemporary multivariate analysis, reinforce methodology and inference procedures grounded in matrix factorization-based techniques. Numerical examples illustrate our findings and supplement our discussion.",http://hdl.handle.net/10.1093/biomet/asad061
Biometrika,2024,A cross-validation-based statistical theory for point processes,"Ottmar Cronie, Mehdi Moradi and Christophe A N Biscio","Motivated by the general ability of cross-validation to reduce overfitting and mean square error, we develop a cross-validation-based statistical theory for general point processes. It is based on the combination of two novel concepts for general point processes: cross-validation and prediction errors. Our cross-validation approach uses thinning to split a point process/pattern into pairs of training and validation sets, while our prediction errors measure discrepancy between two point processes. The new statistical approach, which may be used to model different distributional characteristics, exploits the prediction errors to measure how well a given model predicts validation sets using associated training sets. Having indicated that our new framework generalizes many existing statistical approaches, we then establish different theoretical properties for it, including large sample properties. We further recognize that nonparametric intensity estimation is an instance of Papangelou conditional intensity estimation, which we exploit to apply our new statistical theory to kernel intensity estimation. Using independent thinning-based cross-validation, we numerically show that the new approach substantially outperforms the state-of-the-art in bandwidth selection. Finally, we carry out intensity estimation for a dataset in forestry and a dataset in neurology.",http://hdl.handle.net/10.1093/biomet/asad041
Biometrika,2024,Estimation of prediction error in time series,Alexander Aue and Prabir Burman,"SummaryThe accurate estimation of prediction errors in time series is an important problem, which has immediate implications for the accuracy of prediction intervals as well as the quality of a number of widely used time series model selection criteria such as the Akaike information criterion. Except for simple cases, however, it is difficult or even impossible to obtain exact analytical expressions for one-step and multi-step predictions. This may be one of the reasons that, unlike in the independent case (see Efron, 2004), up to now there has been no fully established methodology for time series prediction error estimation. Starting from an approximation to the bias-variance decomposition of the squared prediction error, a method for accurate estimation of prediction errors in both univariate and multivariate stationary time series is developed in this article. In particular, several estimates are derived for a general class of predictors that includes most of the popular linear, nonlinear, parametric and nonparametric time series models used in practice, with causal invertible autoregressive moving average and nonparametric autoregressive processes discussed as lead examples. Simulations demonstrate that the proposed estimators perform quite well in finite samples. The estimates may also be used for model selection when the purpose of modelling is prediction.",http://hdl.handle.net/10.1093/biomet/asad053
