journal,year,title,authors,abstract,url
Biometrika,2024,Optimal regimes for algorithm-assisted human decision-making,"M J Stensrud, J D Laurendeau and A L Sarvet","SummaryWe consider optimal regimes for algorithm-assisted human decision-making. Such regimes are decision functions of measured pre-treatment variables and, by leveraging natural treatment values, enjoy a superoptimality property whereby they are guaranteed to outperform conventional optimal regimes. When there is unmeasured confounding, the benefit of using superoptimal regimes can be considerable. When there is no unmeasured confounding, superoptimal regimes are identical to conventional optimal regimes. Furthermore, identification of the expected outcome under superoptimal regimes in nonexperimental studies requires the same assumptions as identification of value functions under conventional optimal regimes when the treatment is binary. To illustrate the utility of superoptimal regimes, we derive identification and estimation results in a common instrumental variable setting. We use these derivations to analyse examples from the optimal regimes literature, including a case study of the effect of prompt intensive care treatment on survival.",http://hdl.handle.net/10.1093/biomet/asae016
Biometrika,2024,Exact selective inference with randomization,"Snigdha Panigrahi, Kevin Fry and Jonathan Taylor","SummaryWe introduce a pivot for exact selective inference with randomization. Not only does our pivot lead to exact inference in Gaussian regression models, but it is also available in closed form. We reduce this problem to inference for a bivariate truncated Gaussian variable. By doing so, we give up some power that is achieved with approximate maximum likelihood estimation in Panigrahi & Taylor (2023). Yet our pivot always produces narrower confidence intervals than a closely related data-splitting procedure. We investigate the trade-off between power and exact selective inference on simulated datasets and an HIV drug resistance dataset.",http://hdl.handle.net/10.1093/biomet/asae019
Biometrika,2024,Flexible control of the median of the false discovery proportion,"Jesse Hemerik, Aldo Solari and Jelle J Goeman","SummaryWe introduce a multiple testing procedure that controls the median of the proportion of false discoveries in a flexible way. The procedure requires only a vector of p-values as input and is comparable to the Benjamini–Hochberg method, which controls the mean of the proportion of false discoveries. Our method allows free choice of one or several values ofafter seeing the data, unlike the Benjamini–Hochberg procedure, which can be very anti-conservative whenis chosen post hoc. We prove these claims and illustrate them with simulations. The proposed procedure is inspired by a popular estimator of the total number of true hypotheses. We adapt this estimator to provide simultaneously median unbiased estimators of the proportion of false discoveries, valid for finite samples. This simultaneity allows for the claimed flexibility. Our approach does not assume independence. The time complexity of our method is linear in the number of hypotheses, after sorting the p-values.",http://hdl.handle.net/10.1093/biomet/asae018
Biometrika,2024,Radial neighbours for provably accurate scalable approximations of Gaussian processes,"Yichen Zhu, Michele Peruzzi, Cheng Li and David B Dunson","In geostatistical problems with massive sample size, Gaussian processes can be approximated using sparse directed acyclic graphs to achieve scalable O(n) computational complexity. In these models, data at each location are typically assumed conditionally dependent on a small set of parents that usually include a subset of the nearest neighbours. These methodologies often exhibit excellent empirical performance, but the lack of theoretical validation leads to unclear guidance in specifying the underlying graphical model and sensitivity to graph choice. We address these issues by introducing radial-neighbour Gaussian processes, a class of Gaussian processes based on directed acyclic graphs in which directed edges connect every location to all of its neighbours within a predetermined radius. We prove that any radial-neighbour Gaussian process can accurately approximate the corresponding unrestricted Gaussian process in the Wasserstein-2 distance, with an error rate determined by the approximation radius, the spatial covariance function and the spatial dispersion of samples. We offer further empirical validation of our approach via applications on simulated and real-world data, showing excellent performance in both prior and posterior approximations to the original Gaussian process.",http://hdl.handle.net/10.1093/biomet/asae029
Biometrika,2024,A rank-based sequential test of independence,Alexander Henzi and Michael Law,"SummaryWe consider the problem of independence testing for two univariate random variables in a sequential setting. By leveraging recent developments on safe, anytime-valid inference, we propose a test with time-uniform Type-I error control and derive explicit bounds on the finite-sample performance of the test. We demonstrate the empirical performance of the procedure in comparison to existing sequential and nonsequential independence tests. Furthermore, since the proposed test is distribution-free under the null hypothesis, we empirically simulate the gap due to Ville’s inequality, the supermartingale analogue of Markov’s inequality, that is commonly applied to control Type-I error in anytime-valid inference, and apply this to construct a truncated sequential test.",http://hdl.handle.net/10.1093/biomet/asae023
Biometrika,2024,Testing independence for sparse longitudinal data,"Changbo Zhu, Junwen Yao and Jane-Ling Wang","With the advance of science and technology, more and more data are collected in the form of functions. A fundamental question for a pair of random functions is to test whether they are independent. This problem becomes quite challenging when the random trajectories are sampled irregularly and sparsely for each subject. In other words, each random function is only sampled at a few time-points, and these time-points vary with subjects. Furthermore, the observed data may contain noise. To the best of our knowledge, there exists no consistent test in the literature to test the independence of sparsely observed functional data. We show in this work that testing pointwise independence simultaneously is feasible. The test statistics are constructed by integrating pointwise distance covariances (Székely et al., 2007) and are shown to converge, at a certain rate, to their corresponding population counterparts, which characterize the simultaneous pointwise independence of two random functions. The performance of the proposed methods is further verified by Monte Carlo simulations and analysis of real data.",http://hdl.handle.net/10.1093/biomet/asae035
Biometrika,2024,On some algorithms for estimation in Gaussian graphical models,S Højsgaard and S Lauritzen,"In Gaussian graphical models, the likelihood equations must typically be solved iteratively. This paper investigates two algorithms: a version of iterative proportional scaling, which avoids inversion of large matrices, and an algorithm based on convex duality and operating on the covariance matrix by neighbourhood coordinate descent, which corresponds to the graphical lasso with zero penalty. For large, sparse graphs, the iterative proportional scaling algorithm appears feasible and has simple convergence properties. The algorithm based on neighbourhood coordinate descent is extremely fast and less dependent on sparsity, but needs a positive-definite starting value to converge. We provide an algorithm for finding such a starting value for graphs with low colouring number. As a consequence, we also obtain a simplified proof of existence of the maximum likelihood estimator in such cases.",http://hdl.handle.net/10.1093/biomet/asae028
Biometrika,2024,Network-adjusted covariates for community detection,Y Hu and W Wang,"SummaryCommunity detection is a crucial task in network analysis that can be significantly improved by incorporating subject-level information, ie, covariates. Existing methods have shown the effectiveness of using covariates on the low-degree nodes, but rarely discuss the case where communities have significantly different density levels, ie, multiscale networks. In this paper, we introduce a novel method that addresses this challenge by constructing network-adjusted covariates, which leverage the network connections and covariates with a node-specific weight for each node. This weight can be calculated without tuning parameters. We present novel theoretical results on the strong consistency of our method under degree-corrected stochastic blockmodels with covariates, even in the presence of misspecification and multiple sparse communities. Additionally, we establish a general lower bound for the community detection problem when both the network and covariates are present, and it shows that our method is optimal for connection intensity up to a constant factor. Our method outperforms existing approaches in simulations and a LastFM app user network. We then compare our method with others on a statistics publication citation network where 30% of nodes are isolated, and our method produces reasonable and balanced results. Our method is implemented in the R package NAC.",http://hdl.handle.net/10.1093/biomet/asae011
Biometrika,2024,Skip sampling: subsampling in the frequency domain,Tucker McElroy and Dimitris N Politis,"SummaryOver the last 35 years, several bootstrap methods for time series have been proposed. Popular time domain methods include the block bootstrap, the stationary bootstrap, the linear process bootstrap, among others; subsampling for time series is also available, and is closely related to the block bootstrap. The frequency domain bootstrap has been performed either by resampling the periodogram ordinates or by resampling the ordinates of the discrete Fourier transform. The paper at hand proposes a novel construction of subsampling the discrete Fourier transform ordinates, and investigates its theoretical properties and realm of applicability. Numerical studies show that the new method performs comparably to the frequency domain bootstrap for linear spectral means and ratio statistics, while at the same time yielding significant computational savings as well as numerical stability. Some key words: Discrete Fourier transform; Spectral density, Time series.",http://hdl.handle.net/10.1093/biomet/asae039
Biometrika,2024,Individualized dynamic latent factor model for multi-resolutional data with application to mobile health,"J Zhang, F Xue, Q Xu, J Lee and A Qu","SummaryMobile health has emerged as a major success for tracking individual health status, due to the popularity and power of smartphones and wearable devices. This has also brought great challenges in handling heterogeneous, multi-resolution data that arise ubiquitously in mobile health due to irregular multivariate measurements collected from individuals. In this paper, we propose an individualized dynamic latent factor model for irregular multi-resolution time series data to interpolate unsampled measurements of time series with low resolution. One major advantage of the proposed method is the capability to integrate multiple irregular time series and multiple subjects by mapping the multi-resolution data to the latent space. In addition, the proposed individualized dynamic latent factor model is applicable to capturing heterogeneous longitudinal information through individualized dynamic latent factors. Our theory provides a bound on the integrated interpolation error and the convergence rate for B-spline approximation methods. Both the simulation studies and the application to smartwatch data demonstrate the superior performance of the proposed method compared to existing methods.",http://hdl.handle.net/10.1093/biomet/asae015
Biometrika,2024,Difference-based covariance matrix estimation in time series nonparametric regression with application to specification tests,Lujia Bai and Weichi Wu,"SummaryLong-run covariance matrix estimation is the building block of time series inference. The corresponding difference-based estimator, which avoids detrending, has attracted considerable interest due to its robustness to both smooth and abrupt structural breaks and its competitive finite sample performance. However, existing methods mainly focus on estimators for the univariate process, while their direct and multivariate extensions for most linear models are asymptotically biased. We propose a novel difference-based and debiased long-run covariance matrix estimator for functional linear models with time-varying regression coefficients, allowing time series nonstationarity, long-range dependence, state heteroscedasticity and combinations thereof. We apply the new estimator to (i) the structural stability test, overcoming the notorious nonmonotonic power phenomena caused by piecewise smooth alternatives for regression coefficients, and (ii) the nonparametric residual-based tests for long memory, improving the performance via the residual-free formula of the proposed estimator. The effectiveness of the proposed method is justified theoretically and demonstrated by superior performance in simulation studies, while its usefulness is elaborated via real data analysis. Our method is implemented in the R package mlrv.",http://hdl.handle.net/10.1093/biomet/asae013
Biometrika,2024,Testing serial dependence or cross dependence for time series with underreporting,"Keyao Wei, Lengyang Wang and Yingcun Xia","In practice, it is common for collected data to be underreported, an issue that is particularly prevalent in fields such as the social sciences, ecology and epidemiology. Drawing inferences from such data using conventional statistical methods can lead to incorrect conclusions. In this paper, we study tests for serial or cross dependence in time series data that are subject to underreporting. We introduce new test statistics, develop corresponding group-of-blocks bootstrap techniques and establish their consistency. The methods are shown via simulation studies to be efficient and are used to identify key factors responsible for the spread of dengue fever and the occurrence of cardiovascular disease.",http://hdl.handle.net/10.1093/biomet/asae027
Biometrika,2024,Debiasing Welch’s method for spectral density estimation,"Lachlan C Astfalck, Adam M Sykulski and Edward J Cripps","Welch’s method provides an estimator of the power spectral density that is statistically consistent. This is achieved by averaging over periodograms calculated from overlapping segments of a time series. For a finite-length time series, while the variance of the estimator decreases as the number of segments increases, the magnitude of the estimator’s bias increases: a bias-variance trade-off ensues when setting the segment number. We address this issue by providing a novel method for debiasing Welch’s method that maintains the computational complexity and asymptotic consistency, and leads to improved finite-sample performance. Theoretical results are given for fourth-order stationary processes with finite fourth-order moments and an absolutely convergent fourth-order cumulant function. The significant bias reduction is demonstrated with numerical simulation and an application to real-world data. Our estimator also permits irregular spacing over frequency and we demonstrate how this may be employed for signal compression and further variance reduction. The code accompanying this work is available in R and python.",http://hdl.handle.net/10.1093/biomet/asae033
Biometrika,2024,Bootstrap test procedure for variance components in nonlinear mixed effects models in the presence of nuisance parameters and a singular Fisher information matrix,"T Guédon, C Baey and E Kuhn","SummaryWe examine the problem of variance component testing in general mixed effects models using the likelihood ratio test. We account for the presence of nuisance parameters, ie, the fact that some untested variances might also be equal to zero. Two main issues arise in this context, leading to a nonregular setting. First, under the null hypothesis, the true parameter value lies on the boundary of the parameter space. Moreover, due to the presence of nuisance parameters, the exact locations of these boundary points are not known, which prevents the use of classical asymptotic theory of maximum likelihood estimation. Then, in the specific context of nonlinear mixed effects models, the Fisher information matrix is singular at the true parameter value. We address these two points by proposing a shrunk parametric bootstrap procedure, which is straightforward to apply even for nonlinear models. We show that the procedure is consistent, solving both the boundary and the singularity issues, and we provide a verifiable criterion for the applicability of our theoretical results. We show through a simulation study that, compared to the asymptotic approach, our procedure has a better small sample performance and is more robust to the presence of nuisance parameters. A real data application on bird growth rates is also provided.",http://hdl.handle.net/10.1093/biomet/asae025
Biometrika,2024,Sensitivity analysis for matched observational studies with continuous exposures and binary outcomes,"Jeffrey Zhang, Dylan S Small and Siyu Heng","SummaryMatching is one of the most widely used study designs for adjusting for measured confounders in observational studies. However, unmeasured confounding may exist and cannot be removed by matching. Therefore, a sensitivity analysis is typically needed to assess a causal conclusion’s sensitivity to unmeasured confounding. Sensitivity analysis frameworks for binary exposures have been well established for various matching designs and are commonly used in various studies. However, unlike the binary exposure case, there still lacks valid and general sensitivity analysis methods for continuous exposures, except in some special cases such as pair matching. To fill this gap in the binary outcome case, we develop a sensitivity analysis framework for general matching designs with continuous exposures and binary outcomes. First, we use probabilistic lattice theory to show that our sensitivity analysis approach is finite population exact under Fisher’s sharp null. Second, we prove a novel design sensitivity formula as a powerful tool for asymptotically evaluating the performance of our sensitivity analysis approach. Third, to allow effect heterogeneity with binary outcomes, we introduce a framework for conducting asymptotically exact inference and sensitivity analysis on generalized attributable effects with binary outcomes via mixed-integer programming. Fourth, for the continuous outcome case, we show that conducting an asymptotically exact sensitivity analysis in matched observational studies when both the exposures and outcomes are continuous is generally NP-hard, except in some special cases such as pair matching. As a real data application, we apply our new methods to study the effect of early-life lead exposure on juvenile delinquency. An implementation of the methods in this work is available in the R package doseSens.",http://hdl.handle.net/10.1093/biomet/asae021
Biometrika,2024,A model-free variable screening method for optimal treatment regimes with high-dimensional survival data,Cheng-Han Yang and Yu-Jen Cheng,"SummaryWe propose a model-free variable screening method for the optimal treatment regime with high-dimensional survival data. The proposed screening method provides a unified framework to select the active variables in a prespecified target population, including the treated group as a special case. Based on this framework, the optimal treatment regime is exactly the optimal classifier that minimizes a weighted misclassification error rate, with weights associated with survival outcome variables, the censoring distribution and a prespecified target population. Our main contribution involves reformulating the weighted classification problem into a classification problem within a hypothetical population, where the observed data can be viewed as a sample obtained from outcome-dependent sampling, with the selection probability inversely proportional to the weights. Consequently, we introduce the weighted Kolmogorov–Smirnov approach for selecting active variables in the optimal treatment regime, extending the conventional Kolmogorov–Smirnov method for binary classification. Additionally, the proposed screening method exhibits two levels of robustness. The first level of robustness is achieved because the proposed method does not require any model assumptions for the survival outcome on treatment and covariates, whereas the other is attained as the form of treatment regimes is allowed to be unspecified even without requiring convex surrogate loss, such as logit loss or hinge loss. As a result, the proposed screening method is robust to model misspecifications, and nonparametric learning methods such as random forests and boosting can be applied to those selected variables for further analysis. The theoretical properties of the proposed method are established. The performance of the proposed method is examined through simulation studies and illustrated by a lung cancer dataset.",http://hdl.handle.net/10.1093/biomet/asae022
Biometrika,2024,Inference for possibly misspecified generalized linear models with nonpolynomial-dimensional nuisance parameters,"Shaoxin Hong, Jiancheng Jiang, Xuejun Jiang and Haofeng Wang","SummaryIt is routine practice in statistical modelling to first select variables and then make inference for the selected model as in stepwise regression. Such inference is made upon the assumption that the selected model is true. However, without this assumption, one would not know the validity of the inference. Similar problems also exist in high-dimensional regression with regularization. To address these problems, we propose a dimension-reduced generalized likelihood ratio test for generalized linear models with nonpolynomial dimensionality, based on quasilikelihood estimation that allows for misspecification of the conditional variance. The test has nearly oracle performance when using the correct amount of shrinkage and has robust performance against the choice of regularization parameter across a large range. We further develop an adaptive data-driven dimension-reduced generalized likelihood ratio test and prove that, with probability going to one, it is an oracle generalized likelihood ratio test. However, in ultrahigh-dimensional models the penalized estimation may produce spuriously important variables that deteriorate the performance of the test. To tackle this problem, we introduce a cross-fitted dimension-reduced generalized likelihood ratio test, which is not only free of spurious effects, but robust against the choice of regularization parameter. We establish limiting distributions of the proposed tests. Their advantages are highlighted via theoretical and empirical comparisons to some competitive tests. An application to breast cancer data illustrates the use of our proposed methodology.",http://hdl.handle.net/10.1093/biomet/asae024
Biometrika,2024,More power by using fewer permutations,Nick W Koning,"It is conventionally believed that permutation-based testing methods should ideally use all permutations. We challenge this by showing that we can sometimes obtain dramatically more power by using a tiny subgroup. As the subgroup is tiny, this also comes at a much lower computational cost. Moreover, the method remains valid for the same hypotheses. We exploit this to improve the popular permutation-based Westfall and Young MaxT multiple testing method. We analyse the relative efficiency in a Gaussian location model, and find the largest gain in high dimensions.",http://hdl.handle.net/10.1093/biomet/asae031
Biometrika,2024,Covariate adjustment in randomized experiments with missing outcomes and covariates,"Anqi Zhao, Peng Ding and Fan Li","SummaryCovariate adjustment can improve precision in analysing randomized experiments. With fully observed data, regression adjustment and propensity score weighting are asymptotically equivalent in improving efficiency over unadjusted analysis. When some outcomes are missing, we consider combining these two adjustment methods with the inverse probability of observation weighting for handling missing outcomes, and show that the equivalence between the two methods breaks down. Regression adjustment no longer ensures efficiency gain over unadjusted analysis unless the true outcome model is linear in covariates or the outcomes are missing completely at random. Propensity score weighting, in contrast, still guarantees efficiency over unadjusted analysis, and including more covariates in adjustment never harms asymptotic efficiency. Moreover, we establish the value of using partially observed covariates to secure additional efficiency by the missingness indicator method, which imputes all missing covariates by zero and uses the union of the completed covariates and corresponding missingness indicators as the new, fully observed covariates. Based on these findings, we recommend using regression adjustment in combination with the missingness indicator method if the linear outcome model or missing-completely-at-random assumption is plausible and using propensity score weighting with the missingness indicator method otherwise.",http://hdl.handle.net/10.1093/biomet/asae017
