journal,year,title,authors,abstract,url
Biometrika,2021,Inference for treatment effect parameters in potentially misspecified high-dimensional models,Oliver Dukes and Stijn Vansteelandt,"SummaryEliminating the effect of confounding in observational studies typically involves fitting a model for an outcome adjusted for covariates. When, as often, these covariates are high-dimensional, this necessitates the use of sparse estimators, such as the lasso, or other regularization approaches. Naïve use of such estimators yields confidence intervals for the conditional treatment effect parameter that are not uniformly valid. Moreover, as the number of covariates grows with the sample size, correctly specifying a model for the outcome is nontrivial. In this article we deal with both of these concerns simultaneously, obtaining confidence intervals for conditional treatment effects that are uniformly valid, regardless of whether the outcome model is correct. This is done by incorporating an additional model for the treatment selection mechanism. When both models are correctly specified, we can weaken the standard conditions on model sparsity. Our procedure extends to multivariate treatment effect parameters and complex longitudinal settings.",http://hdl.handle.net/10.1093/biomet/asaa071
Biometrika,2021,Specification tests for covariance structures in high-dimensional statistical models,X Guo and C Y Tang,"SummaryWe consider testing the covariance structure in statistical models. We focus on developing such tests when the random vectors of interest are not directly observable and have to be derived via estimated models. Additionally, the covariance specification may involve extra nuisance parameters which also need to be estimated. In a generic additive model setting, we develop and investigate test statistics based on the maximum discrepancy measure calculated from the residuals. To approximate the distributions of the test statistics under the null hypothesis, new multiplier bootstrap procedures with dedicated adjustments that incorporate the model and nuisance parameter estimation errors are proposed. Our theoretical development elucidates the impact due to the estimation errors with high-dimensional data and demonstrates the validity of our tests. Simulations and real data examples confirm our theory and demonstrate the performance of the proposed tests.",http://hdl.handle.net/10.1093/biomet/asaa073
Biometrika,2021,On the use of a penalized quasilikelihood information criterion for generalized linear mixed models,Francis K C Hui,"SummaryInformation criteria are commonly used for joint fixed and random effects selection in mixed models. While information criteria are straightforward to implement, a major difficulty in applying them is that they are typically based on maximum likelihood estimates, but calculating such estimates for one candidate mixed model, let alone multiple models, presents a major computational challenge. To overcome this hurdle, we study penalized quasilikelihood estimation and use it as the basis for performing fast joint selection. Under a general framework, we show that penalized quasilikelihood estimation produces consistent estimates of the true parameters. We then propose a new penalized quasilikelihood information criterion whose distinguishing feature is the way it accounts for model complexity in the random effects, since penalized quasilikelihood estimation effectively treats the random effects as fixed. We demonstrate that the criterion asymptotically identifies the true set of important fixed and random effects. Simulations show that the quasilikelihood information criterion performs competitively with and sometimes better than common maximum likelihood information criteria for joint selection, while offering substantial reductions in computation time.",http://hdl.handle.net/10.1093/biomet/asaa069
Biometrika,2021,Posterior contraction in sparse generalized linear models,Seonghyun Jeong and Subhashis Ghosal,"SummaryWe study posterior contraction rates in sparse high-dimensional generalized linear models using priors incorporating sparsity. A mixture of a point mass at zero and a continuous distribution is used as the prior distribution on regression coefficients. In addition to the usual posterior, the fractional posterior, which is obtained by applying Bayes theorem with a fractional power of the likelihood, is also considered. The latter allows uniformity in posterior contraction over a larger subset of the parameter space. In our set-up, the link function of the generalized linear model need not be canonical. We show that Bayesian methods achieve convergence properties analogous to lasso-type procedures. Our results can be used to derive posterior contraction rates in many generalized linear models including logistic, Poisson regression and others.",http://hdl.handle.net/10.1093/biomet/asaa074
Biometrika,2021,The uniform general signed rank test and its design sensitivity,S R Howard and S D Pimentel,"SummaryA sensitivity analysis in an observational study tests whether the qualitative conclusions of an analysis would change if we were to allow for the possibility of limited bias due to confounding. The design sensitivity of a hypothesis test quantifies the asymptotic performance of the test in a sensitivity analysis against a particular alternative. We propose a new, nonasymptotic, distribution-free test, the uniform general signed rank test, for observational studies with paired data, and examine its performance under Rosenbaum’s sensitivity analysis model. Our test can be viewed as adaptively choosing from among a large underlying family of signed rank tests, and we show that the uniform test achieves design sensitivity equal to the maximum design sensitivity over the underlying family of signed rank tests. Our test thus achieves superior design sensitivity, indicating it will perform well in sensitivity analyses on large samples. We support this conclusion with simulations and a data example, showing that the advantages of our test extend to moderate sample sizes as well.",http://hdl.handle.net/10.1093/biomet/asaa072
Biometrika,2021,An assumption-free exact test for fixed-design linear models with exchangeable errors,Lihua Lei and Peter J Bickel,"SummaryWe propose the cyclic permutation test to test general linear hypotheses for linear models. The test is nonrandomized and valid in finite samples with exact Type I errorfor an arbitrary fixed design matrix and arbitrary exchangeable errors, wheneveris an integer and , whereis the sample size andis the number of parameters. The test involves applying the marginal rank test tolinear statistics of the outcome vector, where the coefficient vectors are determined by solving a linear system such that the joint distribution of the linear statistics is invariant with respect to a nonstandard cyclic permutation group under the null hypothesis. The power can be further enhanced by solving a secondary nonlinear travelling salesman problem, for which the genetic algorithm can find a reasonably good solution. Extensive simulation studies show that the cyclic permutation test has comparable power to existing tests. When testing for a single contrast of coefficients, an exact confidence interval can be obtained by inverting the test.",http://hdl.handle.net/10.1093/biomet/asaa079
Biometrika,2021,On quadratic forms in multivariate generalized hyperbolic random vectors,Simon Broda and Juan Arismendi Zambrano,"SummaryThis article presents exact and approximate expressions for tail probabilities and partial moments of quadratic forms in multivariate generalized hyperbolic random vectors. The derivations involve a generalization of the classic inversion formula for distribution functions (Gil-Pelaez, 1951). Two numerical applications are considered: the distribution of the two-stage least squares estimator and the expected shortfall of a quadratic portfolio.",http://hdl.handle.net/10.1093/biomet/asaa067
Biometrika,2021,Estimating differential latent variable graphical models with applications to brain connectivity,"S Na, M Kolar and O Koyejo","SummaryDifferential graphical models are designed to represent the difference between the conditional dependence structures of two groups, and thus are of particular interest for scientific investigations. Motivated by modern applications, this manuscript considers an extended setting where each group is generated by a latent variable Gaussian graphical model. Due to the existence of latent factors, the differential network is decomposed into sparse and low-rank components, both of which are symmetric indefinite matrices. We estimate these two components simultaneously using a two-stage procedure: (i) an initialization stage, which computes a simple, consistent estimator, and (ii) a convergence stage, implemented using a projected alternating gradient descent algorithm applied to a nonconvex objective, initialized using the output of the first stage. We prove that given the initialization, the estimator converges linearly with a nontrivial, minimax optimal statistical error. Experiments on synthetic and real data illustrate that the proposed nonconvex procedure outperforms existing methods.",http://hdl.handle.net/10.1093/biomet/asaa066
Biometrika,2021,Lattice-based designs with quasi-optimal separation distance on all projections,Xu He,"SummaryExperimental designs that spread points apart from each other on projections are important for computer experiments, when not necessarily all factors have a substantial influence on the response. We provide a theoretical framework for generating designs that have quasi-optimal separation distance on all the projections and quasi-optimal fill distance on univariate margins. The key is to use special techniques to rotate certain lattices. One such type of design is the class of densest packing-based maximum projection designs, which outperform existing types of space-filling designs in many scenarios.",http://hdl.handle.net/10.1093/biomet/asaa057
Biometrika,2021,Poisson reduced-rank models with an application to political text data,"Carsten Jentsch, Eun Ryung Lee and Enno Mammen","SummaryWe discuss Poisson reduced-rank models for low-dimensional summaries of high-dimensional Poisson vectors that allow inference on the location of individuals in a low-dimensional space. We show that under weak dependence conditions, which allow for certain correlations between the Poisson random variables, the locations can be consistently estimated using Poisson maximum likelihood estimation. Moreover, we develop consistent rules for determining the dimension of the location from the discrete data. Our main motivation for studying Poisson reduced-rank models arises from applications to political text data, where word counts in a political document are modelled by Poisson random variables. We apply our method to party manifesto data taken from German political parties across seven federal elections following German reunification, to make statistical inferences on the multi-dimensional evolution of party positions.",http://hdl.handle.net/10.1093/biomet/asaa063
Biometrika,2021,Finite-time analysis of vector autoregressive models under linear restrictions,Yao Zheng and Guang Cheng,"SummaryThis paper develops a unified finite-time theory for the ordinary least squares estimation of possibly unstable and even slightly explosive vector autoregressive models under linear restrictions, with the applicable region , whereis the spectral radius of the transition matrixin the var(1) representation,is the time horizon and 0$]]> is a universal constant. The linear restriction framework encompasses various existing models such as banded/network vector autoregressive models. We show that the restrictions reduce the error bounds via not only the reduced dimensionality, but also a scale factor resembling the asymptotic covariance matrix of the estimator in the fixed-dimensional set-up: as long as the model is correctly specified, this scale factor is decreasing in the number of restrictions. It is revealed that the phase transition from slow to fast error rate regimes is determined by the smallest singular value of , a measure of the least excitable mode of the system. The minimax lower bounds are derived across different regimes. The developed non-asymptotic theory not only bridges the theoretical gap between stable and unstable regimes, but precisely characterizes the effect of restrictions and its interplay with model parameters. Simulations support our theoretical results.",http://hdl.handle.net/10.1093/biomet/asaa065
Biometrika,2021,Nonsmooth backfitting for the excess risk additive regression model with two survival time scales,"M Hiabu, J P Nielsen and T H Scheike","SummaryWe consider an extension of Aalen’s additive regression model that allows covariates to have effects that vary on two different time scales. The two time scales considered are equal up to a constant for each individual and vary across individuals, such as follow-up time and age in medical studies or calendar time and age in longitudinal studies. The model was introduced in Scheike (2001), where it was solved using smoothing techniques. We present a new backfitting algorithm for estimating the structured model without having to use smoothing. Estimators of the cumulative regression functions on the two time scales are suggested by solving local estimating equations jointly on the two time scales. We provide large-sample properties and simultaneous confidence bands. The model is applied to data on myocardial infarction, providing a separation of the two effects stemming from time since diagnosis and age.",http://hdl.handle.net/10.1093/biomet/asaa058
Biometrika,2021,The asymptotic distribution of modularity in weighted signed networks,Rong Ma and Ian Barnett,"SummaryModularity is a popular metric for quantifying the degree of community structure within a network. The distribution of the largest eigenvalue of a network’s edge weight or adjacency matrix is well studied and is frequently used as a substitute for modularity when performing statistical inference. However, we show that the largest eigenvalue and modularity are asymptotically uncorrelated, which suggests the need for inference directly on modularity itself when the network is large. To this end, we derive the asymptotic distribution of modularity in the case where the network’s edge weight matrix belongs to the Gaussian orthogonal ensemble, and study the statistical power of the corresponding test for community structure under some alternative models. We empirically explore universality extensions of the limiting distribution and demonstrate the accuracy of these asymptotic distributions through Type I error simulations. We also compare the empirical powers of the modularity-based tests and some existing methods. Our method is then used to test for the presence of community structure in two real data applications.",http://hdl.handle.net/10.1093/biomet/asaa059
Biometrika,2021,Hypothesis testing for phylogenetic composition: a minimum-cost flow perspective,"Shulei Wang, T Tony Cai and Hongzhe Li","SummaryQuantitative comparison of microbial composition from different populations is a fundamental task in various microbiome studies. We consider two-sample testing for microbial compositional data by leveraging phylogenetic information. Motivated by existing phylogenetic distances, we take a minimum-cost flow perspective to study such testing problems. We first show that multivariate analysis of variance with permutation using phylogenetic distances, one of the most commonly used methods in practice, is essentially a sum-of-squares type of test and has better power for dense alternatives. However, empirical evidence from real datasets suggests that the phylogenetic microbial composition difference between two populations is usually sparse. Motivated by this observation, we propose a new maximum type test, detector of active flow on a tree, and investigate its properties. We show that the proposed method is particularly powerful against sparse phylogenetic composition difference and enjoys certain optimality. The practical merit of the proposed method is demonstrated by simulation studies and an application to a human intestinal biopsy microbiome dataset on patients with ulcerative colitis.",http://hdl.handle.net/10.1093/biomet/asaa061
Biometrika,2021,Large-sample asymptotics of the pseudo-marginal method,"S M Schmon, G Deligiannidis, A Doucet and M K Pitt","SummaryThe pseudo-marginal algorithm is a variant of the Metropolis–Hastings algorithm which samples asymptotically from a probability distribution when it is only possible to estimate unbiasedly an unnormalized version of its density. Practically, one has to trade off the computational resources used to obtain this estimator against the asymptotic variances of the ergodic averages obtained by the pseudo-marginal algorithm. Recent works on optimizing this trade-off rely on some strong assumptions, which can cast doubts over their practical relevance. In particular, they all assume that the distribution of the difference between the log-density, and its estimate is independent of the parameter value at which it is evaluated. Under regularity conditions we show that as the number of data points tends to infinity, a space-rescaled version of the pseudo-marginal chain converges weakly to another pseudo-marginal chain for which this assumption indeed holds. A study of this limiting chain allows us to provide parameter dimension-dependent guidelines on how to optimally scale a normal random walk proposal, and the number of Monte Carlo samples for the pseudo-marginal method in the large-sample regime. These findings complement and validate currently available results.",http://hdl.handle.net/10.1093/biomet/asaa044
Biometrika,2021,In search of lost mixing time: adaptive Markov chain Monte Carlo schemes for Bayesian variable selection with very large p,"J E Griffin, K G Łatuszyński and Mark Steel","SummaryThe availability of datasets with large numbers of variables is rapidly increasing. The effective application of Bayesian variable selection methods for regression with these datasets has proved difficult since available Markov chain Monte Carlo methods do not perform well in typical problem sizes of interest. We propose new adaptive Markov chain Monte Carlo algorithms to address this shortcoming. The adaptive design of these algorithms exploits the observation that in large-$p$, small-$n$ settings, the majority of the $p$ variables will be approximately uncorrelated a posteriori. The algorithms adaptively build suitable nonlocal proposals that result in moves with squared jumping distance significantly larger than standard methods. Their performance is studied empirically in high-dimensional problems and speed-ups of up to four orders of magnitude are observed.",http://hdl.handle.net/10.1093/biomet/asaa055
Biometrika,2021,"Jeffreys-prior penalty, finiteness and shrinkage in binomial-response generalized linear models",Ioannis Kosmidis and David Firth,"SummaryPenalization of the likelihood by Jeffreys’ invariant prior, or a positive power thereof, is shown to produce finite-valued maximum penalized likelihood estimates in a broad class of binomial generalized linear models. The class of models includes logistic regression, where the Jeffreys-prior penalty is known additionally to reduce the asymptotic bias of the maximum likelihood estimator, and models with other commonly used link functions, such as probit and log-log. Shrinkage towards equiprobability across observations, relative to the maximum likelihood estimator, is established theoretically and studied through illustrative examples. Some implications of finiteness and shrinkage for inference are discussed, particularly when inference is based on Wald-type procedures. A widely applicable procedure is developed for computation of maximum penalized likelihood estimates, by using repeated maximum likelihood fits with iteratively adjusted binomial responses and totals. These theoretical results and methods underpin the increasingly widespread use of reduced-bias and similarly penalized binomial regression models in many applied fields.",http://hdl.handle.net/10.1093/biomet/asaa052
Biometrika,2021,Matrix-variate logistic regression with measurement error,Junhan Fang and Grace Y Yi,"SummaryMeasurement error in covariates has been extensively studied in many conventional regression settings where covariate information is typically expressed in a vector form. However, there has been little work on error-prone matrix-variate data, which commonly arise from studies with imaging, spatial-temporal structures, etc. We consider analysis of error-contaminated matrix-variate data. We particularly focus on matrix-variate logistic measurement error models. We examine the biases induced from naive analysis which ignores measurement error in matrix-variate data. Two measurement error correction methods are developed to adjust for measurement error effects. The proposed methods are justified both theoretically and empirically. We analyse an electroencephalography dataset with the proposed methods.",http://hdl.handle.net/10.1093/biomet/asaa056
Biometrika,2021,Optimal subsampling for quantile regression in big data,Haiying Wang and Yanyuan Ma,"SummaryWe investigate optimal subsampling for quantile regression. We derive the asymptotic distribution of a general subsampling estimator and then derive two versions of optimal subsampling probabilities. One version minimizes the trace of the asymptotic variance-covariance matrix for a linearly transformed parameter estimator and the other minimizes that of the original parameter estimator. The former does not depend on the densities of the responses given covariates and is easy to implement. Algorithms based on optimal subsampling probabilities are proposed and asymptotic distributions, and the asymptotic optimality of the resulting estimators are established. Furthermore, we propose an iterative subsampling procedure based on the optimal subsampling probabilities in the linearly transformed parameter estimation which has great scalability to utilize available computational resources. In addition, this procedure yields standard errors for parameter estimators without estimating the densities of the responses given the covariates. We provide numerical examples based on both simulated and real data to illustrate the proposed method.",http://hdl.handle.net/10.1093/biomet/asaa043
Biometrika,2021,High-quantile regression for tail-dependent time series,Ting Zhang,"SummaryQuantile regression is a popular and powerful method for studying the effect of regressors on quantiles of a response distribution. However, existing results on quantile regression were mainly developed for cases in which the quantile level is fixed, and the data are often assumed to be independent. Motivated by recent applications, we consider the situation where (i) the quantile level is not fixed and can grow with the sample size to capture the tail phenomena, and (ii) the data are no longer independent, but collected as a time series that can exhibit serial dependence in both tail and non-tail regions. To study the asymptotic theory for high-quantile regression estimators in the time series setting, we introduce a tail adversarial stability condition, which had not previously been described, and show that it leads to an interpretable and convenient framework for obtaining limit theorems for time series that exhibit serial dependence in the tail region, but are not necessarily strongly mixing. Numerical experiments are conducted to illustrate the effect of tail dependence on high-quantile regression estimators, for which simply ignoring the tail dependence may yield misleading $p$-values.",http://hdl.handle.net/10.1093/biomet/asaa046
Biometrika,2021,High-dimensional empirical likelihood inference,"Jinyuan Chang, Song Chen, Cheng Yong Tang and Tong Tong Wu","SummaryHigh-dimensional statistical inference with general estimating equations is challenging and remains little explored. We study two problems in the area: confidence set estimation for multiple components of the model parameters, and model specifications tests. First, we propose to construct a new set of estimating equations such that the impact from estimating the high-dimensional nuisance parameters becomes asymptotically negligible. The new construction enables us to estimate a valid confidence region by empirical likelihood ratio. Second, we propose a test statistic as the maximum of the marginal empirical likelihood ratios to quantify data evidence against the model specification. Our theory establishes the validity of the proposed empirical likelihood approaches, accommodating over-identification and exponentially growing data dimensionality. Numerical studies demonstrate promising performance and potential practical benefits of the new methods.",http://hdl.handle.net/10.1093/biomet/asaa051
