journal,year,title,authors,abstract,url
Econometrica,2021,"Inequality, Business Cycles, and Monetary‐Fiscal Policy","Anmol Bhandari, David Evans, Mikhail Golosov and Thomas Sargent","We study optimal monetary and fiscal policies in a New Keynesian model with heterogeneous agents, incomplete markets, and nominal rigidities. Our approach uses small‐noise expansions and Fréchet derivatives to approximate equilibria quickly and efficiently. Responses of optimal policies to aggregate shocks differ qualitatively from what they would be in a corresponding representative agent economy and are an order of magnitude larger. A motive to provide insurance that arises from heterogeneity and incomplete markets outweighs price stabilization motives.",https://doi.org/10.3982/ECTA16414
Econometrica,2021,Learning Dynamics in Social Networks,Simon Board and Moritz Meyer‐ter‐Vehn,"This paper proposes a tractable model of Bayesian learning on large random networks where agents choose whether to adopt an innovation. We study the impact of the network structure on learning dynamics and product diffusion. In directed networks, all direct and indirect links contribute to agents' learning. In comparison, learning and welfare are lower in undirected networks and networks with cliques. In a rich class of networks, behavior is described by a small number of differential equations, making the model useful for empirical work.",https://doi.org/10.3982/ECTA18659
Econometrica,2021,Team Players: How Social Skills Improve Team Performance,Ben Weidmann and David Deming,"Most jobs require teamwork. Are some people good team players? In this paper, we design and test a new method for identifying individual contributions to team production. We randomly assign people to multiple teams and predict team performance based on previously assessed individual skills. Some people consistently cause their team to exceed its predicted performance. We call these individuals “team players.” Team players score significantly higher on a well‐established measure of social intelligence, but do not differ across a variety of other dimensions, including IQ, personality, education, and gender. Social skills—defined as a single latent factor that combines social intelligence scores with the team player effect—improve team performance about as much as IQ. We find suggestive evidence that team players increase effort among teammates.",https://doi.org/10.3982/ECTA18461
Econometrica,2021,The Reputation Trap,David Levine,"Few want to do business with a partner who has a bad reputation. Consequently, once a bad reputation is established, it can be difficult to get rid of. This leads on the one hand to the intuitive idea that a good reputation is easy to lose and hard to gain. On the other hand, it can lead to a strong form of history dependence in which a single beneficial or adverse event can cast a shadow over a very long period of time. It gives rise to a reputational trap where an agent rationally chooses not to invest in a good reputation because the chances others will find out is too low. Nevertheless, the same agent with a good reputation will make every effort to maintain it. Here, a simple reputational model is constructed and the conditions for there to be a unique equilibrium that constitutes a reputation trap are characterized.",https://doi.org/10.3982/ECTA17891
Econometrica,2021,Are Poor Cities Cheap for Everyone? Non‐Homotheticity and the Cost of Living Across U.S. Cities,Jessie Handbury,"This paper shows that the products and prices offered in markets are correlated with local income‐specific tastes. To quantify the welfare impact of this variation, I calculate local price indexes micro‐founded by a model of non‐homothetic demand over thousands of grocery products. These indexes reveal large differences in how wealthy and poor households perceive the choice sets available in wealthy and poor cities. Relative to low‐income households, high‐income households enjoy 40 percent higher utility per dollar expenditure in wealthy cities, relative to poor cities. Similar patterns are observed across stores in different neighborhoods. Most of this variation is explained by differences in the product assortment offered, rather than the relative prices charged, by chains that operate in different markets.",https://doi.org/10.3982/ECTA11738
Econometrica,2021,Lumpy Durable Consumption Demand and the Limited Ammunition of Monetary Policy,Alisdair McKay and Johannes Wieland,"The prevailing neo‐Wicksellian view holds that the central bank's objective is to track the natural rate of interest (r*), which itself is largely exogenous to monetary policy. We challenge this view using a fixed‐cost model of durable consumption demand, in which expansionary monetary policy prompts households to accelerate purchases of durable goods. This yields an intertemporal trade‐off in aggregate demand as encouraging households to increase durable holdings today leaves fewer households acquiring durables going forward. Interest rates must be kept low to support demand going forward, so accommodative monetary policy today reduces r* in the future. We show that this mechanism is quantitatively important in explaining the persistently low level of real interest rates and r* after the Great Recession.",https://doi.org/10.3982/ECTA18821
Econometrica,2021,Investment Demand and Structural Change,"Manuel García‐Santana, Josep Pijoan‐Mas and Lucciano Villacorta","We study the joint evolution of the sectoral composition and the investment rate of developing economies. Using panel data for several countries in different stages of development, we document three novel facts: (a) the share of industry and the investment rate are strongly correlated and follow a hump‐shaped profile with development, (b) investment goods contain more domestic value added from industry and less from services than consumption goods do, and (c) the evolution of the sectoral composition of investment and consumption goods differs from the one of GDP. We build a multi‐sector growth model to fit these patterns and provide two important results. First, the hump‐shaped evolution of investment demand explains half of the hump in industry with development. Second, asymmetric sectoral productivity growth helps explain the decline in the relative price of investment goods along the development path, which in turn increases capital accumulation and promotes growth.",https://doi.org/10.3982/ECTA16295
Econometrica,2021,When Moving‐Average Models Meet High‐Frequency Data: Uniform Inference on Volatility,Rui Da and Dacheng Xiu,"We conduct inference on volatility with noisy high‐frequency data. We assume the observed transaction price follows a continuous‐time Itô‐semimartingale, contaminated by a discrete‐time moving‐average noise process associated with the arrival of trades. We estimate volatility, defined as the quadratic variation of the semimartingale, by maximizing the likelihood of a misspecified moving‐average model, with its order selected based on an information criterion. Our inference is uniformly valid over a large class of noise processes whose magnitude and dependence structure vary with sample size. We show that the convergence rate of our estimator dominates n1/4 as noise vanishes, and is determined by the selected order of noise dependence when noise is sufficiently small. Our implementation guarantees positive estimates in finite samples.",https://doi.org/10.3982/ECTA15593
Econometrica,2021,Econometrics for Decision Making: Building Foundations Sketched by Haavelmo and Wald,Charles Manski,"Haavelmo (1944) proposed a probabilistic structure for econometric modeling, aiming to make econometrics useful for decision making. His fundamental contribution has become thoroughly embedded in econometric research, yet it could not answer all the deep issues that the author raised. Notably, Haavelmo struggled to formalize the implications for decision making of the fact that models can at most approximate actuality. In the same period, Wald (1939, 1945) initiated his own seminal development of statistical decision theory. Haavelmo favorably cited Wald, but econometrics did not embrace statistical decision theory. Instead, it focused on study of identification, estimation, and statistical inference. This paper proposes use of statistical decision theory to evaluate the performance of models in decision making. I consider the common practice of as‐if optimization: specification of a model, point estimation of its parameters, and use of the point estimate to make a decision that would be optimal if the estimate were accurate. A central theme is that one should evaluate as‐if optimization or any other model‐based decision rule by its performance across the state space, listing all states of nature that one believes feasible, not across the model space. I apply the theme to prediction and treatment choice. Statistical decision theory is conceptually simple, but application is often challenging. Advancing computation is the primary task to complete the foundations sketched by Haavelmo and Wald.",https://doi.org/10.3982/ECTA17985
Econometrica,2021,Identification at the Zero Lower Bound,Sophocles Mavroeidis,"I show that the zero lower bound (ZLB) on interest rates can be used to identify the causal effects of monetary policy. Identification depends on the extent to which the ZLB limits the efficacy of monetary policy. I propose a simple way to test the efficacy of unconventional policies, modeled via a “shadow rate.” I apply this method to U.S. monetary policy using a three‐equation structural vector autoregressive model of inflation, unemployment, and the Federal Funds rate. I reject the null hypothesis that unconventional monetary policy has no effect at the ZLB, but find some evidence that it is not as effective as conventional monetary policy.",https://doi.org/10.3982/ECTA17388
Econometrica,2021,Exchange Design and Efficiency,Marzena Rostek and Ji Hee Yoon,"Most assets clear independently rather than jointly. This paper presents a model based on the uniform‐price double auction which accommodates arbitrary restrictions on market clearing, including independent clearing across assets (allowed when demand for each asset is contingent only on the price of that asset) and joint market clearing for all assets (required when demand for each asset is contingent on the prices of all assets). Additional trading protocols for traded assets—neutral when the market clears jointly—are generally not redundant innovations, even if all traders participate in all protocols. Multiple trading protocols that clear independently can be designed to be at least as efficient as joint market clearing for all assets. The change in price impact brought by independence in market clearing can overcome the loss of information, and enhance diversification and risk sharing. Except when the market is competitive, market characteristics should guide innovation in trading technology.",https://doi.org/10.3982/ECTA16537
Econometrica,2021,Pairwise Stable Matching in Large Economies,Michael Greinecker and Christopher Kah,"We formulate a stability notion for two‐sided pairwise matching problems with individually insignificant agents in distributional form. Matchings are formulated as joint distributions over the characteristics of the populations to be matched. Spaces of characteristics can be high‐dimensional and need not be compact. Stable matchings exist with and without transfers, and stable matchings correspond precisely to limits of stable matchings for finite‐agent models. We can embed existing continuum matching models and stability notions with transferable utility as special cases of our model and stability notion. In contrast to finite‐agent matching models, stable matchings exist under a general class of externalities.",https://doi.org/10.3982/ECTA16228
Econometrica,2021,Capital Buffers in a Quantitative Model of Banking Industry Dynamics,P. Dean Corbae and Pablo D'Erasmo,"We develop a model of banking industry dynamics to study the quantitative impact of regulatory policies on bank risk‐taking and market structure. Since our model is matched to U.S. data, we propose a market structure where big banks with market power interact with small, competitive fringe banks as well as non‐bank lenders. Banks face idiosyncratic funding shocks in addition to aggregate shocks which affect the fraction of performing loans in their portfolio. A nontrivial bank size distribution arises out of endogenous entry and exit, as well as banks' buffer stock of capital. We show that the model predictions are consistent with untargeted business cycle properties, the bank lending channel, and empirical studies of the role of concentration on financial stability. We find that regulatory policies can have an important impact on banking market structure, which, along with selection effects, can generate changes in allocative efficiency and stability.",https://doi.org/10.3982/ECTA16930
Econometrica,2021,Learning With Heterogeneous Misspecified Models: Characterization and Robustness,J. Aislinn Bohren and Daniel N. Hauser,"This paper develops a general framework to study how misinterpreting information impacts learning. Our main result is a simple criterion to characterize long‐run beliefs based on the underlying form of misspecification. We present this characterization in the context of social learning, then highlight how it applies to other learning environments, including individual learning. A key contribution is that our characterization applies to settings with model heterogeneity and provides conditions for entrenched disagreement. Our characterization can be used to determine whether a representative agent approach is valid in the face of heterogeneity, study how differing levels of bias or unawareness of others' biases impact learning, and explore whether the impact of a bias is sensitive to parametric specification or the source of information. This unified framework synthesizes insights gleaned from previously studied forms of misspecification and provides novel insights in specific applications, as we demonstrate in settings with partisan bias, overreaction, naive learning, and level‐k reasoning.",https://doi.org/10.3982/ECTA15318
Econometrica,2021,Heterogeneous Choice Sets and Preferences,"Levon Barseghyan, Maura Coughlin, Francesca Molinari and Joshua Teitelbaum","We propose a robust method of discrete choice analysis when agents' choice sets are unobserved. Our core model assumes nothing about agents' choice sets apart from their minimum size. Importantly, it leaves unrestricted the dependence, conditional on observables, between choice sets and preferences. We first characterize the sharp identification region of the model's parameters by a finite set of conditional moment inequalities. We then apply our theoretical findings to learn about households' risk preferences and choice sets from data on their deductible choices in auto collision insurance. We find that the data can be explained by expected utility theory with low levels of risk aversion and heterogeneous non‐singleton choice sets, and that more than three in four households require limited choice sets to explain their deductible choices. We also provide simulation evidence on the computational tractability of our method in applications with larger feasible sets or higher‐dimensional unobserved heterogeneity.",https://doi.org/10.3982/ECTA17448
Econometrica,2021,Market Selection and the Information Content of Prices,Alp Atakan and Mehmet Ekmekci,"We study information aggregation when n bidders choose, based on their private information, between two concurrent common‐value auctions. There are ks identical objects on sale through a uniform‐price auction in market s and there are an additional kr objects on auction in market r, which is identical to market s except for a positive reserve price. The reserve price in market r implies that information is not aggregated in this market. Moreover, if the object‐to‐bidder ratio in market s exceeds a certain cutoff, then information is not aggregated in market s either. Conversely, if the object‐to‐bidder ratio is less than this cutoff, then information is aggregated in market s as the market grows arbitrarily large. Our results demonstrate how frictions in one market can disrupt information aggregation in a linked, frictionless market because of the pattern of market selection by imperfectly informed bidders.",https://doi.org/10.3982/ECTA14935
Econometrica,2021,An Axiomatic Model of Persuasion,Alexander M. Jakobsen,"A sender ranks information structures knowing that a receiver processes the information before choosing an action affecting them both. The sender and receiver may differ in their utility functions and/or prior beliefs, yielding a model of dynamic inconsistency when they represent the same individual at two points in time. I take as primitive (i) a collection of preference orderings over all information structures, indexed by menus of acts (the sender's ex ante preferences for information), and (ii) a collection of correspondences over menus of acts, indexed by signals (the receiver's signal‐contingent choice(s) from menus). I provide axiomatic representation theorems characterizing the sender as a sophisticated planner and the receiver as a Bayesian information processor, and show that all parameters can be uniquely identified from the sender's preferences for information. I also establish a series of results characterizing common priors, common utility functions, and intuitive measures of disagreement for these parameters—all in terms of the sender's preferences for information.",https://doi.org/10.3982/ECTA16729
Econometrica,2021,A Model of Scientific Communication,Isaiah Andrews and Jesse Shapiro,"We propose a positive model of empirical science in which an analyst makes a report to an audience after observing some data. Agents in the audience may differ in their beliefs or objectives, and may therefore update or act differently following a given report. We contrast the proposed model with a classical model of statistics in which the report directly determines the payoff. We identify settings in which the predictions of the proposed model differ from those of the classical model, and seem to better match practice.",https://doi.org/10.3982/ECTA18155
Econometrica,2021,Bootstrap With Cluster‐Dependence in Two or More Dimensions,Konrad Menzel,"We propose a bootstrap procedure for data that may exhibit cluster‐dependence in two or more dimensions. The asymptotic distribution of the sample mean or other statistics may be non‐Gaussian if observations are dependent but uncorrelated within clusters. We show that there exists no procedure for estimating the limiting distribution of the sample mean under two‐way clustering that achieves uniform consistency. However, we propose bootstrap procedures that achieve adaptivity with respect to different uniformity criteria. Important cases and extensions discussed in the paper include regression inference, U‐ and V‐statistics, subgraph counts for network data, and non‐exhaustive samples of matched data.",https://doi.org/10.3982/ECTA15383
Econometrica,2021,An Empirical Model of R&D Procurement Contests: An Analysis of the DOD SBIR Program,Vivek Bhattacharya,"Firms and governments often use R&D contests to incentivize suppliers to develop and deliver innovative products. The optimal design of such contests depends on empirical primitives: the cost of research, the uncertainty in outcomes, and the surplus participants capture. Can R&D contests in real‐world settings be redesigned to increase social surplus? I ask this question in the context of the Department of Defense's Small Business Innovation Research program, a multistage R&D contest. I develop a structural model to estimate the primitives from data on R&D and procurement contracts. I find that the optimal design substantially increases social surplus, and simple design changes in isolation (e.g., inviting more contestants) can capture up to half these gains; however, these changes reduce the DOD's own welfare. These results suggest there is substantial scope for improving the design of real‐world contests but that a designer must balance competing objectives.",https://doi.org/10.3982/ECTA16581
Econometrica,2021,Random Evolving Lotteries and Intrinsic Preference for Information,"Faruk Gul, Paulo Natenzon and Wolfgang Pesendorfer","We introduce random evolving lotteries to study preference for non‐instrumental information. Each period, the agent enjoys a flow payoff from holding a lottery that will resolve at the terminal date. We provide a representation theorem for non‐separable risk consumption preferences and use it to characterize agents' attitude to non‐instrumental information. To address applications, we characterize peak‐trough utilities that aggregate trajectories of flow utilities linearly but, in addition, put weight on the best (peak) and worst (trough) lotteries along each path. We show that the model is consistent with recent experimental evidence on attitudes to information, including a preference for gradual arrival of good news and the ostrich effect, that is, decision makers' tendency to prefer information after good news to information after bad news.",https://doi.org/10.3982/ECTA16190
Econometrica,2021,Reconciling Models of Diffusion and Innovation: A Theory of the Productivity Distribution and Technology Frontier,"Jess Benhabib, Jesse Perla and Christopher Tonetti","We study how endogenous innovation and technology diffusion interact to determine the shape of the productivity distribution and generate aggregate growth. We model firms that choose to innovate, adopt technology, or produce with their existing technology. Costly adoption creates a spread between the best and worst technologies concurrently used to produce similar goods. The balance of adoption and innovation determines the shape of the distribution; innovation stretches the distribution, while adoption compresses it. On the balanced growth path, the aggregate growth rate equals the maximum growth rate of innovators. While innovation drives long‐run growth, changes in the adoption environment can influence growth by affecting innovation incentives, either directly, through licensing of excludable technologies, or indirectly, via the option value of adoption.",https://doi.org/10.3982/ECTA15020
Econometrica,2021,What Do Data on Millions of U.S. Workers Reveal About Lifecycle Earnings Dynamics?,"Fatih Guvenen, Fatih Karahan, Serdar Ozkan and Jae Song","We study individual male earnings dynamics over the life cycle using panel data on millions of U.S. workers. Using nonparametric methods, we first show that the distribution of earnings changes exhibits substantial deviations from lognormality, such as negative skewness and very high kurtosis. Further, the extent of these nonnormalities varies significantly with age and earnings level, peaking around age 50 and between the 70th and 90th percentiles of the earnings distribution. Second, we estimate nonparametric impulse response functions and find important asymmetries: Positive changes for high‐income individuals are quite transitory, whereas negative ones are very persistent; the opposite is true for low‐income individuals. Third, we turn to long‐run outcomes and find substantial heterogeneity in the cumulative growth rates of earnings and the total number of years individuals spend nonemployed between ages 25 and 55. Finally, by targeting these rich sets of moments, we estimate stochastic processes for earnings that range from the simple to the complex. Our preferred specification features normal mixture innovations to both persistent and transitory components and includes state‐dependent long‐term nonemployment shocks with a realization probability that varies with age and earnings.",https://doi.org/10.3982/ECTA14603
Econometrica,2021,Whither Formal Contracts?,Raúl Sánchez  de la Sierra,"To measure the benefits of formal contract enforcement for society, I create a market with merchants and buyers, in which buyers can choose whether to buy, and whether to pay. A set of multiple “state‐favored” ethnic groups control the state. I experimentally vary whether formal contracts are required and the composition of buyer‐merchant pairs. The design separately identifies the effect of the contracts on the buyers' incentive to pay and on their incentive to buy. I document two ways in which society limits the benefits of contracts. First, contracts reduce buyer cheating, thus increasing merchants' profits, if, and only if, the merchant is state‐favored. Buyers' beliefs suggest that the merchants can enforce the contracts if, and only if, the merchant is state‐favored. Second, holding constant whether the pair is state‐favored, contracts only influence buyer choices when the buyer and the merchant belong to two, different, state‐favored ethnic groups. Buyers' choices and beliefs confirm that, in that case, the contracts are expected to be enforceable, but they have no effect on buyers' choices because reputation already governs the incentives to cheat within groups. The findings temper the view of the state as independent from society, offer a rationale for why contracts are not adopted, and nuance the notion of state weakness.",https://doi.org/10.3982/ECTA16083
