journal,year,title,authors,abstract,url
Econometrica,2023,"Presidential Address: Demand‐Side Constraints in Development. The Role of Market Size, Trade, and (In)Equality",Pinelopi Goldberg and Tristan Reed,"What is the pathway to development in a world marked by rising economic nationalism and less international integration? This paper answers this question within a framework that emphasizes the role of demand‐side constraints on national development, which is identified with sustained poverty reduction. In this framework, development is linked to the adoption of an increasing returns to scale technology by imperfectly competitive firms that need to pay the fixed setup cost of switching to that technology. Sustained poverty reduction is measured as a continuous decline in the share of the population living below $1.90/day purchasing power parity in 2011 U.S. dollars over a five‐year period. This outcome is affected in a statistically significant and economically meaningful way by domestic market size, which is measured as a function of the income distribution, and international market size, which is measured as a function of legally‐binding provisions to international trade agreements, including the General Agreement on Tariffs and Trade, the World Trade Organization, and 279 preferential trade agreements. Counterfactual estimates suggest that, in the absence of international integration, the average resident of a low‐ or lower‐middle‐income country does not live in a market large enough to experience sustained poverty reduction. Domestic redistribution targeted towards generating a larger middle class can partially compensate for the lack of an international market.",https://doi.org/10.3982/ECTA20787
Econometrica,2023,"A Comment on: “Presidential Address: Demand‐Side Constraints in Development. The Role of Market Size, Trade, and (In)Equality” by Pinelopi Koujianou Goldberg and Tristan Reed",Tim Bresnahan,,https://doi.org/10.3982/ECTA22218
Econometrica,2023,"A Comment on: “Presidential Address: Demand‐Side Constraints in Development: The Role of Market Size, Trade, and (In)Equality” by Pinelopi Koujianou Goldberg and Tristan Reed",Paula Bustos,,https://doi.org/10.3982/ECTA22318
Econometrica,2023,"A Comment on: “Presidential Address: Demand‐Side Constraints in Development: The Role of Market Size, Trade, and (In)Equality,” by Pinelopi Koujianou Goldberg and Tristan Reed",Dani Rodrik,,https://doi.org/10.3982/ECTA22088
Econometrica,2023,"Reply to: Comments on “Presidential Address: Demand‐Side Constraints in Development. The Role of Market Size, Trade, and (In)Equality”",Pinelopi Goldberg and Tristan Reed,,https://doi.org/10.3982/ECTA22251
Econometrica,2023,Algorithmic Mechanism Design With Investment,"Mohammad Akbarpour, Scott Kominers, Kevin Michael Li, Shengwu Li and Paul Milgrom",We study the investment incentives created by truthful mechanisms that allocate resources using approximation algorithms. Some approximation algorithms guarantee nearly 100% of the optimal welfare in the allocation problem but guarantee nothing when accounting for investment incentives. An algorithm's allocative and investment guarantees coincide if and only if its confirming negative externalities are sufficiently small. We introduce fast approximation algorithms for the knapsack problem that have no confirming negative externalities and guarantees close to 100% for both allocation and investment.,https://doi.org/10.3982/ECTA19559
Econometrica,2023,Price Setting With Strategic Complementarities as a Mean Field Game,"Fernando Alvarez, Francesco Lippi and Panagiotis Souganidis","We study the propagation of monetary shocks in a sticky‐price general equilibrium economy where the firms' pricing strategy features a complementarity with the decisions of other firms. In a dynamic equilibrium, the firm's price‐setting decisions depend on aggregates, which in turn depend on the firms' decisions. We cast this fixed‐point problem as a Mean Field Game and prove several analytic results. We establish existence and uniqueness of the equilibrium and characterize the impulse response function (IRF) of output following an aggregate shock. We prove that strategic complementarities make the IRF larger at each horizon. We establish that complementarities may give rise to an IRF with a hump‐shaped profile. As the complementarity becomes large enough, the IRF diverges, and at a critical point there is no equilibrium. Finally, we show that the amplification effect of the strategic interactions is similar across models: the Calvo model and the Golosov–Lucas model display a comparable amplification, in spite of the fact that the non‐neutrality in Calvo is much larger.",https://doi.org/10.3982/ECTA20797
Econometrica,2023,An Adversarial Approach to Structural Estimation,"Tetsuya Kaji, Elena Manresa and Guillaume Pouliot","We propose a new simulation‐based estimation method, adversarial estimation, for structural models. The estimator is formulated as the solution to a minimax problem between a generator (which generates simulated observations using the structural model) and a discriminator (which classifies whether an observation is simulated). The discriminator maximizes the accuracy of its classification while the generator minimizes it. We show that, with a sufficiently rich discriminator, the adversarial estimator attains parametric efficiency under correct specification and the parametric rate under misspecification. We advocate the use of a neural network as a discriminator that can exploit adaptivity properties and attain fast rates of convergence.",https://doi.org/10.3982/ECTA18707
Econometrica,2023,The Cross‐Sectional Implications of the Social Discount Rate,Maya Eden,"In this paper, I consider two normative questions: (1) how should policymakers approach tradeoffs that involve different age groups, and (2) at what rate should policymakers discount the consumption of future generations? I demonstrate that, under standard assumptions, these two questions are equivalent: caring more about the future means caring less about the elderly. Even small differences between the social discount rate and the market interest rate can have significant quantitative implications for the relative value placed on the consumption of different age groups.",https://doi.org/10.3982/ECTA20844
Econometrica,2023,Tail Risk in Production Networks,Ian Dew‐Becker,"This paper describes the response of the economy to large shocks in a nonlinear production network. A sector's tail centrality measures how a large negative shock transmits to GDP, that is, the systemic risk of the sector. Tail centrality is theoretically and empirically very different from local centrality measures such as sales share—in a benchmark case, it is measured as a sector's average downstream closeness to final production. It also measures how large differences in sector productivity can generate cross‐country income differences. The paper also uses the results to analyze the determinants of total tail risk in the economy. Increases in interconnectedness can simultaneously reduce the sensitivity of the economy to small shocks while increasing the sensitivity to large shocks. Tail risk is related to conditional granularity, where some sectors become highly influential following negative shocks.",https://doi.org/10.3982/ECTA21064
Econometrica,2023,Same Root Different Leaves: Time Series and Cross‐Sectional Methods in Panel Data,"Dennis Shen, Peng Ding, Jasjeet Sekhon and Bin Yu","One dominant approach to evaluate the causal effect of a treatment is through panel data analysis, whereby the behaviors of multiple units are observed over time. The information across time and units motivates two general approaches: (i) horizontal regression (i.e., unconfoundedness), which exploits time series patterns, and (ii) vertical regression (e.g., synthetic controls), which exploits cross‐sectional patterns. Conventional wisdom often considers the two approaches to be different. We establish this position to be partly false for estimation but generally true for inference. In the absence of any assumptions, we show that both approaches yield algebraically equivalent point estimates for several standard estimators. However, the source of randomness assumed by each approach leads to a distinct estimand and quantification of uncertainty even for the same point estimate. This emphasizes that researchers should carefully consider where the randomness stems from in their data, as it has direct implications for the accuracy of inference.",https://doi.org/10.3982/ECTA21248
Econometrica,2023,Nonrandom Exposure to Exogenous Shocks,Kirill Borusyak and Peter Hull,We develop a new approach to estimating the causal effects of treatments or instruments that combine multiple sources of variation according to a known formula. Examples include treatments capturing spillovers in social or transportation networks and simulated instruments for policy eligibility. We show how exogenous shocks to some—but not all—determinants of such variables can be leveraged while avoiding omitted variables bias. Our solution involves specifying counterfactual shocks that may as well have been realized and adjusting for a summary measure of nonrandomness in shock exposure: the average treatment (or instrument) across shock counterfactuals. We use this approach to address bias when estimating employment effects of market access growth from Chinese high‐speed rail construction.,https://doi.org/10.3982/ECTA19367
Econometrica,2023,Estimation Based on Nearest Neighbor Matching: From Density Ratio to Average Treatment Effect,"Zhexiao Lin, Peng Ding and Fang Han","Nearest neighbor (NN) matching is widely used in observational studies for causal effects. Abadie and Imbens (2006) provided the first large‐sample analysis of NN matching. Their theory focuses on the case with the number of NNs, M fixed. We reveal something new out of their study and show that once allowing M to diverge with the sample size an intrinsic statistic in their analysis constitutes a consistent estimator of the density ratio with regard to covariates across the treated and control groups. Consequently, with a diverging M, the NN matching with Abadie and Imbens' (2011) bias correction yields a doubly robust estimator of the average treatment effect and is semiparametrically efficient if the density functions are sufficiently smooth and the outcome model is consistently estimated. It can thus be viewed as a precursor of the double machine learning estimators.",https://doi.org/10.3982/ECTA20598
Econometrica,2023,Urban Growth and Its Aggregate Implications,Gilles Duranton and Diego Puga,"We develop an urban growth model where human capital spillovers foster entrepreneurship and learning in heterogeneous cities. Incumbent residents limit city expansion through planning regulations so that commuting and housing costs do not outweigh productivity gains from agglomeration. The model builds on strong microfoundations, matches key regularities at the city and economy‐wide levels, and generates novel predictions for which we provide evidence. It can be quantified by relying on few parameters and gives us a basis to estimate them. We examine counterfactuals relaxing planning regulations or constraining city growth to assess the effect of cities on economic growth and aggregate output.",https://doi.org/10.3982/ECTA17936
Econometrica,2023,Rethinking the Welfare State,"Nezih Guner, Remzi Kaygusuz and Gustavo Ventura","The United States spends significant amounts on non‐medical transfers for its working‐age population in a wide range of programs that support low‐ and middle‐income households. How valuable are these programs for U.S. households? Are there simpler, welfare‐improving ways to transfer resources that are supported by a majority? What are the macroeconomic effects of such alternatives? We answer these questions in an equilibrium, life‐cycle model with single and married households who face idiosyncratic productivity risk, in the presence of costly children and potential skill losses of females associated with non‐participation. Our findings show that a potential revenue‐neutral elimination of the welfare state generates large welfare losses in the aggregate, although most households support the move as losses are concentrated among a small group. We find that a Universal Basic Income program does not improve upon the current system. If, instead, per‐person transfers are implemented alongside a proportional tax, a Negative Income Tax experiment, it becomes feasible to improve upon the current system. Providing per‐person transfers to all households is costly, and reducing tax distortions helps to provide for resources to expand redistribution.",https://doi.org/10.3982/ECTA19921
Econometrica,2023,Mixed Strategies in the Indefinitely Repeated Prisoner's Dilemma,Julian Romero and Yaroslav Rosokha,"Identifying the strategies that are played is critical to understanding behavior in repeated games. This process is difficult because only choices (not strategies) are observable. Recently, a debate has emerged regarding whether subjects play mixed strategies in the indefinitely repeated prisoner's dilemma. We use an experimental approach to elicit mixed strategies from human subjects, thereby providing direct empirical evidence. We find that a majority of subjects use mixed strategies. However, the data also suggest subjects' strategies are becoming less mixed over time, and move toward three focal pure strategies: Tit For Tat, Grim Trigger, and Always Defect. We use the elicited strategies to provide an empirically‐relevant foundation for analyzing commonly used mixture model estimation procedures.",https://doi.org/10.3982/ECTA17482
Econometrica,2023,Intertemporal Hedging and Trade in Repeated Games With Recursive Utility,Asen Kochov and Yangwei Song,"Two key features distinguish the general class of recursive preferences from the standard model of dynamic choice: (i) agents may care about the intertemporal distribution of risk, and (ii) their rates of time preference, rather than being fixed, may vary with the level of consumption. We investigate what these features imply in the context of a repeated strategic interaction. First, we show that opportunities for intertemporal trade may expand the set of feasible payoffs relative to that in a static interaction. Two distinct sources for such trade are identified: endogenous heterogeneity in the players' rates of time preference and a hedging motive pertaining to the intertemporal distribution of risk. The set of equilibrium payoffs may on the other hand shrink drastically as many efficient outcomes become unsustainable no matter the level of patience. This “antifolk” result occurs when the players prefer stage outcomes to be positively correlated rather than independent across time. Intuitively, such preferences make it inefficient to offset short‐term losses with future gains, while this is needed to ensure that security levels are met on path. We also establish a folk theorem: if security levels are met on path, such play can be sustained in a subgame perfect equilibrium provided that the players are sufficiently patient.",https://doi.org/10.3982/ECTA17756
Econometrica,2023,Corporate Tax Cuts and the Decline in the Manufacturing Labor Share,Baris Kaymak and Immo Schott,"We document a strong empirical connection between corporate taxation and the manufacturing labor share, both in the US and across OECD countries. Our estimates associate 30 to 60% of the observed decline in labor shares with the fall in corporate taxation. Using an equilibrium model of an industry where firms differ in their capital intensities, we show that lower corporate tax rates reduce the labor share by raising the market share of capital‐intensive firms. The tax elasticity of the labor share depends on the joint distribution of labor intensities and value added at the micro level. Given the empirical distribution in the US manufacturing sector, our quantitative analysis suggests that corporate tax cuts explain a significant part of the decline in the manufacturing labor share since the 1950s. The shift away from traditionally large, labor‐intensive production units raised the concentration of market shares and reduced the concentration of employment.",https://doi.org/10.3982/ECTA17702
Econometrica,2023,The Anatomy of Sorting—Evidence From Danish Data,"Rasmus Lentz, Suphanit Piyapromdee and Jean‐Marc Robin","In this paper, we formulate and estimate a flexible model of job mobility and wages with two‐sided heterogeneity. The analysis extends the finite mixture approach of Bonhomme, Lamadon, and Manresa (2019) and Abowd, McKinney, and Schmutte (2019) to develop a new Classification Expectation‐Maximization algorithm that ensures both worker and firm latent‐type identification using wage and mobility variations in the data. Workers receive job offers in worker‐type segmented labor markets. Offers are accepted according to a logit form that compares the value of the current job with that of the new job. In combination with flexibly estimated layoff and job finding rates, the analysis quantifies the four different sources of sorting: job preferences, segmentation, layoffs, and job finding. Job preferences are identified through job‐to‐job moves in a revealed preference argument. They are in the model structurally independent of the identified job wages, possibly as a reflection of the presence of amenities. We find evidence of a strong pecuniary motive in job preferences. While the correlation between preferences and current job wages is positive, the net present value of the future earnings stream given the current job correlates much more strongly with preferences for it. This is more so for short‐ than long‐tenure workers. In the analysis, we distinguish between type sorting and wage sorting. Type sorting is quantified by means of the mutual information index. Wage sorting is captured through correlation between identified wage types. While layoffs are less important than the other channels, we find all channels to contribute substantially to sorting. As workers age, job arrival processes are the key determinant of wage sorting, whereas the role of job preferences dictate type sorting. Over the life cycle, job preferences intensify, type sorting increases, and pecuniary considerations wane.",https://doi.org/10.3982/ECTA16425
Econometrica,2023,"A Comment on: “Low Interest Rates, Market Power, and Productivity Growth”","Craig A. Chikis, Jonathan Goldberg and David López‐Salido","Using an endogenous growth model, Liu, Mian, and Sufi (2022) (LMS) show that a decline in the interest rate can lead to a fall in productivity growth and a rise in leader‐laggard productivity gaps and firm profits. We identify two issues in their quantitative analysis of transition dynamics: a time‐scale error and the omission of composition terms in calculating productivity growth along the transition to a new balanced growth path. Correcting the time‐scale error and including the composition terms, the decline in the interest rate that LMS study leads to a large and protracted productivity boom lasting about 20 years. In addition, the average leader‐laggard gap grows much more slowly than reported in their paper. We also point out an issue in their quantitative analysis of steady‐state profit shares. These issues are related to the quantitative exercises, and do not affect the key theoretical contributions of LMS.",https://doi.org/10.3982/ECTA20621
Econometrica,2023,Regret‐Minimizing Project Choice,Yingni Guo and Eran Shmaya,"An agent observes the set of available projects and proposes some, but not necessarily all, of them. A principal chooses one or none from the proposed set. We solve for a mechanism that minimizes the principal's worst‐case regret. We compare the single‐project environment in which the agent can propose only one project with the multiproject environment in which he can propose many. In both environments, if the agent proposes one project, it is chosen for sure if the principal's payoff is sufficiently high; otherwise, the probability that it is chosen decreases in the agent's payoff. In the multiproject environment, the agent's payoff from proposing multiple projects equals his maximal payoff from proposing each project alone. The multiproject environment outperforms the single‐project one by providing better fallback options than rejection and by delivering this payoff to the agent more efficiently.",https://doi.org/10.3982/ECTA20157
Econometrica,2023,Selection Into Credit Markets: Evidence From Agriculture in Mali,"Lori Beaman, Dean Karlan, Bram Thuysbaert and Christopher Udry","We use a two‐stage experiment on agricultural lending in Mali to test whether selection into lending is predictive of heterogeneous returns to capital. Understanding this heterogeneity, and the selection process which reveals it, is critical for guiding modeling of credit markets in developing countries, as well as for policy. We find such heterogeneity: returns to capital are higher for farmers who borrow than for those who do not. In our first stage, we offer loans in some villages and not others. In the second stage, we provide cash grants to a random subset of all farmers in villages where no loans were offered, and to a random subset of the farmers who do not borrow in villages where loans were offered. We estimate seasonal returns to the grant of 130% for would‐be borrowers, whereas we find returns near zero for the sample representative of non‐borrowers. We also provide evidence that there are some farmers—particularly those that are poor at baseline—that have high returns but do not receive a loan.",https://doi.org/10.3982/ECTA18916
Econometrica,2023,Infinite Debt Rollover in Stochastic Economies,Narayana Kocherlakota,"This paper shows that there is more scope for a borrower to engage in a sustainable infinite debt rollover (a “Ponzi scheme”) when interest/growth rates are stochastic. In this context, I prove that the relevant “r vs. g” comparison uses the yield rlong to an infinite‐maturity zero‐coupon bond. I show that rlong is lower than the risk‐neutral expectation of the short‐term yield when it is variable, and that rlong is close to the minimal realization of the short‐term yield when it is highly persistent. The paper applies these results to illustrative heterogeneous agent dynamic stochastic general equilibrium models to obtain similarly weakened sufficient conditions for the existence of public debt bubbles.",https://doi.org/10.3982/ECTA21090
Econometrica,2023,The Investment Effects of Market Integration: Evidence From Renewable Energy Expansion in Chile,"Luis Edwin Gonzales Carrasco, Koichiro Ito and Mar Reguant","We study the investment effects of market integration on renewable energy expansion. Our theory highlights that market integration not only improves allocative efficiency by gains from trade but also incentivizes new investment in renewable power plants. To test our theoretical predictions, we examine how recent grid expansions in the Chilean electricity market changed electricity production, wholesale prices, generation costs, and renewable investments. We then build a structural model of power plant entry to quantify the impact of market integration with and without the investment effects. We find that the market integration in Chile increased solar generation by around 180%, saved generation costs by 8%, and reduced carbon emissions by 5%. A substantial amount of renewable entry would not have occurred in the absence of market integration. Our findings suggest that ignoring these investment effects would substantially understate the benefits of market integration and its important role in expanding renewable energy.",https://doi.org/10.3982/ECTA20769
Econometrica,2023,What Can Time‐Series Regressions Tell Us About Policy Counterfactuals?,Alisdair McKay and Christian Wolf,"We show that, in a general family of linearized structural macroeconomic models, knowledge of the empirically estimable causal effects of contemporaneous and news shocks to the prevailing policy rule is sufficient to construct counterfactuals under alternative policy rules. If the researcher is willing to postulate a loss function, our results furthermore allow her to recover an optimal policy rule for that loss. Under our assumptions, the derived counterfactuals and optimal policies are robust to the Lucas critique. We then discuss strategies for applying these insights when only a limited amount of empirical causal evidence on policy shock transmission is available.",https://doi.org/10.3982/ECTA21045
Econometrica,2023,Monitoring versus Discounting in Repeated Games,Takuo Sugaya and Alexander Wolitzky,"We study how discounting and monitoring jointly determine whether cooperation is possible in repeated games with imperfect (public or private) monitoring. Our main result provides a simple bound on the strength of players' incentives as a function of discounting, monitoring precision, and on‐path payoff variance. We show that the bound is tight in the low‐discounting/low‐monitoring double limit, by establishing a public‐monitoring folk theorem where the discount factor and the monitoring structure can vary simultaneously.",https://doi.org/10.3982/ECTA20206
