journal,year,title,authors,abstract,url
Econometrica,2023,Mitigating Disaster Risks in the Age of Climate Change,"Harrison Hong, Neng Wang and Jinqiang Yang","Emissions abatement alone cannot address the consequences of global warming for weather disasters. We model how society adapts to manage disaster risks to capital stock. Optimal adaptation—a mix of firm‐level efforts and public spending—varies as society learns about the adverse consequences of global warming for disaster arrivals. Taxes on capital are needed alongside those on carbon to achieve the first best. We apply our model to country‐level control of flooding from tropical cyclones. Learning rationalizes empirical findings, including the responses of Tobin's q, equity risk premium, and risk‐free rate to disaster arrivals. Adaptation is more valuable under learning than a counterfactual no‐learning environment. Learning alters social‐cost‐of‐carbon projections due to the interaction of uncertainty resolution and endogenous adaptive response.",https://doi.org/10.3982/ECTA20442
Econometrica,2023,A Quantitative Theory of the Credit Score,"Satyajit Chatterjee, P. Dean Corbae, Kyle Dempsey and José‐Víctor Ríos‐Rull","What is the role of credit scores in credit markets? We argue that it is, in part, the market's assessment of a person's unobservable type, which here we take to be patience. We postulate a model of persistent hidden types where observable actions shape the public assessment of a person's type via Bayesian updating. We show how dynamic reputation can incentivize repayment. Importantly, we show how an economy with credit scores implements the same equilibrium allocation. We estimate the model using both credit market data and the evolution of individuals' credit scores. We conduct counterfactuals to assess how more or less information used in scoring individuals affects outcomes and welfare. If tracking of individual credit actions is outlawed, poor young adults of low type benefit from subsidization by high types despite facing higher interest rates arising from lower dynamic incentives to repay.",https://doi.org/10.3982/ECTA18771
Econometrica,2023,Platform Design When Sellers Use Pricing Algorithms,"Justin P. Johnson, Andrew Rhodes and Matthijs Wildenbeest","We investigate the ability of a platform to design its marketplace to promote competition, improve consumer surplus, and increase its own payoff. We consider demand‐steering rules that reward firms that cut prices with additional exposure to consumers. We examine the impact of these rules both in theory and by using simulations with artificial intelligence pricing algorithms (specifically Q‐learning algorithms, which are commonly used in computer science). Our theoretical results indicate that these policies (which require little information to implement) can have strongly beneficial effects, even when sellers are infinitely patient and seek to collude. Similarly, our simulations suggest that platform design can benefit consumers and the platform, but that achieving these gains may require policies that condition on past behavior and treat sellers in a nonneutral fashion. These more sophisticated policies disrupt the ability of algorithms to rotate demand and split industry profits, leading to low prices.",https://doi.org/10.3982/ECTA19978
Econometrica,2023,The Macro Impact of Short‐Termism,Stephen Terry,"R&D investment reduces current profits, so short‐term pressure to hit profit targets may distort R&D. In the data, firms just meeting Wall Street forecasts have lower R&D growth and subsequent innovation, while managers just missing receive lower pay. But short‐termist distortions might not quantitatively matter if aggregation or equilibrium dampen their impact. So I build and estimate a quantitative endogenous growth model in which short‐termism arises naturally as discipline on conflicted managers and boosts firm value by about 1%. But short‐termism reduces R&D, and the social return to R&D is higher than the private return due to standard channels including knowledge spillovers and imperfect competition. So at the macro level, short‐termist distortions slow growth by 5 basis points yearly and lower social welfare by about 1%.",https://doi.org/10.3982/ECTA15420
Econometrica,2023,Ideology and Performance in Public Organizations,"Jörg Spenkuch, Edoardo Teso and Guo Xu","We combine personnel records of the United States federal bureaucracy from 1997 to 2019 with administrative voter registration data to study how ideological alignment between politicians and bureaucrats affects turnover and performance. We document significant partisan cycles and turnover among political appointees. By contrast, we find no political cycles in the civil service. At any point in time, a sizable share of bureaucrats is ideologically misaligned with their political leaders. We study the performance implications of this misalignment for the case of procurement officers. Exploiting presidential transitions as a source of “within‐bureaucrat” variation in political alignment, we find that procurement contracts overseen by misaligned officers exhibit greater cost overruns and delays. We provide evidence consistent with a general “morale effect,” whereby misaligned bureaucrats are less motivated to pursue the organizational mission. Our results thus help to shed some of the first light on the costs of ideological misalignment within public organizations.",https://doi.org/10.3982/ECTA20355
Econometrica,2023,Scaling Auctions as Insurance: A Case Study in Infrastructure Procurement,Valentin Bolotnyy and Shoshana Vasserman,"Most U.S. government spending on highways and bridges is done through “scaling” procurement auctions, in which private construction firms submit unit price bids for each piece of material required to complete a project. Using data on bridge maintenance projects undertaken by the Massachusetts Department of Transportation (MassDOT), we present evidence that firm bidding behavior in this context is consistent with optimal skewing under risk aversion: firms limit their risk exposure by placing lower unit bids on items with greater uncertainty. We estimate the amount of uncertainty in each auction, and the distribution of bidders' private costs and risk aversion. Simulating equilibrium item‐level bids under counterfactual settings, we estimate the fraction of project spending that is due to risk and evaluate auction mechanisms under consideration by policymakers. We find that scaling auctions provide substantial savings relative to lump sum auctions and show how our framework can be used to evaluate alternative auction designs.",https://doi.org/10.3982/ECTA17673
Econometrica,2023,General Equilibrium Effects of (Improving) Public Employment Programs: Experimental Evidence From India,"Karthik Muralidharan, Paul Niehaus and Sandip Sukhtankar","Public employment programs may affect poverty both directly through the income they provide and indirectly through general equilibrium effects. We estimate both effects, exploiting a reform that improved the implementation of India's National Rural Employment Guarantee Scheme (NREGS) and whose rollout was randomized at a large (sub‐district) scale. The reform raised beneficiary households' earnings by 14%, and reduced poverty by 26%. Importantly, 86% of income gains came from non‐program earnings, driven by higher private‐sector (real) wages and employment. This pattern appears to reflect imperfectly competitive labor markets more than productivity gains: worker's reservation wages increased, land returns fell, and employment gains were higher in villages with more concentrated landholdings. Non‐agricultural enterprise counts and employment grew rapidly despite higher wages, consistent with a role for local demand in structural transformation. These results suggest that public employment programs can effectively reduce poverty in developing countries, and may also improve economic efficiency.",https://doi.org/10.3982/ECTA18181
Econometrica,2023,The Effect of Macroeconomic Uncertainty on Firm Decisions,"Saten Kumar, Yuriy Gorodnichenko and Olivier Coibion","Using a new survey of firms in New Zealand, we document how exogenous variation in the macroeconomic uncertainty perceived by firms affects their economic decisions. We use randomized information treatments that provide different types of information about the first and/or second moments of future economic growth to generate exogenous changes in the perceived macroeconomic uncertainty of some firms. The effects on their decisions relative to their initial plans as well as relative to an untreated control group are measured in a follow‐up survey six months later. We find that as firms become more uncertain, they reduce their prices, employment, and investment, their sales decline, and they become less likely to invest in new technologies or open new facilities. These ex post effects of uncertainty are similar to how firms say they would respond to higher uncertainty when asked hypothetical questions.",https://doi.org/10.3982/ECTA21004
Econometrica,2023,Robust Inference on Infinite and Growing Dimensional Time‐Series Regression,Abhimanyu Gupta and Myung Hwan Seo,"We develop a class of tests for time‐series models such as multiple regression with growing dimension, infinite‐order autoregression, and nonparametric sieve regression. Examples include the Chow test and general linear restriction tests of growing rank p. Employing such increasing p asymptotics, we introduce a new scale correction to conventional test statistics, which accounts for a high‐order long‐run variance (HLV), which emerges as p grows with sample size. We also propose a bias correction via a null‐imposed bootstrap to alleviate finite‐sample bias without sacrificing power unduly. A simulation study shows the importance of robustifying testing procedures against the HLV even when p is moderate. The tests are illustrated with an application to the oil regressions in Hamilton (2003).",https://doi.org/10.3982/ECTA17918
Econometrica,2023,Dynamic Information Provision: Rewarding the Past and Guiding the Future,Ian Ball,"I study the optimal provision of information in a long‐term relationship between a sender and a receiver. The sender observes a persistent, evolving state and commits to send signals over time to the receiver, who sequentially chooses public actions that affect the welfare of both players. I solve for the sender's optimal policy in closed form: the sender reports the value of the state with a delay that shrinks over time and eventually vanishes. Even when the receiver knows the current state, the sender retains leverage by threatening to conceal the future evolution of the state.",https://doi.org/10.3982/ECTA17345
Econometrica,2023,Testing Hurwicz Expected Utility,"Han Bleichrodt, Simon Grant and Jingni Yang","Gul and Pesendorfer (2015) propose a promising theory of decision under uncertainty, they dub Hurwicz expected utility (HEU). HEU is a special case of α‐maxmin EU that allows for preferences over sources of uncertainty. It is consistent with most of the available empirical evidence on decision under risk and uncertainty. We show that HEU is also tractable and can readily be measured and tested. We do this by deriving a new two‐parameter functional form for the probability weighting function, which fits our data well and which offers a clean separation between ambiguity perception and ambiguity aversion. In two experiments, we find support for HEU's predictions that ambiguity aversion is constant across sources of uncertainty and that ambiguity aversion and first order risk aversion are positively correlated.",https://doi.org/10.3982/ECTA19221
Econometrica,2023,"Networks, Phillips Curves, and Monetary Policy",Elisa Rubbo,"This paper revisits the New Keynesian framework, theoretically and quantitatively, in an economy with multiple sectors and input‐output linkages. Analytical expressions for the Phillips curve and welfare, derived as a function of primitives, show that the slope of all sectoral and aggregate Phillips curves is decreasing in intermediate input shares, while productivity fluctuations endogenously generate an inflation‐output tradeoff—except when inflation is measured according to the novel divine coincidence index. Consistent with the theory, the divine coincidence index provides a better fit in Phillips curve regressions than consumer prices. Monetary policy can no longer achieve the first‐best, resulting in a welfare loss of 2.9% of per‐period GDP under the constrained‐optimal policy, which increases to 3.8% when targeting consumer inflation. The constrained‐optimal policy must tolerate relative price distortions across firms and sectors in order to stabilize the output gap, and it can be implemented via a Taylor rule that targets the divine coincidence index.",https://doi.org/10.3982/ECTA18654
Econometrica,2023,Growing Like India—the Unequal Effects of Service‐Led Growth,"Tianyu Fan, Michael Peters and Fabrizio Zilibotti","Structural transformation in most currently developing countries takes the form of a rapid rise in services but limited industrialization. In this paper, we propose a new methodology to structurally estimate productivity growth in service industries that circumvents the notorious difficulties in measuring quality improvements. In our theory, the expansion of the service sector is both a consequence—due to income effects—and a cause—due to productivity growth—of the development process. We estimate the model using Indian household data. We find that productivity growth in nontradable consumer services such as retail, restaurants, or residential real estate was an important driver of structural transformation and rising living standards between 1987 and 2011. However, the welfare gains were heavily skewed toward high‐income urban dwellers.",https://doi.org/10.3982/ECTA20964
Econometrica,2023,A Theory of Simplicity in Games and Mechanism Design,Marek Pycia and Peter Troyan,"We study extensive‐form games and mechanisms allowing agents that plan for only a subset of future decisions they may be called to make (the planning horizon). Agents may update their so‐called strategic plan as the game progresses and new decision points enter their planning horizon. We introduce a family of simplicity standards which require that the prescribed action leads to unambiguously better outcomes, no matter what happens outside the planning horizon. We employ these standards to explore the trade‐off between simplicity and other objectives, to characterize simple mechanisms in a wide range of economic environments, and to delineate the simplicity of common mechanisms such as posted prices and ascending auctions, with the former being simpler than the latter.",https://doi.org/10.3982/ECTA16310
Econometrica,2023,Sequential Veto Bargaining With Incomplete Information,"S. Nageeb Ali, Navin Kartik and Andreas Kleiner","We study sequential bargaining between a proposer and a veto player. Both have single‐peaked preferences, but the proposer is uncertain about the veto player's ideal point. The proposer cannot commit to future proposals. When players are patient, there can be equilibria with Coasian dynamics: the veto player's private information can largely nullify proposer's bargaining power. Our main result, however, is that under some conditions there also are equilibria in which the proposer obtains the high payoff that he would with commitment power. The driving force is that the veto player's single‐peaked preferences give the proposer an option to “leapfrog,” that is, to secure agreement from only low‐surplus types early on to credibly extract surplus from high types later. Methodologically, we exploit the connection between sequential bargaining and static mechanism design.",https://doi.org/10.3982/ECTA20658
Econometrica,2023,Online Corrigendum to “Social Media and Protest Participation: Evidence From Russia”,"Ruben Enikolopov, Alexey Makarin and Maria Petrova",,https://doi.org/10.3982/ECTA20824
Econometrica,2023,Corrigendum: Long‐Term Contracting With Time‐Inconsistent Agents,"Alex Citanna, Daniel Gottlieb, Paolo Siconolfi and Xingtan Zhang",,https://doi.org/10.3982/ECTA21301
Econometrica,2023,Corrigendum: A Preferred‐Habitat Model of the Term Structure of Interest Rates,Dimitri Vayanos and Jean‐Luc Vila,,https://doi.org/10.3982/ECTA21596
Econometrica,2023,Erratum to “Savage's P3 is Redundant”,Gabriel Frahm and Lorenz Hartmann,,https://doi.org/10.3982/ECTA21641
Econometrica,2023,Equilibrium Effects of Pay Transparency,Zoë B. Cullen and Bobak Pakzad‐Hurson,"The discourse around pay transparency has focused on partial equilibrium effects: how workers rectify pay inequities through informed renegotiation. We investigate how employers respond in equilibrium. We study a model of bargaining under two‐sided incomplete information. Our model predicts that transparency reduces the individual bargaining power of workers, leading to lower average wages. A key insight is that employers credibly refuse to pay high wages to any one worker to avoid costly renegotiations with others. When workers have low individual bargaining power, pay transparency has a muted effect. We test our model with an event‐study analysis of U.S. state‐level laws protecting the right of private sector workers to communicate salary information with their coworkers. Consistent with our theoretical predictions, transparency laws empirically lead wages to decline by approximately 2%, and wage declines are smallest in magnitude when workers have low individual bargaining power.",https://doi.org/10.3982/ECTA19788
Econometrica,2023,The Welfare Effects of Encouraging Rural–Urban Migration,"David Lagakos, Ahmed Mushfiq Mobarak and Michael Waugh","This paper studies the welfare effects of encouraging rural–urban migration in the developing world. To do so, we build and analyze a dynamic general‐equilibrium model of migration that features a rich set of migration motives. We estimate the model to replicate the results of a field experiment that subsidized seasonal migration in rural Bangladesh, leading to significant increases in migration and consumption. We show that the welfare gains from migration subsidies come from providing better insurance for vulnerable rural households rather than from correcting spatial misallocation by relaxing credit constraints for those with high productivity in urban areas that are stuck in rural areas.",https://doi.org/10.3982/ECTA15962
Econometrica,2023,Equilibrium Effects of Food Labeling Policies,"Nano Barahona, Cristóbal Otero and Sebastián Otero","We study a regulation in Chile that mandates warning labels on products whose sugar or caloric concentration exceeds certain thresholds. We show that consumers substitute from labeled to unlabeled products—a pattern mostly driven by products that consumers mistakenly believe to be healthy. On the supply side, we find substantial reformulation of products and bunching at the thresholds. We develop and estimate an equilibrium model of demand for food and firms' pricing and nutritional choices. We find that food labels increase consumer welfare by 1.8% of total expenditure, and that these effects are enhanced by firms' responses. We then use the model to study alternative policy designs. Under optimal policy thresholds, food labels and sugar taxes generate similar gains in consumer welfare, but food labels benefit the poor relatively more.",https://doi.org/10.3982/ECTA19603
Econometrica,2023,Financial Frictions and the Wealth Distribution,"Jesús Fernández‐Villaverde, Samuel Hurtado and Galo Nuño Barrau","We postulate a continuous‐time heterogeneous agent model with a financial sector and households to study the nonlinear linkages between aggregate and financial variables. In our model, the interaction between the supply of bonds by the financial sector and the precautionary demand for bonds by households produces significant endogenous aggregate risk. This risk makes the economy transition between a high‐leverage region and a low‐leverage region, which, in turn, creates state dependence in impulse responses: the same shock starting from the high‐leverage region gets propagated and amplified more than when the shock arrives when leverage is low. State dependence in impulse responses generates a time‐varying aggregate precautionary savings motive that, by moving the risk‐free rate, justifies the leverage level of the financial sector in each region. Finally, we illustrate the usefulness of neutral networks to solve for the nonlinear perceived law of motion of the model, and the importance of household heterogeneity in driving its quantitative properties.",https://doi.org/10.3982/ECTA18180
Econometrica,2023,Searching for Job Security and the Consequences of Job Loss,Gregor Jarosch,"Job loss comes with large present value earnings losses which elude workhorse models of unemployment and labor market policy. I propose a parsimonious model of a frictional labor market in which jobs differ in terms of unemployment risk and workers search off‐ and on‐the‐job. This gives rise to a job ladder with slippery bottom rungs where unemployment spells beget unemployment spells. I allow for human capital to respond to time spent out of work and estimate the framework on German Social Security data. The model captures the joint response of wages, employment, and unemployment risk to job loss which I measure empirically. The key driver of the “unemployment scar” is the loss in job security and its interaction with the evolution of human capital and, in particular, the search for better employment.",https://doi.org/10.3982/ECTA14008
Econometrica,2023,A Sieve‐SMM Estimator for Dynamic Models,Jean‐Jacques Forneron,"This paper proposes a Sieve Simulated Method of Moments (Sieve‐SMM) estimator for the parameters and the distribution of the shocks in nonlinear dynamic models where the likelihood and the moments are not tractable. An important concern with SMM, which matches sample with simulated moments, is that a parametric distribution is required. However, economic quantities that depend on this distribution, such as welfare and asset prices, can be sensitive to misspecification. The Sieve‐SMM estimator addresses this issue by flexibly approximating the distribution of the shocks with a Gaussian and tails mixture sieve. The asymptotic framework provides consistency, rate of convergence, and asymptotic normality results, extending existing results to a new framework with more general dynamics and latent variables. An application to asset pricing in a production economy shows a large decline in the estimates of relative risk aversion, highlighting the empirical relevance of misspecification bias.",https://doi.org/10.3982/ECTA17068
Econometrica,2023,Decomposing the Growth of Top Wealth Shares,Matthieu Gomez,"What drives the dynamics of top wealth inequality? To answer this question, I propose an accounting framework that decomposes the growth of the share of aggregate wealth owned by a top percentile into three terms: a within term, which is the average wealth growth of individuals initially in the top percentile relative to the economy; a between term, which accounts for individuals entering and exiting the top percentile due to changes in their relative wealth rankings; and a demography term, which accounts for individuals entering or exiting the top percentile due to death and population growth. I obtain closed‐form expressions for each term in a wide range of random growth models. Evidence from the Forbes 400 list suggests that the between term accounts for half of the recent rise in top wealth inequality.",https://doi.org/10.3982/ECTA16755
Econometrica,2023,Relational Contracts: Public versus Private Savings,Francesc Dilme and Daniel F. Garrett,"Work on relational employment agreements often predicts low payments or termination for poor performance. The possibility of saving can, however, limit the effectiveness of monetary incentives in motivating an employee with diminishing marginal utility for consumption. We study the role of savings and their observability in optimal relational contracts. We focus on the case where players are not too patient, and hence the constant first‐best effort cannot be implemented. If savings are hidden, the relationship eventually deteriorates over time. In particular, both payments and effort decline. On the other hand, if savings are public, consumption is initially high, so the agent's savings fall over time, and effort and payments to the agent increase. The findings thus suggest how tacit agreements on consumption can forestall the deterioration of dynamic relationships in which the agent can save.",https://doi.org/10.3982/ECTA18742
