journal,year,title,authors,abstract,url
Journal of Finance,2026,Dynamic Trading with Realization Utility,"Min Dai, Cong Qin and Neng Wang","An investor receives utility bursts from realizing gains and losses at the individual stock level and dynamically allocates his mental budget between risky and risk‐free assets at the trading account level. Using savings, he reduces his stockholdings and is more willing to realize losses. Using leverage, he increases his stockholdings beyond his mental budget and is more reluctant to realize losses. While leverage strengthens the disposition effect, introducing leverage constraints mitigates it. Our model predicts that investors with stocks in deep losses sell them either immediately or after stocks rebound a little.",https://doi.org/10.1111/jofi.13472
Journal of Finance,2026,Adverse Selection in Corporate Loan Markets,"Mehdi Beyhaghi, Cesare Fracassi and Gregory Weitzner","Theories of competition typically predict a positive relationship between market concentration and prices. However, in loan markets, adverse selection can reverse this relationship as riskier borrowers become more likely to receive funding. Using supervisory data, we show that interest rates, borrower risk, and lending volume are higher in markets with more banks. We also create a novel measure of markup that is orthogonal to borrower risk, and find that, consistent with adverse selection, markups are higher after repeated borrowing relationships. Finally, we use a shock to large banks' lending costs to provide further support for the adverse selection channel.",https://doi.org/10.1111/jofi.70011
Journal of Finance,2026,An Economic View of Corporate Social Impact,"Hunt Allcott, Giovanni Montanari, Bora Ozaltun and Brandon Tan","Growing discussions of impact investing and stakeholder capitalism have increased interest in measuring companies' social impact. We conceptualize corporate social impact as the welfare loss that would be caused by a firm's exit. To illustrate, we quantify the social impacts of 74 firms in 12 industries using a new survey measuring consumer and worker substitution patterns combined with models of product and labor markets. We find that consumer surplus is the primary component of social impact, suggesting that consumer impacts deserve more attention from impact investors. Existing environmental, social, and governance (ESG) and social impact ratings are essentially unrelated to our economically grounded measures.",https://doi.org/10.1111/jofi.70004
Journal of Finance,2026,Subtle Discrimination,Elena S. Pikulina and Daniel Ferreira,"We introduce the concept of subtle discrimination—biased acts that cannot be objectively ascertained as discriminatory. When candidates compete for promotions by investing in skills, firms' subtle biases induce discriminated candidates to overinvest when promotions are low‐stakes (to distinguish themselves from favored candidates) but underinvest in high‐stakes settings (anticipating low promotion probabilities). This asymmetry implies that subtle discrimination raises profits in low‐productivity firms but lowers them in high‐productivity firms. Although subtle biases are small, they generate large gaps in skills and promotion outcomes. We derive further predictions in contexts such as equity analysis, lending, fund flows, banking careers, and entrepreneurial finance.",https://doi.org/10.1111/jofi.13506
Journal of Finance,2026,Losing Control? The Two‐Decade Decline in Loan Covenant Violations,"Thomas P. Griffin, Greg Nini and David C. Smith","The annual proportion of U.S. public firms that reported a financial covenant violation fell roughly 70% between 1997 and 2019. To understand this trend, we develop an estimable model of covenant design that depends on the ability to differentiate between distressed and nondistressed borrowers and the relative costs associated with screening incorrectly. We find that the drop in violations is best explained by an increased willingness to forgo early detection of distressed borrowers in exchange for fewer inconsequential violations, which we attribute largely to a shift in the composition of public borrowers and partly to heightened investor sentiment during the 2010s.",https://doi.org/10.1111/jofi.70005
Journal of Finance,2026,Investment under Upstream and Downstream Uncertainty,Fotis Grigoris and Gill Segal,"The impact of uncertainty shocks on firm‐level economic activity depends on their origin in supply chains. Upstream (downstream) uncertainty from suppliers (customers) is associated with variability over future input (output) prices. Consequently, a real‐option production model with time‐to‐build suggests that only upstream uncertainty suppresses investment, since upstream (downstream) uncertainty affects the shorter (longer) run. Production network data show that upstream uncertainty negatively affects firm‐level outcomes. Conversely, downstream uncertainty affects firm‐level outcomes more weakly but positively. At the macro level, these two uncertainties oppositely predict aggregate growth and asset prices. Overall, downstream uncertainty has an expansionary effect, in contrast to other facets of uncertainty.",https://doi.org/10.1111/jofi.70010
Journal of Finance,2026,Going Public and the Internal Organization of the Firm,"Daniel Bias, Benjamin Lochner, Stefan Obernberger and Merih Sevilir","This paper examines how initial public offerings (IPOs) affect firms' internal organization. We find that IPO firms become more hierarchical and standardized organizations, characterized by additional layers, more managers, smaller control spans, and larger administrative functions. These changes occur mostly in preparation for the IPO and can be only partially explained by growth. IPO firms with greater human capital risk experience larger hierarchical changes. Hierarchical changes help firms standardize employee roles and formalize internal processes. Our results suggest that firms reorganize to reduce their dependence on key individuals' human capital when transitioning to public markets.",https://doi.org/10.1111/jofi.70012
Journal of Finance,2026,Second Chance: Life with Less Student Debt,"Marco Di Maggio, Ankit Kalda and Vincent Yao","We exploit an episode of plausibly random debt discharge due to the loss of paperwork for thousands of defaulted borrowers to examine the effects of private student debt relief on borrower outcomes. We find that borrowers who receive debt relief (treated) experience declines in debt balances and delinquency rates on other accounts, and increases in mobility and income relative to those who bear the costs of default like wage garnishment and collections (control). Borrowers in both groups contribute to our findings through different mechanisms. While our estimates may not directly apply to blanket student loan forgiveness, they speak to the benefits of forgiveness in reducing the consequences of debt burden for distressed borrowers.",https://doi.org/10.1111/jofi.70002
