journal,year,title,authors,abstract,url
Journal of Finance,2020,Local Crowding‐Out in China,"Yi Huang, Marco Pagano and Ugo Panizza","In China, between 2006 and 2013, local public debt crowded out the investment of private firms by tightening their funding constraints while leaving state‐owned firms' investment unaffected. We establish this result using a purpose‐built data set for Chinese local public debt. Private firms invest less in cities with more public debt, with the reduction in investment larger for firms located farther from banks in other cities or more dependent on external funding. Moreover, in cities where public debt is high, private firms' investment is more sensitive to internal cash flow.",https://doi.org/10.1111/jofi.12966
Journal of Finance,2020,"Every Cloud Has a Silver Lining: Fast Trading, Microwave Connectivity, and Trading Costs",Andriy Shkilko and Konstantin Sokolov,"Modern markets are characterized by speed differentials, with some traders being fractions of a second faster than others. Theoretical models suggest that such differentials may have both positive and negative effects on liquidity and gains from trade. We examine these effects by studying a series of exogenous weather episodes that temporarily remove the speed advantages of the fastest traders by disrupting their microwave networks. The disruptions are associated with lower adverse selection and lower trading costs. In additional analysis, we show that the long‐term removal of speed differentials results in similar effects and also increases gains from trade.",https://doi.org/10.1111/jofi.12969
Journal of Finance,2020,Credit Rating Inflation and Firms' Investments,Itay Goldstein and Chong Huang,"We analyze credit rating effects on firm investments in a rational bond financing game that features a feedback loop. The credit rating agency (CRA) inflates the rating, providing a biased but informative signal to creditors. Creditors' response to the rating affects the firm's investment decision and thus its credit quality, which is reflected in the rating. The CRA might reduce ex ante economic efficiency, which results solely from its strategic effect: the CRA assigns more firms high ratings and allows them to gamble for resurrection. We derive empirical predictions on the determinants of rating standards and inflation and discuss policy implications.",https://doi.org/10.1111/jofi.12961
Journal of Finance,2020,Safety Transformation and the Structure of the Financial System,William Diamond,"This paper studies how a financial system that is organized to efficiently create safe assets responds to macroeconomic shocks. Financial intermediaries face a cost of bearing risk, so they choose the least risky portfolio that backs their issuance of riskless deposits: a diversified pool of nonfinancial firms' debt. Nonfinancial firms choose their capital structure to exploit the resulting segmentation between debt and equity markets. Increased safe asset demand yields larger and riskier intermediaries and more levered firms. Quantitative easing reduces the size and riskiness of intermediaries and can decrease firm leverage, despite reducing borrowing costs at the zero lower bound.",https://doi.org/10.1111/jofi.12967
Journal of Finance,2020,The Forced Safety Effect: How Higher Capital Requirements Can Increase Bank Lending,Saleem Bahaj and Frederic Malherbe,"Government guarantees generate an implicit subsidy for banks. A capital requirement reduces this subsidy, through a simple liability composition effect. However, the guarantees also make a bank undervalue loans that generates surplus in states of the world in which it defaults. Raising the capital requirement makes the bank safer, which alleviates this problem. We refer to this mechanism, which we argue is empirically relevant, as the forced safety effect.",https://doi.org/10.1111/jofi.12958
Journal of Finance,2020,Monetary Policy and Global Banking,Falk Bräuning and Victoria Ivashina,"When central banks adjust interest rates, the opportunity cost of lending in local currency changes, but—absent frictions—there is no spillover effect to lending in other currencies. However, when equity capital is limited, global banks must benchmark domestic and foreign lending opportunities. We show that, in equilibrium, the marginal return on foreign lending is affected by the interest rate differential, with lower domestic rates leading to an increase in local lending, at the expense of a reduction in foreign lending. We test our prediction in the context of changes in interest rates in six major currency areas.",https://doi.org/10.1111/jofi.12959
Journal of Finance,2020,"Sovereign Debt Portfolios, Bond Risks, and the Credibility of Monetary Policy","Wenxin Du, Carolin E. Pflueger and Jesse Schreger","We document that governments whose local currency debt provides them with greater hedging benefits actually borrow more in foreign currency. We introduce two features into a government's debt portfolio choice problem to explain this finding: risk‐averse lenders and lack of monetary policy commitment. A government without commitment chooses excessively countercyclical inflation ex post, which leads risk‐averse lenders to require a risk premium ex ante. This makes local currency debt too expensive from the government's perspective and thereby discourages the government from borrowing in its own currency.",https://doi.org/10.1111/jofi.12965
Journal of Finance,2020,The Employment Effects of Faster Payment: Evidence from the Federal Quickpay Reform,Jean‐noël Barrot and Ramana Nanda,"We study the impact of Quickpay, a reform that permanently accelerated payments to small business contractors of the U.S. government. We find a strong direct effect of the reform on employment growth at the firm level. However, we document substantial crowding out of nontreated firms' employment within local labor markets. While the overall net employment effect is positive, it is close to zero in tight labor markets. Our results highlight an important channel for alleviating financing constraints in small firms, but emphasize the general‐equilibrium effects of large‐scale interventions, which can lead to lower aggregate outcomes depending on labor market conditions.",https://doi.org/10.1111/jofi.12955
Journal of Finance,2020,Stock Market Returns and Consumption,"Marco Di Maggio, Amir Kermani and Kaveh Majlesi",This paper employs Swedish data on households' stock holdings to investigate how consumption responds to changes in stock market returns. We instrument the actual capital gains and dividend payments with past portfolio weights. Unrealized capital gains lead to a marginal propensity to consume of 23% for the bottom 50% of the wealth distribution and about 3% for the top 30% of the wealth distribution. Household consumption is significantly more responsive to dividend payouts across all parts of the wealth distribution. Our findings are consistent with households treating capital gains and dividends as separate sources of income.,https://doi.org/10.1111/jofi.12968
Journal of Finance,2020,Measuring Mutual Fund Flow Pressure as Shock to Stock Returns,Malcolm Wardlaw,"A large and rapidly growing literature examines the impact of misvaluation on firm policies by using mutual fund outflow‐induced price pressure to isolate nonfundamental price variation. I demonstrate that the standard approach to computing outflow‐induced price pressure produces a measure that is inadvertently a direct function of a stock's actual realized return during the outflow quarter, raising doubts about its orthogonality to fundamentals. After removing these direct measurements of return, outflows generate a fairly negligible quarterly decline in returns, with no subsequent reversal, and many established results in this literature no longer hold. I provide suggestions for future analysis.",https://doi.org/10.1111/jofi.12962
Journal of Finance,2020,AMERICAN FINANCE ASSOCIATION,Laura Starks,,https://doi.org/10.1111/jofi.12985
Journal of Finance,2020,"No Job, No Money, No Refi: Frictions to Refinancing in a Recession",Anthony DeFusco and John Mondragon,"We study how employment documentation requirements and out‐of‐pocket closing costs constrain mortgage refinancing. These frictions, which bind most severely during recessions, may significantly inhibit monetary policy pass‐through. To study their effects on refinancing, we exploit a Federal Housing Administration policy change that excluded unemployed borrowers from refinancing and increased others' out‐of‐pocket costs substantially. These changes dramatically reduced refinancing rates, particularly among the likely unemployed and those facing new out‐of‐pocket costs. Our results imply that unemployed and liquidity‐constrained borrowers have a high latent demand for refinancing. Cyclical variation in these factors may therefore affect both the aggregate and distributional consequences of monetary policy.",https://doi.org/10.1111/jofi.12952
Journal of Finance,2020,"Bad Credit, No Problem? Credit and Labor Market Consequences of Bad Credit Reports","Will Dobbie, Paul Goldsmith‐pinkham, Neale Mahoney and Jae Song","We study the financial and labor market impacts of bad credit reports. Using difference‐in‐differences variation from the staggered removal of bankruptcy flags, we show that bankruptcy flag removal leads to economically large increases in credit limits and borrowing. Using administrative tax records linked to personal bankruptcy records, we estimate economically small effects of flag removal on employment and earnings outcomes. We rationalize these contrasting results by showing that, conditional on basic observables, “hidden” bankruptcy flags are strongly correlated with adverse credit market outcomes but have no predictive power for measures of job performance.",https://doi.org/10.1111/jofi.12954
Journal of Finance,2020,Declining Labor and Capital Shares,Simcha Barkai,"This paper presents direct measures of capital costs, equal to the product of the required rate of return on capital and the value of the capital stock. The capital share, equal to the ratio of capital costs and gross value added, does not offset the decline in the labor share. Instead, a large increase in the share of pure profits offsets declines in the shares of both labor and capital. Industry data show that increases in concentration are associated with declines in the labor share.",https://doi.org/10.1111/jofi.12909
Journal of Finance,2020,The Banking View of Bond Risk Premia,Valentin Haddad and David Sraer,"Banks' balance sheet exposure to fluctuations in interest rates strongly forecasts excess Treasury bond returns. This result is consistent with optimal risk management, a banking counterpart to the household Euler equation. In equilibrium, the bond risk premium compensates banks for bearing fluctuations in interest rates. When banks' exposure to interest rate risk increases, the price of this risk simultaneously rises. We present a collection of empirical observations that support this view, but also discuss several challenges to this interpretation.",https://doi.org/10.1111/jofi.12949
Journal of Finance,2020,False (and Missed) Discoveries in Financial Economics,Campbell Harvey and Yan Liu,"Multiple testing plagues many important questions in finance such as fund and factor selection. We propose a new way to calibrate both Type I and Type II errors. Next, using a double‐bootstrap method, we establish a t‐statistic hurdle that is associated with a specific false discovery rate (e.g., 5%). We also establish a hurdle that is associated with a certain acceptable ratio of misses to false discoveries (Type II error scaled by Type I error), which effectively allows for differential costs of the two types of mistakes. Evaluating current methods, we find that they lack power to detect outperforming managers.",https://doi.org/10.1111/jofi.12951
Journal of Finance,2020,The Mismatch Between Mutual Fund Scale and Skill,Yang Song,I demonstrate that skill and scale are mismatched among actively managed equity mutual funds. Many mutual fund investors confuse the effects of fund exposures to common systematic factors with managerial skill when allocating capital among funds. Active mutual funds with positive factor‐related past returns thus accumulate assets to the point that they significantly underperform. I also show that the negative aggregate benchmark‐adjusted performance of active equity mutual funds is driven mainly by these oversized funds.,https://doi.org/10.1111/jofi.12950
Journal of Finance,2020,Price and Probability: Decomposing the Takeover Effects of Anti‐Takeover Provisions,"Vicente Cuñat, Mireia Giné and Maria Guadalupe","We study the effects of anti‐takeover provisions (ATPs) on the takeover probability, the takeover premium, and target selection. Voting to remove an ATP increases both the takeover probability and the takeover premium, that is, there is no evidence of a trade‐off between premiums and takeover probabilities. We provide causal estimates based on shareholder proposals to remove ATPs and address the endogenous selection of targets through bounding techniques. The positive premium effect in less protected firms is driven by better bidder‐target matching and merger synergies.",https://doi.org/10.1111/jofi.12908
Journal of Finance,2020,The Causal Effect of Limits to Arbitrage on Asset Pricing Anomalies,"Yongqiang Chu, David Hirshleifer and Liang Ma","We examine the causal effect of limits to arbitrage on 11 well‐known asset pricing anomalies using the pilot program of Regulation SHO, which relaxed short‐sale constraints for a quasi‐random set of pilot stocks, as a natural experiment. We find that the anomalies became weaker on portfolios constructed with pilot stocks during the pilot period. The pilot program reduced the combined anomaly long–short portfolio returns by 72 basis points per month, a difference that survives risk adjustment with standard factor models. The effect comes only from the short legs of the anomaly portfolios.",https://doi.org/10.1111/jofi.12947
Journal of Finance,2020,Low‐Risk Anomalies?,"Paul Schneider, Christian Wagner and Josef Zechner","This paper shows that low‐risk anomalies in the capital asset pricing model and in traditional factor models arise when investors require compensation for coskewness risk. Empirically, we find that option‐implied ex ante skewness is strongly related to ex post residual coskewness, which allows us to construct coskewness factor‐mimicking portfolios. Controlling for skewness renders the alphas of betting‐against‐beta and betting‐against‐volatility insignificant. We also show that the returns of beta‐ and volatility‐sorted portfolios are driven largely by a single principal component, which in turn is explained largely by skewness.",https://doi.org/10.1111/jofi.12910
Journal of Finance,2020,Market Structure and Transaction Costs of Index CDSs,"Pierre Collin‐dufresne, Benjamin Junge and Anders B. Trolle","Despite regulatory efforts to promote all‐to‐all trading, the post–Dodd‐Frank index credit default swap market remains two‐tiered. Transaction costs are higher for dealer‐to‐client than interdealer trades, but the difference is explained by the higher, largely permanent, price impact of client trades. Most interdealer trades are liquidity motivated and executed via low‐cost, low‐immediacy trading protocols. Dealer‐to‐client trades are nonanonymous; they almost always improve upon contemporaneous executable interdealer quotes, and dealers appear to price discriminate based on the perceived price impact of trades. Our results suggest that the market structure is a consequence of the characteristics of client trades: relatively infrequent, large, and differentially informed.",https://doi.org/10.1111/jofi.12953
Journal of Finance,2020,The Impact of Supervision on Bank Performance,"Beverly Hirtle, Anna Kovner and Matthew Plosser","We explore the impact of supervision on the riskiness, profitability, and growth of U.S. banks. Using data on supervisors' time use, we demonstrate that the top‐ranked banks by size within a supervisory district receive more attention from supervisors, even after controlling for size, complexity, risk, and other characteristics. Using a matched sample approach, we find that these top‐ranked banks that receive more supervisory attention hold less risky loan portfolios, are less volatile, and are less sensitive to industry downturns, but do not have lower growth or profitability. Our results underscore the distinct role of supervision in mitigating banking sector risk.",https://doi.org/10.1111/jofi.12964
Journal of Finance,2020,A Macrofinance View of U.S. Sovereign CDS Premiums,"Mikhail Chernov, Lukas Schmid and Andres Schneider","Premiums on U.S. sovereign credit default swaps (CDS) have risen to persistently elevated levels since the financial crisis. We examine whether these premiums reflect the probability of a fiscal default—a state in which a balanced budget can no longer be restored by raising taxes or eroding the real value of debt by increasing inflation. We develop an equilibrium macrofinance model in which the fiscal and monetary policy stances jointly endogenously determine nominal debt, taxes, inflation, and growth. We show that the CDS premiums reflect the endogenous risk‐adjusted probabilities of fiscal default. The calibrated model is consistent with elevated levels of CDS premiums but leaves dynamic implications quantitatively unresolved.",https://doi.org/10.1111/jofi.12948
Journal of Finance,2020,Presidential Address: Social Transmission Bias in Economics and Finance,David Hirshleifer,"I discuss a new intellectual paradigm, social economics and finance—the study of the social processes that shape economic thinking and behavior. This emerging field recognizes that people observe and talk to each other. A key, underexploited building block of social economics and finance is social transmission bias: systematic directional shift in signals or ideas induced by social transactions. I use five “fables” (models) to illustrate the novelty and scope of the transmission bias approach, and offer several emergent themes. For example, social transmission bias compounds recursively, which can help explain booms, bubbles, return anomalies, and swings in economic sentiment.",https://doi.org/10.1111/jofi.12906
Journal of Finance,2020,Political Connections and the Informativeness of Insider Trades,"Alan D. Jagolinzer, David F. Larcker, Gaizka Ormazabal and Daniel J. Taylor","We analyze the trading of corporate insiders at leading financial institutions during the 2007 to 2009 financial crisis. We find strong evidence of a relation between political connections and informed trading during the period in which Troubled Asset Relief Program (TARP) funds were disbursed, and that the relation is most pronounced among corporate insiders with recent direct connections. Notably, we find evidence of abnormal trading by politically connected insiders 30 days in advance of TARP infusions, and that these trades anticipate the market reaction to the infusion. Our results suggest that political connections can facilitate opportunistic behavior by corporate insiders.",https://doi.org/10.1111/jofi.12899
Journal of Finance,2020,Do CEOs Matter? Evidence from Hospitalization Events,"Morten Bennedsen, Francisco Pérez‐gonzález and Daniel Wolfenzon","Using variation in firms’ exposure to their CEOs resulting from hospitalization, we estimate the effect of chief executive officers (CEOs) on firm policies, holding firm‐CEO matches constant. We document three main findings. First, CEOs have a significant effect on profitability and investment. Second, CEO effects are larger for younger CEOs, in growing and family‐controlled firms, and in human‐capital‐intensive industries. Third, CEOs are unique: the hospitalization of other senior executives does not have similar effects on the performance. Overall, our findings demonstrate that CEOs are a key driver of firm performance, which suggests that CEO contingency plans are valuable.",https://doi.org/10.1111/jofi.12897
Journal of Finance,2020,Is Bitcoin Really Untethered?,John M. Griffin and Amin Shams,"This paper investigates whether Tether, a digital currency pegged to the U.S. dollar, influenced Bitcoin and other cryptocurrency prices during the 2017 boom. Using algorithms to analyze blockchain data, we find that purchases with Tether are timed following market downturns and result in sizable increases in Bitcoin prices. The flow is attributable to one entity, clusters below round prices, induces asymmetric autocorrelations in Bitcoin, and suggests insufficient Tether reserves before month‐ends. Rather than demand from cash investors, these patterns are most consistent with the supply‐based hypothesis of unbacked digital money inflating cryptocurrency prices.",https://doi.org/10.1111/jofi.12903
Journal of Finance,2020,What Matters to Individual Investors? Evidence from the Horse's Mouth,James Choi and Adriana Z. Robertson,"We survey a representative sample of U.S. individuals about how well leading academic theories describe their financial beliefs and decisions. We find substantial support for many factors hypothesized to affect portfolio equity share, particularly background risk, investment horizon, rare disasters, transactional factors, and fixed costs of stock market participation. Individuals tend to believe that past mutual fund performance is a good signal of stock‐picking skill, actively managed funds do not suffer from diseconomies of scale, value stocks are safer and do not have higher expected returns, and high‐momentum stocks are riskier and do have higher expected returns.",https://doi.org/10.1111/jofi.12895
Journal of Finance,2020,The Value of Central Clearing,Guillaume Vuillemey,"I study a contracting innovation that suddenly insulated traders of hedging contracts against counterparty risk: central clearing counterparties (CCPs) for derivatives. The first CCP was created in Le Havre (France) in 1882, in the coffee futures market. Using triple difference‐in‐differences estimation, I show that central clearing changed the geography of trade flows Europe‐wide, to the benefit of Le Havre. Inspecting the mechanism using trader‐level data, I find that the CCP solved both a “missing market” problem and adverse selection issues. Central clearing also facilitated entry of new traders in the market. The successful contracting innovation quickly spread to other exchanges.",https://doi.org/10.1111/jofi.12902
Journal of Finance,2020,Informational Frictions and the Credit Crunch,Olivier Darmouni,"In this paper, I estimate the magnitude of an informational friction limiting credit reallocation to firms during the 2007 to 2009 financial crisis. Because lenders rely on private information when deciding which relationship to end, borrowers looking for a new lender are adversely selected. I show how to separately identify private information from information common to all lenders but unobservable to the econometrician by using bank shocks within a discrete choice model of relationships. Quantitatively, these informational frictions appear to be too small to explain the credit crunch in the U.S. syndicated corporate loan market.",https://doi.org/10.1111/jofi.12900
Journal of Finance,2020,Debt Contracting on Management,"Brian Akins, David de Angelis and Maclean Gaulin","Change of management restrictions (CMRs) in loan contracts give lenders explicit ex ante control rights over managerial retention and selection. This paper shows that lenders use CMRs to mitigate risks arising from CEO turnover, especially those related to the loss of human capital and replacement uncertainty, thereby providing evidence that human capital risk affects debt contracting. With a CMR in place, the likelihood of CEO turnover decreases by more than half, and future firm performance improves when retention frictions are important, suggesting that lenders can influence managerial turnover, even outside of default states, and help the borrower retain talent.",https://doi.org/10.1111/jofi.12893
Journal of Finance,2020,"Bank Quality, Judicial Efficiency, and Loan Repayment Delays in Italy","Fabio Schiantarelli, Massimiliano Stacchini and Philip E. Strahan","Italian firms delay payment to banks weakened by past loan losses. Exploiting Credit Register data, we fully absorb borrower fundamentals with firm‐quarter effects. Identification therefore reflects firm choices to delay payment to some banks, depending on their health. This selective delay occurs more where legal enforcement of collateral recovery is slow. Poor enforcement encourages borrowers not to pay when the value of their bank relationship comes into doubt. Selective delays occur even by firms able to pay all lenders. Credit losses in Italy have thus been worsened by the combination of weak banks and weak legal enforcement.",https://doi.org/10.1111/jofi.12896
